"Authors","Author full names","Author(s) ID","Title","Year","Source title","Volume","Issue","Art. No.","Page start","Page end","Page count","Cited by","DOI","Link","Document Type","Publication Stage","Open Access","Source","EID"
"Chen W.; Wang S.; Long G.; Yao L.; Sheng Q.Z.; Li X.","Chen, Weitong (56477550000); Wang, Sen (55919171700); Long, Guodong (55522990400); Yao, Lina (54406102800); Sheng, Quan Z. (57208669610); Li, Xue (35183610900)","56477550000; 55919171700; 55522990400; 54406102800; 57208669610; 35183610900","Dynamic Illness Severity Prediction via Multi-task RNNs for Intensive Care Unit","2018","Proceedings - IEEE International Conference on Data Mining, ICDM","2018-November","","8594920","917","922","5","28","10.1109/ICDM.2018.00111","https://www.scopus.com/inward/record.uri?eid=2-s2.0-85061367599&doi=10.1109%2fICDM.2018.00111&partnerID=40&md5=6e78e6807d1c323eadc42d111dff3550","Conference paper","Final","","Scopus","2-s2.0-85061367599"
"Lahrichi S.; Rhanoui M.; Mikram M.; Asri B.E.","Lahrichi, Sofia (57226495950); Rhanoui, Maryem (55351723600); Mikram, Mounia (23397604200); Asri, Bouchra El (6504757785)","57226495950; 55351723600; 23397604200; 6504757785","Toward a multimodal multitask model for neurodegenerative diseases diagnosis and progression prediction","2021","Proceedings of the 10th International Conference on Data Science, Technology and Applications, DATA 2021","","","","322","328","6","1","10.5220/0010600003220328","https://www.scopus.com/inward/record.uri?eid=2-s2.0-85111735908&doi=10.5220%2f0010600003220328&partnerID=40&md5=1f255250606020cc06dfdc4c73cc29c0","Conference paper","Final","All Open Access; Green Open Access; Hybrid Gold Open Access","Scopus","2-s2.0-85111735908"
"Spathis D.; Servia-Rodriguez S.; Farrahi K.; Mascolo C.; Rentfrow J.","Spathis, Dimitris (56458782500); Servia-Rodriguez, Sandra (55135807400); Farrahi, Katayoun (25926993400); Mascolo, Cecilia (6701533742); Rentfrow, Jason (6602274526)","56458782500; 55135807400; 25926993400; 6701533742; 6602274526","Sequence multi-task learning to forecast mental wellbeing from sparse self-reported data","2019","Proceedings of the ACM SIGKDD International Conference on Knowledge Discovery and Data Mining","","","","2886","2894","8","20","10.1145/3292500.3330730","https://www.scopus.com/inward/record.uri?eid=2-s2.0-85071199270&doi=10.1145%2f3292500.3330730&partnerID=40&md5=43ac89fb1b16081e00aa18b59a252085","Conference paper","Final","All Open Access; Green Open Access","Scopus","2-s2.0-85071199270"
"","","","23rd Pacific-Asia Conference on Knowledge Discovery and Data Mining, PAKDD 2019","2019","Lecture Notes in Computer Science (including subseries Lecture Notes in Artificial Intelligence and Lecture Notes in Bioinformatics)","11439 LNAI","","","","","553","0","","https://www.scopus.com/inward/record.uri?eid=2-s2.0-85064930382&partnerID=40&md5=91a077b67100d7e3c614f3ef8582d643","Conference review","Final","","Scopus","2-s2.0-85064930382"
"Qiu M.; Zhao P.; Zhang K.; Huang J.; Shi X.; Wang X.; Chu W.","Qiu, Minghui (55537463100); Zhao, Peilin (36445134800); Zhang, Ke (57201213633); Huang, Jun (57199287007); Shi, Xing (58436237100); Wang, Xiaoguang (55586907500); Chu, Wei (57198886369)","55537463100; 36445134800; 57201213633; 57199287007; 58436237100; 55586907500; 57198886369","A short-term rainfall prediction model using multi-task convolutional neural networks","2017","Proceedings - IEEE International Conference on Data Mining, ICDM","2017-November","","","395","404","9","110","10.1109/ICDM.2017.49","https://www.scopus.com/inward/record.uri?eid=2-s2.0-85043994635&doi=10.1109%2fICDM.2017.49&partnerID=40&md5=4718f322c300074eae8f27d2b7fe6b07","Conference paper","Final","","Scopus","2-s2.0-85043994635"
"","","","European Conference on Machine Learning and Principles and Practice of Knowledge Discovery in Databases, ECML PKDD 2021","2021","Lecture Notes in Computer Science (including subseries Lecture Notes in Artificial Intelligence and Lecture Notes in Bioinformatics)","12976 LNAI","","","","","3508","0","","https://www.scopus.com/inward/record.uri?eid=2-s2.0-85115685784&partnerID=40&md5=5dfb7bdadbfd0fdf981672ba36a99405","Conference review","Final","","Scopus","2-s2.0-85115685784"
"Zhuang Z.; Wei C.; Li B.; Xu P.; Guo Y.; Ren J.","Zhuang, Zhaoyi (25625851100); Wei, Chen (58405758200); Li, Bing (57221074942); Xu, Peng (57189042051); Guo, Yifei (57030883700); Ren, Jiachang (57208499917)","25625851100; 58405758200; 57221074942; 57189042051; 57030883700; 57208499917","Performance Prediction Model Based on Multi-Task Learning and Co-Evolutionary Strategy for Ground Source Heat Pump System","2019","IEEE Access","7","","8807178","117925","117933","8","2","10.1109/ACCESS.2019.2936508","https://www.scopus.com/inward/record.uri?eid=2-s2.0-85097261296&doi=10.1109%2fACCESS.2019.2936508&partnerID=40&md5=78eb6bf14ed37ac6452952572f2669c3","Article","Final","All Open Access; Gold Open Access","Scopus","2-s2.0-85097261296"
"","","","Workshops held at the 16th European Conference on Computer Vision, ECCV 2020","2020","Lecture Notes in Computer Science (including subseries Lecture Notes in Artificial Intelligence and Lecture Notes in Bioinformatics)","12535 LNCS","","","","","4363","0","","https://www.scopus.com/inward/record.uri?eid=2-s2.0-85101313387&partnerID=40&md5=510543b94401cc39711759bb03984922","Conference review","Final","","Scopus","2-s2.0-85101313387"
"Ma T.; Tan Y.","Ma, Tao (57218310455); Tan, Ying (56098810800)","57218310455; 56098810800","Multiple Stock Time Series Jointly Forecasting with Multi-Task Learning","2020","Proceedings of the International Joint Conference on Neural Networks","","","9207543","","","","9","10.1109/IJCNN48605.2020.9207543","https://www.scopus.com/inward/record.uri?eid=2-s2.0-85093837506&doi=10.1109%2fIJCNN48605.2020.9207543&partnerID=40&md5=f018ed1058c25e3020a18d8a20b55233","Conference paper","Final","","Scopus","2-s2.0-85093837506"
"Yang M.; Hu Q.; Wang Y.","Yang, Maoxin (57211169206); Hu, Qinghua (7403214664); Wang, Yun (56802805300)","57211169206; 7403214664; 56802805300","Multi-task Learning Method for Hierarchical Time Series Forecasting","2019","Lecture Notes in Computer Science (including subseries Lecture Notes in Artificial Intelligence and Lecture Notes in Bioinformatics)","11730 LNCS","","","474","485","11","2","10.1007/978-3-030-30490-4_38","https://www.scopus.com/inward/record.uri?eid=2-s2.0-85072873819&doi=10.1007%2f978-3-030-30490-4_38&partnerID=40&md5=701904482ed1f8d89b2ede867f9eeb39","Conference paper","Final","","Scopus","2-s2.0-85072873819"
"","","","European Conference on Machine Learning and Principles and Practice of Knowledge Discovery in Databases, ECML PKDD 2021","2021","Lecture Notes in Computer Science (including subseries Lecture Notes in Artificial Intelligence and Lecture Notes in Bioinformatics)","12978 LNAI","","","","","3508","0","","https://www.scopus.com/inward/record.uri?eid=2-s2.0-85115731425&partnerID=40&md5=e9f660d6cb6e14befa93806fb9a8ba73","Conference review","Final","","Scopus","2-s2.0-85115731425"
"Tao J.; Gong L.; Fan C.; Chen L.; Ye D.; Zhao S.","Tao, Jianrong (57203392720); Gong, Linxia (57203390929); Fan, Changjie (57203398908); Chen, Longbiao (55039599200); Ye, Dezhi (59087728300); Zhao, Sha (55497128900)","57203392720; 57203390929; 57203398908; 55039599200; 59087728300; 55497128900","GMTL: A GART based multi-task learning model for multi-social-temporal prediction in online games","2019","International Conference on Information and Knowledge Management, Proceedings","","","","2841","2849","8","3","10.1145/3357384.3357830","https://www.scopus.com/inward/record.uri?eid=2-s2.0-85075454543&doi=10.1145%2f3357384.3357830&partnerID=40&md5=31fd316a3d93d3819b929f8ce811bd01","Conference paper","Final","","Scopus","2-s2.0-85075454543"
"Chandra R.; Ong Y.-S.; Goh C.-K.","Chandra, Rohitash (35106707300); Ong, Yew-Soon (7006735298); Goh, Chi-Keong (7202891380)","35106707300; 7006735298; 7202891380","Co-evolutionary multi-task learning with predictive recurrence for multi-step chaotic time series prediction","2017","Neurocomputing","243","","","21","34","13","80","10.1016/j.neucom.2017.02.065","https://www.scopus.com/inward/record.uri?eid=2-s2.0-85014783975&doi=10.1016%2fj.neucom.2017.02.065&partnerID=40&md5=4179e86fb0bb40959588de740328bce3","Article","Final","","Scopus","2-s2.0-85014783975"
"Luo T.; Cao X.; Li J.; Dong K.; Zhang R.; Wei X.","Luo, Tao (58691383100); Cao, Xudong (58690826800); Li, Jin (58747950800); Dong, Kun (58690826900); Zhang, Rui (59089926000); Wei, Xueliang (59096116600)","58691383100; 58690826800; 58747950800; 58690826900; 59089926000; 59096116600","Multi-task prediction model based on ConvLSTM and encoder-decoder","2021","Intelligent Data Analysis","25","2","","359","382","23","10","10.3233/IDA-194969","https://www.scopus.com/inward/record.uri?eid=2-s2.0-85140283592&doi=10.3233%2fIDA-194969&partnerID=40&md5=03316a9134b1123d9bb8af1b64d55af3","Article","Final","","Scopus","2-s2.0-85140283592"
"","","","Workshops held at the 16th European Conference on Computer Vision, ECCV 2020","2020","Lecture Notes in Computer Science (including subseries Lecture Notes in Artificial Intelligence and Lecture Notes in Bioinformatics)","12538 LNCS","","","","","4363","0","","https://www.scopus.com/inward/record.uri?eid=2-s2.0-85101783730&partnerID=40&md5=c7875d65f81105afb9f8f13f3e520019","Conference review","Final","","Scopus","2-s2.0-85101783730"
"Tehrani P.; Levorato M.","Tehrani, Peyman (57190583067); Levorato, Marco (8901243100)","57190583067; 8901243100","Frequency-based multi task learning with attention mechanism for fault detection in power systems","2020","2020 IEEE International Conference on Communications, Control, and Computing Technologies for Smart Grids, SmartGridComm 2020","","","9302968","","","","8","10.1109/SmartGridComm47815.2020.9302968","https://www.scopus.com/inward/record.uri?eid=2-s2.0-85099483593&doi=10.1109%2fSmartGridComm47815.2020.9302968&partnerID=40&md5=b4f18a15da2e444e0b866f0bd2e42d07","Conference paper","Final","All Open Access; Green Open Access","Scopus","2-s2.0-85099483593"
"","","","Workshops held at the 16th European Conference on Computer Vision, ECCV 2020","2020","Lecture Notes in Computer Science (including subseries Lecture Notes in Artificial Intelligence and Lecture Notes in Bioinformatics)","12537 LNCS","","","","","4363","0","","https://www.scopus.com/inward/record.uri?eid=2-s2.0-85101515195&partnerID=40&md5=2df743f4471b62fb2d204d4d3653cd39","Conference review","Final","","Scopus","2-s2.0-85101515195"
"Ruan L.; Bai Y.; Xiao L.","Ruan, Li (7006832510); Bai, Yu (55461114100); Xiao, Limin (35729446600)","7006832510; 55461114100; 35729446600","Cloud Server Load Turning Point Prediction Based on Feature Enhanced Multi-task LSTM","2020","Lecture Notes in Computer Science (including subseries Lecture Notes in Artificial Intelligence and Lecture Notes in Bioinformatics)","11945 LNCS","","","261","266","5","1","10.1007/978-3-030-38961-1_22","https://www.scopus.com/inward/record.uri?eid=2-s2.0-85082120197&doi=10.1007%2f978-3-030-38961-1_22&partnerID=40&md5=f501144608f4679b24e204bcff25a911","Conference paper","Final","","Scopus","2-s2.0-85082120197"
"Mahmoud R.A.; Hajj H.; Karameh F.N.","Mahmoud, Reem A. (57192197070); Hajj, Hazem (35117824200); Karameh, Fadi N. (6507646982)","57192197070; 35117824200; 6507646982","A systematic approach to multi-task learning from time-series data","2020","Applied Soft Computing Journal","96","","106586","","","","10","10.1016/j.asoc.2020.106586","https://www.scopus.com/inward/record.uri?eid=2-s2.0-85089208878&doi=10.1016%2fj.asoc.2020.106586&partnerID=40&md5=50844468380d9c51a1e9eaa990d9f65b","Article","Final","","Scopus","2-s2.0-85089208878"
"Li J.; Shao X.; Sun R.","Li, Jiangeng (56303457300); Shao, Xingyang (57204544140); Sun, Rihui (57210515725)","56303457300; 57204544140; 57210515725","A DBN-based deep neural network model with multitask learning for online air quality prediction","2019","Journal of Control Science and Engineering","2019","","5304535","","","","28","10.1155/2019/5304535","https://www.scopus.com/inward/record.uri?eid=2-s2.0-85069202377&doi=10.1155%2f2019%2f5304535&partnerID=40&md5=83fe0ebf35840489bbd3b31396181759","Article","Final","All Open Access; Gold Open Access; Green Open Access","Scopus","2-s2.0-85069202377"
"Nguyen A.T.; Jeong H.; Yang E.; Hwang S.J.","Nguyen, A. Tuan (59584252500); Jeong, Hyewon (57192103119); Yang, Eunho (52265094000); Hwang, Sung Ju (57687927300)","59584252500; 57192103119; 52265094000; 57687927300","Clinical Risk Prediction with Temporal Probabilistic Asymmetric Multi-Task Learning","2021","35th AAAI Conference on Artificial Intelligence, AAAI 2021","10B","","","9081","9091","10","6","10.1609/aaai.v35i10.17097","https://www.scopus.com/inward/record.uri?eid=2-s2.0-85130093243&doi=10.1609%2faaai.v35i10.17097&partnerID=40&md5=9545fb4b4c3b025410182bd0b436f006","Conference paper","Final","All Open Access; Gold Open Access; Green Open Access","Scopus","2-s2.0-85130093243"
"Hüsken M.; Stagge P.","Hüsken, Michael (55939002600); Stagge, Peter (6602441124)","55939002600; 6602441124","Recurrent neural networks for time series classification","2003","Neurocomputing","50","","","223","235","12","286","10.1016/S0925-2312(01)00706-8","https://www.scopus.com/inward/record.uri?eid=2-s2.0-0037239496&doi=10.1016%2fS0925-2312%2801%2900706-8&partnerID=40&md5=353925a8e611519ee1a34f87e9b53906","Article","Final","","Scopus","2-s2.0-0037239496"
"El-Sappagh S.; Abuhmed T.; Riazul Islam S.M.; Kwak K.S.","El-Sappagh, Shaker (55233800700); Abuhmed, Tamer (27067512200); Riazul Islam, S.M. (36129968800); Kwak, Kyung Sup (7006457163)","55233800700; 27067512200; 36129968800; 7006457163","Multimodal multitask deep learning model for Alzheimer's disease progression detection based on time series data","2020","Neurocomputing","412","","","197","215","18","178","10.1016/j.neucom.2020.05.087","https://www.scopus.com/inward/record.uri?eid=2-s2.0-85087653691&doi=10.1016%2fj.neucom.2020.05.087&partnerID=40&md5=12d3bdad3ec6483ac518763caf88165e","Article","Final","","Scopus","2-s2.0-85087653691"
"Yu W.; Zhao X.; Sun Y.; Li X.","Yu, Wenbo (57213520109); Zhao, Xijian (57223101317); Sun, Yong (57208400499); Li, Xuejiao (57223110729)","57213520109; 57223101317; 57208400499; 57223110729","Scenario Uncertainty Modeling for Predictive Maintenance with Recurrent Neural Adaptive Processes (RNAPs)","2021","SAE Technical Papers","","2021","","","","","0","10.4271/2021-01-0191","https://www.scopus.com/inward/record.uri?eid=2-s2.0-85104841898&doi=10.4271%2f2021-01-0191&partnerID=40&md5=ef7f8790db026cabc6efb450a2d69a63","Conference paper","Final","","Scopus","2-s2.0-85104841898"
"","","","Workshops held at the 16th European Conference on Computer Vision, ECCV 2020","2020","Lecture Notes in Computer Science (including subseries Lecture Notes in Artificial Intelligence and Lecture Notes in Bioinformatics)","12536 LNCS","","","","","4363","0","","https://www.scopus.com/inward/record.uri?eid=2-s2.0-85101779826&partnerID=40&md5=994472537e46264eaa64a0f629ca88b0","Conference review","Final","","Scopus","2-s2.0-85101779826"
"Chen Z.; Jiaze E.; Zhang X.; Sheng H.; Cheng X.","Chen, Zekai (57222097875); Jiaze, E. (57222082925); Zhang, Xiao (58872540500); Sheng, Hao (7201933025); Cheng, Xiuzheng (58836542100)","57222097875; 57222082925; 58872540500; 7201933025; 58836542100","Multi-Task Time Series Forecasting with Shared Attention","2020","IEEE International Conference on Data Mining Workshops, ICDMW","2020-November","","9346331","917","925","8","24","10.1109/ICDMW51313.2020.00132","https://www.scopus.com/inward/record.uri?eid=2-s2.0-85101362126&doi=10.1109%2fICDMW51313.2020.00132&partnerID=40&md5=f2b70b2223686fcbebc52fe927ca272c","Conference paper","Final","All Open Access; Green Open Access","Scopus","2-s2.0-85101362126"
"Chandra R.; Cripps A.S.","Chandra, Rohitash (35106707300); Cripps, And Sally (7401446622)","35106707300; 7401446622","Bayesian Multi-task Learning for Dynamic Time Series Prediction","2018","Proceedings of the International Joint Conference on Neural Networks","2018-July","","8489323","","","","5","10.1109/IJCNN.2018.8489323","https://www.scopus.com/inward/record.uri?eid=2-s2.0-85056555804&doi=10.1109%2fIJCNN.2018.8489323&partnerID=40&md5=030474556c6b034169f4a2b27f8fb235","Conference paper","Final","","Scopus","2-s2.0-85056555804"
"Tao Y.; Wang X.; Zhang Y.","Tao, Yanyun (27067953500); Wang, Xiang (57202370507); Zhang, Yuzhen (55370162000)","27067953500; 57202370507; 55370162000","A Multitask Learning Neural Network for Short-Term Traffic Speed Prediction and Confidence Estimation","2019","Lecture Notes in Computer Science (including subseries Lecture Notes in Artificial Intelligence and Lecture Notes in Bioinformatics)","11728 LNCS","","","434","449","15","6","10.1007/978-3-030-30484-3_36","https://www.scopus.com/inward/record.uri?eid=2-s2.0-85072853576&doi=10.1007%2f978-3-030-30484-3_36&partnerID=40&md5=fb12426fa91c6474b819f265b41b3c8e","Conference paper","Final","","Scopus","2-s2.0-85072853576"
"Chandra R.; Ong Y.-S.; Goh C.-K.","Chandra, Rohitash (35106707300); Ong, Yew-Soon (7006735298); Goh, Chi-Keong (7202891380)","35106707300; 7006735298; 7202891380","Co-evolutionary multi-task learning for dynamic time series prediction","2018","Applied Soft Computing Journal","70","","","576","589","13","47","10.1016/j.asoc.2018.05.041","https://www.scopus.com/inward/record.uri?eid=2-s2.0-85048710969&doi=10.1016%2fj.asoc.2018.05.041&partnerID=40&md5=05d04e9b76eb12f56a3e253ab78af4ba","Article","Final","All Open Access; Green Open Access","Scopus","2-s2.0-85048710969"
"Di Persio L.; Honchar O.","Di Persio, Luca (57203636440); Honchar, Oleksandr (57192153071)","57203636440; 57192153071","Multitask machine learning for financial forecasting","2018","International Journal of Circuits, Systems and Signal Processing","12","","","444","451","7","23","","https://www.scopus.com/inward/record.uri?eid=2-s2.0-85046646074&partnerID=40&md5=f35899208c4ae7d702b8cac615059496","Article","Final","","Scopus","2-s2.0-85046646074"
"","","","European Conference on Machine Learning and Principles and Practice of Knowledge Discovery in Databases, ECML PKDD 2021","2021","Lecture Notes in Computer Science (including subseries Lecture Notes in Artificial Intelligence and Lecture Notes in Bioinformatics)","12977 LNAI","","","","","3508","0","","https://www.scopus.com/inward/record.uri?eid=2-s2.0-85115694639&partnerID=40&md5=64f75f1707c3a40ff49eaec124ca3c84","Conference review","Final","","Scopus","2-s2.0-85115694639"
"Flores-Vergara D.; Nanculef R.; Valle C.; Osses M.; Jacques A.; Dominguez M.","Flores-Vergara, Daniel (57215527205); Nanculef, Ricardo (6507812613); Valle, Carlos (13611071300); Osses, Mauricio (6602678375); Jacques, Aldonza (22834960500); Dominguez, Maria (57215526680)","57215527205; 6507812613; 13611071300; 6602678375; 22834960500; 57215526680","Forecasting Ozone Pollution using Recurrent Neural Nets and Multiple Quantile Regression","2019","IEEE CHILEAN Conference on Electrical, Electronics Engineering, Information and Communication Technologies, CHILECON 2019","","","8988110","","","","6","10.1109/CHILECON47746.2019.8988110","https://www.scopus.com/inward/record.uri?eid=2-s2.0-85081052830&doi=10.1109%2fCHILECON47746.2019.8988110&partnerID=40&md5=e216c546e6290e1e5c378072d9d6ed33","Conference paper","Final","","Scopus","2-s2.0-85081052830"
"Heskes T.; Spanjers J.-J.; Bakker B.; Wiegerinck W.","Heskes, Tom (7004495581); Spanjers, Jan-Joost (6508095273); Bakker, Bart (36726521400); Wiegerinck, Wim (6602873496)","7004495581; 6508095273; 36726521400; 6602873496","Optimising newspaper sales using neural-Bayesian technology","2003","Neural Computing and Applications","12","3-4","","212","219","7","3","10.1007/s00521-003-0384-x","https://www.scopus.com/inward/record.uri?eid=2-s2.0-0346342558&doi=10.1007%2fs00521-003-0384-x&partnerID=40&md5=91cc5ac0256d7a3606021fe8f2ed8ef0","Article","Final","","Scopus","2-s2.0-0346342558"
"","","","Workshops held at the 16th European Conference on Computer Vision, ECCV 2020","2020","Lecture Notes in Computer Science (including subseries Lecture Notes in Artificial Intelligence and Lecture Notes in Bioinformatics)","12539 LNCS","","","","","4363","0","","https://www.scopus.com/inward/record.uri?eid=2-s2.0-85101416806&partnerID=40&md5=55b9b7743b83c3fdc65dba6d0a1c8985","Conference review","Final","","Scopus","2-s2.0-85101416806"
"Xuan W.; Shouxiang W.; Qianyu Z.; Shaomin W.; Liwei F.","Xuan, Wang (57219440184); Shouxiang, Wang (57215263542); Qianyu, Zhao (56498209000); Shaomin, Wang (57219443642); Liwei, Fu (57220127713)","57219440184; 57215263542; 56498209000; 57219443642; 57220127713","A multi-energy load prediction model based on deep multi-task learning and ensemble approach for regional integrated energy systems","2021","International Journal of Electrical Power and Energy Systems","126","","106583","","","","112","10.1016/j.ijepes.2020.106583","https://www.scopus.com/inward/record.uri?eid=2-s2.0-85092696625&doi=10.1016%2fj.ijepes.2020.106583&partnerID=40&md5=d5196714d46d8d3b255cfc2d137780c2","Article","Final","","Scopus","2-s2.0-85092696625"
"Yu R.; Zheng Y.; Zhang R.; Jiang Y.; Poon C.C.Y.","Yu, Ruoxi (57037652400); Zheng, Yali (55516624100); Zhang, Ruikai (57037357800); Jiang, Yuqi (57204667156); Poon, Carmen C. Y. (57202479652)","57037652400; 55516624100; 57037357800; 57204667156; 57202479652","Using a Multi-Task Recurrent Neural Network with Attention Mechanisms to Predict Hospital Mortality of Patients","2020","IEEE Journal of Biomedical and Health Informatics","24","2","8713596","486","492","6","35","10.1109/JBHI.2019.2916667","https://www.scopus.com/inward/record.uri?eid=2-s2.0-85078272944&doi=10.1109%2fJBHI.2019.2916667&partnerID=40&md5=5cc13d19bdb162d1fb74cf98f6cdc895","Article","Final","","Scopus","2-s2.0-85078272944"
"Zhang H.; Tang Z.; Xie Y.; Zhang G.; Gui W.","Zhang, Hu (57192483080); Tang, Zhaohui (36570905000); Xie, Yongfang (55609506600); Zhang, Guoyong (57213770651); Gui, Weihua (7004829136)","57192483080; 36570905000; 55609506600; 57213770651; 7004829136","Grouped Time Series Networks for Grade Monitoring of Zinc Tailings with Multisource Features","2021","IEEE Transactions on Instrumentation and Measurement","70","","9509406","","","","12","10.1109/TIM.2021.3103572","https://www.scopus.com/inward/record.uri?eid=2-s2.0-85113266274&doi=10.1109%2fTIM.2021.3103572&partnerID=40&md5=0ff994b57135da6c25a3beb55686b916","Article","Final","","Scopus","2-s2.0-85113266274"
"Barabas M.; Boanea G.; Rus A.B.; Dobrota V.; Domingo-Pascual J.","Barabas, Melinda (35218698500); Boanea, Georgeta (35186050500); Rus, Andrei B. (35219113300); Dobrota, Virgil (6506986343); Domingo-Pascual, Jordi (6603210328)","35218698500; 35186050500; 35219113300; 6506986343; 6603210328","Evaluation of network traffic prediction based on neural networks with multi-task learning and multiresolution decomposition","2011","Proceedings - 2011 IEEE 7th International Conference on Intelligent Computer Communication and Processing, ICCP 2011","","","6047849","95","102","7","45","10.1109/ICCP.2011.6047849","https://www.scopus.com/inward/record.uri?eid=2-s2.0-80755143055&doi=10.1109%2fICCP.2011.6047849&partnerID=40&md5=e6d1cf0491784330e9997b8e00adfa66","Conference paper","Final","","Scopus","2-s2.0-80755143055"
"Cirstea R.-G.; Micu D.-V.; Muresan G.-M.; Guo C.; Yang B.","Cirstea, Razvan-Gabriel (57204939572); Micu, Darius-Valer (57204944949); Muresan, Gabriel-Marcel (57204942790); Guo, Chenjuan (55568451900); Yang, Bin (55584795026)","57204939572; 57204944949; 57204942790; 55568451900; 55584795026","Correlated time series forecasting using multi-task deep neural networks","2018","International Conference on Information and Knowledge Management, Proceedings","","","","1527","1530","3","65","10.1145/3269206.3269310","https://www.scopus.com/inward/record.uri?eid=2-s2.0-85058051566&doi=10.1145%2f3269206.3269310&partnerID=40&md5=d08ee657d3912a59f54030eec6e6fa3b","Conference paper","Final","","Scopus","2-s2.0-85058051566"
"Yeh C.-H.; Fan Y.-C.; Peng W.-C.","Yeh, Cheng-Han (57209507762); Fan, Yao-Chung (55226868000); Peng, Wen-Chih (8358716100)","57209507762; 55226868000; 8358716100","Interpretable multi-task learning for product quality prediction with attention mechanism","2019","Proceedings - International Conference on Data Engineering","2019-April","","8731458","1910","1921","11","10","10.1109/ICDE.2019.00207","https://www.scopus.com/inward/record.uri?eid=2-s2.0-85068003425&doi=10.1109%2fICDE.2019.00207&partnerID=40&md5=de95e7b36da61c6d500efc8ac5e0fe77","Conference paper","Final","","Scopus","2-s2.0-85068003425"
"Zhou D.; Zheng L.; Zhu Y.; Li J.; He J.","Zhou, Dawei (57001852100); Zheng, Lecheng (57208900351); Zhu, Yada (35323529600); Li, Jianbo (57203396867); He, Jingrui (7404984811)","57001852100; 57208900351; 35323529600; 57203396867; 7404984811","Domain Adaptive Multi-Modality Neural Attention Network for Financial Forecasting","2020","The Web Conference 2020 - Proceedings of the World Wide Web Conference, WWW 2020","","","","2230","2240","10","31","10.1145/3366423.3380288","https://www.scopus.com/inward/record.uri?eid=2-s2.0-85086570975&doi=10.1145%2f3366423.3380288&partnerID=40&md5=dd025bb84832f6c487098a519257292d","Conference paper","Final","","Scopus","2-s2.0-85086570975"
