"Authors","Author full names","Author(s) ID","Title","Year","Source title","Volume","Issue","Art. No.","Page start","Page end","Page count","Cited by","DOI","Link","Document Type","Publication Stage","Open Access","Source","EID"
"Baldi A.; Carnevali L.; Collodi G.; Lippi M.; Manes A.","Baldi, Ada (34967809400); Carnevali, Laura (22833351700); Collodi, Giovanni (6602725240); Lippi, Marco (7003730739); Manes, Antonio (8717154200)","34967809400; 22833351700; 6602725240; 7003730739; 8717154200","Multi-task neural networks for multi-step soil moisture forecasting in vineyards using Internet-of-Things sensors","2025","Smart Agricultural Technology","10","","100769","","","","0","10.1016/j.atech.2025.100769","https://www.scopus.com/inward/record.uri?eid=2-s2.0-85214702211&doi=10.1016%2fj.atech.2025.100769&partnerID=40&md5=02737105be59e11401568dd52646d821","Article","Final","All Open Access; Gold Open Access","Scopus","2-s2.0-85214702211"
"Lodhi E.; Dahmani N.; Bukhari S.M.S.; Gyawali S.; Thapa S.; Qiu L.; Zafar M.H.; Akhtar N.","Lodhi, Ehtisham (57193111980); Dahmani, Nadia (36184997800); Bukhari, Syed Muhammad Salman (58635732800); Gyawali, Sujan (59389740300); Thapa, Sanjog (59385193900); Qiu, Lin (54796951400); Zafar, Muhammad Hamza (57220040342); Akhtar, Naureen (57208856722)","57193111980; 36184997800; 58635732800; 59389740300; 59385193900; 54796951400; 57220040342; 57208856722","Enhancing microgrid forecasting accuracy with SAQ-MTCLSTM: A self-adjusting quantized multi-task ConvLSTM for optimized solar power and load demand predictions","2024","Energy Conversion and Management: X","24","","100767","","","","1","10.1016/j.ecmx.2024.100767","https://www.scopus.com/inward/record.uri?eid=2-s2.0-85207785392&doi=10.1016%2fj.ecmx.2024.100767&partnerID=40&md5=96b89ee27ea9a4333d6ddb94e8c95d43","Article","Final","All Open Access; Gold Open Access","Scopus","2-s2.0-85207785392"
"Ji W.; Cao Z.; Li X.","Ji, Wenxian (58718294200); Cao, Zeyu (57218284502); Li, Xiaorun (7501707862)","58718294200; 57218284502; 7501707862","Multi-Task Learning and Temporal-Fusion-Transformer-Based Forecasting of Building Power Consumption","2023","Electronics (Switzerland)","12","22","4656","","","","3","10.3390/electronics12224656","https://www.scopus.com/inward/record.uri?eid=2-s2.0-85178325997&doi=10.3390%2felectronics12224656&partnerID=40&md5=7adf4a76edeadfc85efe0c3113ff0401","Article","Final","All Open Access; Gold Open Access","Scopus","2-s2.0-85178325997"
"Zuo H.; Yan G.; Lu R.; Li R.; Xiao S.; Pang Y.","Zuo, Hui (58731855100); Yan, Gaowei (7202089903); Lu, Ruochen (58732656000); Li, Rong (57198938318); Xiao, Shuyi (57204569352); Pang, Yusong (14070474300)","58731855100; 7202089903; 58732656000; 57198938318; 57204569352; 14070474300","A Multi-Task Learning Based Runoff Forecasting Model for Multi-Scale Chaotic Hydrological Time Series","2024","Water Resources Management","38","2","","481","503","22","1","10.1007/s11269-023-03681-z","https://www.scopus.com/inward/record.uri?eid=2-s2.0-85178244842&doi=10.1007%2fs11269-023-03681-z&partnerID=40&md5=608c998930a425b9ee7b26a436ce3e94","Article","Final","","Scopus","2-s2.0-85178244842"
"","","","22nd Joint European Conference on Machine Learning and Principles and Practice of Knowledge Discovery in Databases, ECML PKDD 2022","2023","Lecture Notes in Computer Science (including subseries Lecture Notes in Artificial Intelligence and Lecture Notes in Bioinformatics)","13718 LNAI","","","","","4095","0","","https://www.scopus.com/inward/record.uri?eid=2-s2.0-85150977651&partnerID=40&md5=a3c8253c18fdd30cc255bcaaf7dac8af","Conference review","Final","","Scopus","2-s2.0-85150977651"
"Qian B.; Chen Q.; Zhang Z.; Liu M.; Wang S.; Niu Y.","Qian, Beiqi (58260550500); Chen, Qian (58494711700); Zhang, Zhengwei (58261294900); Liu, Mingyang (57188697897); Wang, Suying (58261539700); Niu, Yinghao (58260550600)","58260550500; 58494711700; 58261294900; 57188697897; 58261539700; 58260550600","Multi-task Transient Stability Assessment Based on Feature-level Fusion of Heterogeneous Data; [基 于 异 构 数 据 特 征 级 融 合 的 多 任 务 暂 态 稳 定 评 估]","2023","Dianli Xitong Zidonghua/Automation of Electric Power Systems","47","9","","118","128","10","6","10.7500/AEPS20220921001","https://www.scopus.com/inward/record.uri?eid=2-s2.0-85159674873&doi=10.7500%2fAEPS20220921001&partnerID=40&md5=9524fbbeb6dd2da3f7d585f77317b05b","Article","Final","","Scopus","2-s2.0-85159674873"
"Shao X.; Kim C.-S.","Shao, Xiaorui (57216473967); Kim, Chang-Soo (55645446000)","57216473967; 55645446000","TFFS: A trainable federal fusion strategy for multistep time series forecasting","2024","Information Sciences","679","","121126","","","","0","10.1016/j.ins.2024.121126","https://www.scopus.com/inward/record.uri?eid=2-s2.0-85197409118&doi=10.1016%2fj.ins.2024.121126&partnerID=40&md5=96995a62d4db650ddfa84049097af7c4","Article","Final","","Scopus","2-s2.0-85197409118"
"Wei M.; Shi J.; Zhang T.; Zhao Y.; Jiang H.; He Y.","Wei, Mofan (57215092567); Shi, Jiaqi (57126564800); Zhang, Tieyan (57221156181); Zhao, Yan (56258250600); Jiang, He (57037425800); He, Yutong (57934590500)","57215092567; 57126564800; 57221156181; 56258250600; 57037425800; 57934590500","Short-Term Multi-Energy Load Forecasting Based on Feature Reconstruction and TCN-Informer","2024","IEEE Student Conference on Electric Machines and Systems (SCEMS)","","","","","","","0","10.1109/SCEMS63294.2024.10756388","https://www.scopus.com/inward/record.uri?eid=2-s2.0-85212292973&doi=10.1109%2fSCEMS63294.2024.10756388&partnerID=40&md5=0a9fc513c451656f8933e0d2eccde6b4","Conference paper","Final","","Scopus","2-s2.0-85212292973"
"Al Mallah R.; Quintero A.; Farooq B.","Al Mallah, Ranwa (57219281510); Quintero, Alejandro (7005159772); Farooq, Bilal (35573116600)","57219281510; 7005159772; 35573116600","Prediction of Traffic Flow via Connected Vehicles","2022","IEEE Transactions on Mobile Computing","21","1","","264","277","13","15","10.1109/TMC.2020.3006713","https://www.scopus.com/inward/record.uri?eid=2-s2.0-85121028057&doi=10.1109%2fTMC.2020.3006713&partnerID=40&md5=bcbc3c8c919dab127eab97cfc22b6d40","Article","Final","All Open Access; Green Open Access","Scopus","2-s2.0-85121028057"
"Sun Z.; Li Q.; Jin S.; Song Y.; Xu S.; Wang X.; Cai J.; Zhou Q.; Ge Y.; Zhang R.; Zang J.; Jiang D.","Sun, Zhuangzhuang (57215500950); Li, Qing (57221243551); Jin, Shichao (57200513988); Song, Yunlin (57223227521); Xu, Shan (57204081809); Wang, Xiao (46462079300); Cai, Jian (56470143000); Zhou, Qin (55722094700); Ge, Yan (57195932726); Zhang, Ruinan (58842811500); Zang, Jingrong (57607415900); Jiang, Dong (26027000300)","57215500950; 57221243551; 57200513988; 57223227521; 57204081809; 46462079300; 56470143000; 55722094700; 57195932726; 58842811500; 57607415900; 26027000300","Simultaneous Prediction of Wheat Yield and Grain Protein Content Using Multitask Deep Learning from Time-Series Proximal Sensing","2022","Plant Phenomics","2022","","9757948","","","","47","10.34133/2022/9757948","https://www.scopus.com/inward/record.uri?eid=2-s2.0-85128639457&doi=10.34133%2f2022%2f9757948&partnerID=40&md5=337f22a18f3d8a506357f2be13f1add3","Article","Final","All Open Access; Gold Open Access; Green Open Access","Scopus","2-s2.0-85128639457"
"Bai W.; Yamashita O.; Yoshimoto J.","Bai, Wenjun (57192897376); Yamashita, Okito (57217729970); Yoshimoto, Junichiro (7006748661)","57192897376; 57217729970; 7006748661","Learning task-agnostic and interpretable subsequence-based representation of time series and its applications in fMRI analysis","2023","Neural Networks","163","","","327","340","13","1","10.1016/j.neunet.2023.03.038","https://www.scopus.com/inward/record.uri?eid=2-s2.0-85153212904&doi=10.1016%2fj.neunet.2023.03.038&partnerID=40&md5=71edd9dd6d24a75eae5669f9d7a37ac6","Article","Final","All Open Access; Hybrid Gold Open Access","Scopus","2-s2.0-85153212904"
"","","","STRL 2022 - Proceedings of the 1st International Workshop on Spatio-Temporal Reasoning and Learning, co-located with the 31st International Joint Conference on Artificial Intelligence and the 25th European Conference on Artificial Intelligence, IJCAI and ECAI 2022","2022","CEUR Workshop Proceedings","3190","","","","","46","0","","https://www.scopus.com/inward/record.uri?eid=2-s2.0-85137812635&partnerID=40&md5=1e4ac7356f2cd78e47e9fb5fa989b387","Conference review","Final","","Scopus","2-s2.0-85137812635"
"Muaz M.; Yu H.; Sung W.L.; Liu C.; Drescher B.","Muaz, Muhammad (57207795493); Yu, Hanxin (58567787800); Sung, Wai Lam (58547418500); Liu, Chang (58367173400); Drescher, Benny (56341451900)","57207795493; 58567787800; 58547418500; 58367173400; 56341451900","A multitask encoder–decoder model for quality prediction in injection moulding","2023","Journal of Manufacturing Processes","103","","","238","247","9","5","10.1016/j.jmapro.2023.08.030","https://www.scopus.com/inward/record.uri?eid=2-s2.0-85170282108&doi=10.1016%2fj.jmapro.2023.08.030&partnerID=40&md5=8bbac1b6c1cbdca90c8830351b6b0bb9","Article","Final","","Scopus","2-s2.0-85170282108"
"Ong J.; Herremans D.","Ong, Joel (58016988100); Herremans, Dorien (55533923200)","58016988100; 55533923200","Constructing time-series momentum portfolios with deep multi-task learning","2023","Expert Systems with Applications","230","","120587","","","","0","10.1016/j.eswa.2023.120587","https://www.scopus.com/inward/record.uri?eid=2-s2.0-85161260123&doi=10.1016%2fj.eswa.2023.120587&partnerID=40&md5=ab05d13db31849c5710efce2d7de63a6","Article","Final","All Open Access; Green Open Access","Scopus","2-s2.0-85161260123"
"Deng J.; Chen X.; Jiang R.; Song X.; Tsang I.W.","Deng, Jinliang (57246045800); Chen, Xiusi (57203390885); Jiang, Renhe (57202284492); Song, Xuan (7402269519); Tsang, Ivor W. (7004570429)","57246045800; 57203390885; 57202284492; 7402269519; 7004570429","A Multi-View Multi-Task Learning Framework for Multi-Variate Time Series Forecasting","2023","IEEE Transactions on Knowledge and Data Engineering","35","8","","7665","7680","15","17","10.1109/TKDE.2022.3218803","https://www.scopus.com/inward/record.uri?eid=2-s2.0-85141598882&doi=10.1109%2fTKDE.2022.3218803&partnerID=40&md5=845356357cf485662a5d8851c974025b","Article","Final","All Open Access; Green Open Access","Scopus","2-s2.0-85141598882"
"Qiao J.; Zhou J.; Meng X.","Qiao, Junfei (9634105900); Zhou, Jianglong (57573976200); Meng, Xi (56413512500)","9634105900; 57573976200; 56413512500","A Multitask Learning Model for the Prediction of NOx Emissions in Municipal Solid Waste Incineration Processes","2023","IEEE Transactions on Instrumentation and Measurement","72","","2502214","","","","12","10.1109/TIM.2022.3225056","https://www.scopus.com/inward/record.uri?eid=2-s2.0-85144053931&doi=10.1109%2fTIM.2022.3225056&partnerID=40&md5=3c53d2cf1f228765827844b8c1ec3529","Article","Final","","Scopus","2-s2.0-85144053931"
"Xu J.; Gong J.; Wang L.; Li Y.","Xu, Jinya (58408970700); Gong, Jiaye (57217562661); Wang, Luyao (58614540500); Li, Yunbo (7502081548)","58408970700; 57217562661; 58614540500; 7502081548","Integrating k-means Clustering and LSTM for Enhanced Ship Heading Prediction in Oblique Stern Wave","2023","Journal of Marine Science and Engineering","11","11","2185","","","","3","10.3390/jmse11112185","https://www.scopus.com/inward/record.uri?eid=2-s2.0-85178383211&doi=10.3390%2fjmse11112185&partnerID=40&md5=cdcee0b7aac1abf88feac571c9303674","Article","Final","All Open Access; Gold Open Access","Scopus","2-s2.0-85178383211"
"Zhou X.; Zhai N.; Li S.; Shi H.","Zhou, Xiaofeng (57210941499); Zhai, Naiju (57218562985); Li, Shuai (56605879200); Shi, Haibo (7402623419)","57210941499; 57218562985; 56605879200; 7402623419","Time Series Prediction Method of Industrial Process With Limited Data Based on Transfer Learning","2023","IEEE Transactions on Industrial Informatics","19","5","","6872","6882","10","30","10.1109/TII.2022.3191980","https://www.scopus.com/inward/record.uri?eid=2-s2.0-85135226657&doi=10.1109%2fTII.2022.3191980&partnerID=40&md5=6c0363c208427d055224df423772d26c","Article","Final","","Scopus","2-s2.0-85135226657"
"Eo M.; Han J.; Rhee W.","Eo, Moonjung (55652157600); Han, Jeongyun (57202099136); Rhee, Wonjong (57201527562)","55652157600; 57202099136; 57201527562","Deep Learning Framework With Essential Pre-Processing Techniques for Improving Mixed-Gas Concentration Prediction","2023","IEEE Access","11","","","25467","25479","12","10","10.1109/ACCESS.2023.3253968","https://www.scopus.com/inward/record.uri?eid=2-s2.0-85149826816&doi=10.1109%2fACCESS.2023.3253968&partnerID=40&md5=e8213f75b6f3294ecb46149d4343a0f0","Article","Final","All Open Access; Gold Open Access","Scopus","2-s2.0-85149826816"
"Yang K.; Wang Y.; Han X.; Cheng Y.; Guo L.; Gong J.","Yang, Kaifei (57221118845); Wang, Yakun (57193332387); Han, Xiaodong (55450928100); Cheng, Yuehua (24922675500); Guo, Lifang (57445263800); Gong, Jianglei (57191541619)","57221118845; 57193332387; 55450928100; 24922675500; 57445263800; 57191541619","Unsupervised Anomaly Detection for Time Series Data of Spacecraft Using Multi-Task Learning","2022","Applied Sciences (Switzerland)","12","13","6296","","","","9","10.3390/app12136296","https://www.scopus.com/inward/record.uri?eid=2-s2.0-85132978353&doi=10.3390%2fapp12136296&partnerID=40&md5=4d175fefd626e873c49cc423fd456627","Article","Final","All Open Access; Gold Open Access","Scopus","2-s2.0-85132978353"
"Xiang Y.","Xiang, Yijun (59525012300)","59525012300","Multi-Model Fusion and Multi-Task Learning for Enhanced Earthquake Sequence Prediction Using Acoustic Signals","2024","2024 4th International Conference on Computer Systems, ICCS 2024","","","","28","33","5","0","10.1109/ICCS62594.2024.10795838","https://www.scopus.com/inward/record.uri?eid=2-s2.0-85215771712&doi=10.1109%2fICCS62594.2024.10795838&partnerID=40&md5=98052255758fa71f9edb9cd4d294e2df","Conference paper","Final","","Scopus","2-s2.0-85215771712"
"Ott F.; Rugamer D.; Heublein L.; Bischl B.; Mutschler C.","Ott, Felix (57218709750); Rugamer, David (56100232400); Heublein, Lucas (57219411160); Bischl, Bernd (23090199300); Mutschler, Christopher (55365041400)","57218709750; 56100232400; 57219411160; 23090199300; 55365041400","Joint Classification and Trajectory Regression of Online Handwriting using a Multi-Task Learning Approach","2022","Proceedings - 2022 IEEE/CVF Winter Conference on Applications of Computer Vision, WACV 2022","","","","1244","1254","10","15","10.1109/WACV51458.2022.00131","https://www.scopus.com/inward/record.uri?eid=2-s2.0-85125217933&doi=10.1109%2fWACV51458.2022.00131&partnerID=40&md5=e0ae93da14cabcf3d94473933944ece7","Conference paper","Final","All Open Access; Green Open Access","Scopus","2-s2.0-85125217933"
"Song T.; Garza P.; Meo M.; Munafo M.M.","Song, Tailai (58500472100); Garza, Paolo (36909944300); Meo, Michela (57042401300); Munafo, Maurizio Matteo (7004859480)","58500472100; 36909944300; 57042401300; 7004859480","Throughput Prediction in Real-Time Communications: Spotlight on Traffic Extremes","2024","Proceedings - IEEE Symposium on Computers and Communications","","","","","","","0","10.1109/ISCC61673.2024.10733668","https://www.scopus.com/inward/record.uri?eid=2-s2.0-85209208782&doi=10.1109%2fISCC61673.2024.10733668&partnerID=40&md5=f395629c05f99d17ec20eb437cadc69b","Conference paper","Final","","Scopus","2-s2.0-85209208782"
"Ilias L.; Kapsalis P.; Mouzakitis S.; Askounis D.","Ilias, Loukas (57222863406); Kapsalis, Panagiotis (57202805687); Mouzakitis, Spiros (24832116700); Askounis, Dimitris (6603428475)","57222863406; 57202805687; 24832116700; 6603428475","A Multitask Learning Framework for Predicting Ship Fuel Oil Consumption","2023","IEEE Access","11","","","132576","132589","13","4","10.1109/ACCESS.2023.3335905","https://www.scopus.com/inward/record.uri?eid=2-s2.0-85178071314&doi=10.1109%2fACCESS.2023.3335905&partnerID=40&md5=639b243c1f7a58f96ab5592b9b0ce810","Article","Final","All Open Access; Gold Open Access","Scopus","2-s2.0-85178071314"
"Tian W.; Song P.; Chen Y.; Zhang Y.; Wu L.; Zhao H.; Lim Kam Sian K.T.C.; Xiang C.","Tian, Wei (28168059300); Song, Ping (58959947200); Chen, Yuanyuan (58960995700); Zhang, Yonghong (55995777500); Wu, Liguang (55714142500); Zhao, Haikun (35195037900); Lim Kam Sian, Kenny Thiam Choy (57208444505); Xiang, Chunyi (57222963859)","28168059300; 58959947200; 58960995700; 55995777500; 55714142500; 35195037900; 57208444505; 57222963859","Short-Term Rolling Prediction of Tropical Cyclone Intensity Based on Multi-Task Learning with Fusion of Deviation-Angle Variance and Satellite Imagery","2025","Advances in Atmospheric Sciences","42","1","","111","128","17","0","10.1007/s00376-024-3301-0","https://www.scopus.com/inward/record.uri?eid=2-s2.0-85211382860&doi=10.1007%2fs00376-024-3301-0&partnerID=40&md5=0c3ff3bf5b98f9a59549e7ae5d1df841","Article","Final","","Scopus","2-s2.0-85211382860"
"","","","22nd Joint European Conference on Machine Learning and Principles and Practice of Knowledge Discovery in Databases, ECML PKDD 2022","2023","Lecture Notes in Computer Science (including subseries Lecture Notes in Artificial Intelligence and Lecture Notes in Bioinformatics)","13714 LNAI","","","","","4095","0","","https://www.scopus.com/inward/record.uri?eid=2-s2.0-85151084703&partnerID=40&md5=c06e9d4a7f32c952cf4bb0b9da2094be","Conference review","Final","","Scopus","2-s2.0-85151084703"
"Yuan C.; Ma X.; Wang H.; Zhang C.; Li X.","Yuan, Chenxun (57783626700); Ma, Xiang (57216646412); Wang, Hua (57211005343); Zhang, Caiming (7405490397); Li, Xuemei (55718132100)","57783626700; 57216646412; 57211005343; 7405490397; 55718132100","COVID19-MLSF: A multi-task learning-based stock market forecasting framework during the COVID-19 pandemic","2023","Expert Systems with Applications","217","","119549","","","","22","10.1016/j.eswa.2023.119549","https://www.scopus.com/inward/record.uri?eid=2-s2.0-85146643439&doi=10.1016%2fj.eswa.2023.119549&partnerID=40&md5=9ef002e718e1e0e26b318fcd124e831c","Article","Final","All Open Access; Bronze Open Access; Green Open Access","Scopus","2-s2.0-85146643439"
"","","","22nd Joint European Conference on Machine Learning and Principles and Practice of Knowledge Discovery in Databases, ECML PKDD 2022","2023","Lecture Notes in Computer Science (including subseries Lecture Notes in Artificial Intelligence and Lecture Notes in Bioinformatics)","13713 LNAI","","","","","4095","0","","https://www.scopus.com/inward/record.uri?eid=2-s2.0-85151086840&partnerID=40&md5=4db021af4d367b90923be07d9bf20d52","Conference review","Final","","Scopus","2-s2.0-85151086840"
"Wu X.; Zhang Q.; Wen F.; Qi Y.","Wu, Xijuan (57339439200); Zhang, Qiang (55624487704); Wen, Fei (57726512600); Qi, Ying (57726622900)","57339439200; 55624487704; 57726512600; 57726622900","A Water Quality Prediction Model Based on Multi-Task Deep Learning: A Case Study of the Yellow River, China","2022","Water (Switzerland)","14","21","3408","","","","22","10.3390/w14213408","https://www.scopus.com/inward/record.uri?eid=2-s2.0-85141850807&doi=10.3390%2fw14213408&partnerID=40&md5=71f4c7fe071237c5960becf6a04c475b","Article","Final","All Open Access; Gold Open Access","Scopus","2-s2.0-85141850807"
"Kakar J.K.; Hussain S.; Kim S.C.; Kim H.","Kakar, Junaid Khan (58753455700); Hussain, Shahid (57671076700); Kim, Sang Cheol (55561975800); Kim, Hyongsuk (23109059600)","58753455700; 57671076700; 55561975800; 23109059600","TimeTector: A Twin-Branch Approach for Unsupervised Anomaly Detection in Livestock Sensor Noisy Data (TT-TBAD)","2024","Sensors","24","8","2453","","","","2","10.3390/s24082453","https://www.scopus.com/inward/record.uri?eid=2-s2.0-85191427734&doi=10.3390%2fs24082453&partnerID=40&md5=340da8385badd30893b65b35f4c123c5","Article","Final","All Open Access; Gold Open Access; Green Open Access","Scopus","2-s2.0-85191427734"
"Li H.; Cao P.; Wang X.; Yi B.; Huang M.; Sun Q.; Zhang Y.","Li, Haodong (58094887700); Cao, Peng (59438413100); Wang, Xingwei (57729227100); Yi, Bo (57194626672); Huang, Min (57996768400); Sun, Qiuye (57698922600); Zhang, Yanfeng (57194616708)","58094887700; 59438413100; 57729227100; 57194626672; 57996768400; 57698922600; 57194616708","Multi-task spatio-temporal augmented net for industry equipment remaining useful life prediction","2023","Advanced Engineering Informatics","55","","101898","","","","29","10.1016/j.aei.2023.101898","https://www.scopus.com/inward/record.uri?eid=2-s2.0-85147607163&doi=10.1016%2fj.aei.2023.101898&partnerID=40&md5=1567adcabfdcc58c7cd9fcafbfbc0279","Article","Final","","Scopus","2-s2.0-85147607163"
"","","","22nd Joint European Conference on Machine Learning and Principles and Practice of Knowledge Discovery in Databases, ECML PKDD 2022","2023","Lecture Notes in Computer Science (including subseries Lecture Notes in Artificial Intelligence and Lecture Notes in Bioinformatics)","13716 LNAI","","","","","4095","0","","https://www.scopus.com/inward/record.uri?eid=2-s2.0-85151068231&partnerID=40&md5=000fa2cec75f47deb4cfd33767f8aed8","Conference review","Final","","Scopus","2-s2.0-85151068231"
"Xu X.; Yoneda M.","Xu, Xinghan (57209023551); Yoneda, Minoru (36132603300)","57209023551; 36132603300","Multitask Air-Quality Prediction Based on LSTM-Autoencoder Model","2021","IEEE Transactions on Cybernetics","51","5","8889470","2577","2586","9","104","10.1109/TCYB.2019.2945999","https://www.scopus.com/inward/record.uri?eid=2-s2.0-85104651277&doi=10.1109%2fTCYB.2019.2945999&partnerID=40&md5=b06d3242cebf44b4068dcb9c61f5d1eb","Article","Final","","Scopus","2-s2.0-85104651277"
"Song T.; Garza P.; Meo M.; Munafò M.M.","Song, Tailai (58500472100); Garza, Paolo (36909944300); Meo, Michela (57042401300); Munafò, Maurizio M. (7004859480)","58500472100; 36909944300; 57042401300; 7004859480","DeX: Deep learning-based throughput prediction for real-time communications with emphasis on traffic eXtremes","2024","Computer Networks","249","","110507","","","","2","10.1016/j.comnet.2024.110507","https://www.scopus.com/inward/record.uri?eid=2-s2.0-85193901444&doi=10.1016%2fj.comnet.2024.110507&partnerID=40&md5=3f28fcb6cf8ba18b4cbca00e0ba0dadb","Article","Final","","Scopus","2-s2.0-85193901444"
"Bhanu M.; Priya S.; Moreira J.M.; Chandra J.","Bhanu, Manish (57193497952); Priya, Shalini (57347311100); Moreira, João Mendes (55403959400); Chandra, Joydeep (57191950294)","57193497952; 57347311100; 55403959400; 57191950294","ST-AGP: Spatio-Temporal aggregator predictor model for multi-step taxi-demand prediction in cities","2023","Applied Intelligence","53","2","","2110","2132","22","2","10.1007/s10489-022-03475-7","https://www.scopus.com/inward/record.uri?eid=2-s2.0-85129439292&doi=10.1007%2fs10489-022-03475-7&partnerID=40&md5=edda5a83f95687ebf52374b7de031b03","Article","Final","","Scopus","2-s2.0-85129439292"
"Sumesh K.C.; Aryal J.; Ryu D.","Sumesh, K.C. (57221405447); Aryal, Jagannath (16315027400); Ryu, Dongryeol (57484743000)","57221405447; 16315027400; 57484743000","Automated Delineation of the Agricultural Fields using Multi-Task Deep Learning and Optical Satellite Imagery","2023","International Geoscience and Remote Sensing Symposium (IGARSS)","2023-July","","","2795","2798","3","1","10.1109/IGARSS52108.2023.10282141","https://www.scopus.com/inward/record.uri?eid=2-s2.0-85178378164&doi=10.1109%2fIGARSS52108.2023.10282141&partnerID=40&md5=39cc16773e03c716d43f15cd0bbf3d7e","Conference paper","Final","","Scopus","2-s2.0-85178378164"
"Huang L.; Yuan J.; Chen S.; Li X.","Huang, Longhao (58862877500); Yuan, Jidong (55648253000); Chen, Shengbo (56035428200); Li, Xu (56065869600)","58862877500; 55648253000; 56035428200; 56065869600","MDG: A Multi-Task Dynamic Graph Generation Framework for Multivariate Time Series Forecasting","2024","IEEE Transactions on Emerging Topics in Computational Intelligence","8","2","","1337","1349","12","0","10.1109/TETCI.2024.3352407","https://www.scopus.com/inward/record.uri?eid=2-s2.0-85184004906&doi=10.1109%2fTETCI.2024.3352407&partnerID=40&md5=a480e1bc8b6227a453fc03e122b1f168","Article","Final","","Scopus","2-s2.0-85184004906"
"Park H.J.; Kim Y.; Kim H.Y.","Park, Hyun Jun (57362809000); Kim, Youngjun (57363682100); Kim, Ha Young (57214326551)","57362809000; 57363682100; 57214326551","Stock market forecasting using a multi-task approach integrating long short-term memory and the random forest framework","2022","Applied Soft Computing","114","","108106","","","","76","10.1016/j.asoc.2021.108106","https://www.scopus.com/inward/record.uri?eid=2-s2.0-85120627694&doi=10.1016%2fj.asoc.2021.108106&partnerID=40&md5=f6504cb5f57965a76263e18224c25900","Article","Final","","Scopus","2-s2.0-85120627694"
"Shickel B.; Loftus T.J.; Ruppert M.; Upchurch G.R., Jr.; Ozrazgat-Baslanti T.; Rashidi P.; Bihorac A.","Shickel, Benjamin (57192316325); Loftus, Tyler J. (35332405100); Ruppert, Matthew (57189390903); Upchurch, Gilbert R. (7004592416); Ozrazgat-Baslanti, Tezcan (55812587100); Rashidi, Parisa (57203185850); Bihorac, Azra (6602479553)","57192316325; 35332405100; 57189390903; 7004592416; 55812587100; 57203185850; 6602479553","Dynamic predictions of postoperative complications from explainable, uncertainty-aware, and multi-task deep neural networks","2023","Scientific Reports","13","1","1224","","","","6","10.1038/s41598-023-27418-5","https://www.scopus.com/inward/record.uri?eid=2-s2.0-85146679174&doi=10.1038%2fs41598-023-27418-5&partnerID=40&md5=d7d9c0a4ba4cb406ab3cc9b07de643b0","Article","Final","All Open Access; Gold Open Access; Green Open Access","Scopus","2-s2.0-85146679174"
