"Authors","Author full names","Author(s) ID","Title","Year","Source title","Volume","Issue","Art. No.","Page start","Page end","Page count","Cited by","DOI","Link","Document Type","Publication Stage","Open Access","Source","EID"
"Karami R.; Yazdanpanah O.; Dolatshahi K.M.; Chang M.","Karami, Reza (59229366400); Yazdanpanah, Omid (55943079500); Dolatshahi, Kiarash M. (48761203100); Chang, Minwoo (55236835000)","59229366400; 55943079500; 48761203100; 55236835000","Hybrid stacked neural network empowered by novel loss function for structural response history prediction using input excitation and roof acceleration","2024","Engineering Applications of Artificial Intelligence","136","","108984","","","","5","10.1016/j.engappai.2024.108984","https://www.scopus.com/inward/record.uri?eid=2-s2.0-85199284641&doi=10.1016%2fj.engappai.2024.108984&partnerID=40&md5=9ee20c56178bf8b45431b0383b9fe4a6","Article","Final","","Scopus","2-s2.0-85199284641"
"Qin X.; Li F.; He C.; Pei R.; Zhang X.","Qin, Xiaofei (36183547200); Li, Fan (56901990500); He, Changxiang (23097637500); Pei, Ruiqi (59229080300); Zhang, Xuedian (34874077100)","36183547200; 56901990500; 23097637500; 59229080300; 34874077100","Improving visual grounding with multi-modal interaction and auto-regressive vertex generation","2024","Neurocomputing","598","","128227","","","","0","10.1016/j.neucom.2024.128227","https://www.scopus.com/inward/record.uri?eid=2-s2.0-85199263345&doi=10.1016%2fj.neucom.2024.128227&partnerID=40&md5=4a6931303bf3bfcecd3a2aaa6c46e85a","Article","Final","","Scopus","2-s2.0-85199263345"
"Han R.; Jiang H.; Wei M.; Guo R.","Han, Ruicong (59425673200); Jiang, He (57037425800); Wei, Mofan (57215092567); Guo, Rui (57933198300)","59425673200; 57037425800; 57215092567; 57933198300","Research on Joint Forecasting Technology of Cold, Heat, and Electricity Loads Based on Multi-Task Learning","2024","Electronics (Switzerland)","13","22","4396","","","","1","10.3390/electronics13224396","https://www.scopus.com/inward/record.uri?eid=2-s2.0-85210235225&doi=10.3390%2felectronics13224396&partnerID=40&md5=9df46109eda4f5496a24c99fdae90c91","Article","Final","","Scopus","2-s2.0-85210235225"
"Zhao C.; Wu W.; Zhang H.; Zhang R.; Zheng X.; Kong X.","Zhao, Chen (57303122500); Wu, Wei (58886970700); Zhang, Haoyi (57218389403); Zhang, Ruiyan (59187784400); Zheng, Xinyue (58886841400); Kong, Xiangzeng (35322504300)","57303122500; 58886970700; 57218389403; 59187784400; 58886841400; 35322504300","Sleep Stage Classification Via Multi-View Based Self-Supervised Contrastive Learning of EEG","2024","IEEE Journal of Biomedical and Health Informatics","28","12","","7068","7077","9","1","10.1109/JBHI.2024.3432633","https://www.scopus.com/inward/record.uri?eid=2-s2.0-85202747946&doi=10.1109%2fJBHI.2024.3432633&partnerID=40&md5=6b5870e506ab191ac4b6e164695a438a","Article","Final","","Scopus","2-s2.0-85202747946"
"Liu J.-J.; Yao J.-P.; Liu J.-H.; Wang Z.-Y.; Huang L.","Liu, Jing-Jing (59451416200); Yao, Jie-Peng (57211916608); Liu, Jin-Hang (58888560700); Wang, Zhong-Yi (55719857100); Huang, Lan (55548877200)","59451416200; 57211916608; 58888560700; 55719857100; 55548877200","Missing data imputation and classification of small sample missing time series data based on gradient penalized adversarial multi-task learning","2024","Applied Intelligence","54","3","","2528","2550","22","3","10.1007/s10489-024-05314-3","https://www.scopus.com/inward/record.uri?eid=2-s2.0-85185097793&doi=10.1007%2fs10489-024-05314-3&partnerID=40&md5=3df1c18f8be62d172d383c766fc8b1b3","Article","Final","","Scopus","2-s2.0-85185097793"
"Li P.; Fang J.; Chen W.; Liu A.; Chao P.","Li, Pengfei (57848223500); Fang, Junhua (56727133200); Chen, Wei (57087491500); Liu, An (17435039000); Chao, Pingfu (56727659300)","57848223500; 56727133200; 57087491500; 17435039000; 56727659300","Adversarial Spatial-Temporal Graph Network for Traffic Speed Prediction with Missing Values","2023","Lecture Notes in Computer Science (including subseries Lecture Notes in Artificial Intelligence and Lecture Notes in Bioinformatics)","13943 LNCS","","","380","395","15","2","10.1007/978-3-031-30637-2_25","https://www.scopus.com/inward/record.uri?eid=2-s2.0-85161659654&doi=10.1007%2f978-3-031-30637-2_25&partnerID=40&md5=0e4722adbbe39a408bf88705c195c11e","Conference paper","Final","","Scopus","2-s2.0-85161659654"
"","","","20th International Conference on Artificial Intelligence in Medicine, AIME 2022","2022","Lecture Notes in Computer Science (including subseries Lecture Notes in Artificial Intelligence and Lecture Notes in Bioinformatics)","13263 LNAI","","","","","440","0","","https://www.scopus.com/inward/record.uri?eid=2-s2.0-85135080837&partnerID=40&md5=d8ade5cf7a95ff00269c1b6a8e8de0db","Conference review","Final","","Scopus","2-s2.0-85135080837"
"Chatziparaskevas G.; Mademlis I.; Pitas I.","Chatziparaskevas, Georgios (59294005800); Mademlis, Ioannis (56436769200); Pitas, Ioannis (35569279700)","59294005800; 56436769200; 35569279700","Generative Representation Learning in Recurrent Neural Networks for Causal Timeseries Forecasting","2024","IEEE Transactions on Artificial Intelligence","5","12","","6412","6425","13","0","10.1109/TAI.2024.3446465","https://www.scopus.com/inward/record.uri?eid=2-s2.0-85201748000&doi=10.1109%2fTAI.2024.3446465&partnerID=40&md5=14b31c05e5028ae3455422c4cf8c1bd0","Article","Final","","Scopus","2-s2.0-85201748000"
"Le H.L.; Roh H.G.; Kim H.J.; Kwak J.T.","Le, Hoang Long (57222666065); Roh, Hong Gee (7005464560); Kim, Hyun Jeong (57191719203); Kwak, Jin Tae (57226305229)","57222666065; 7005464560; 57191719203; 57226305229","A 3D Multi-task Regression and Ordinal Regression Deep Neural Network for Collateral Imaging from Dynamic Susceptibility Contrast-Enhanced MR perfusion in Acute Ischemic Stroke","2022","Computer Methods and Programs in Biomedicine","225","","107071","","","","5","10.1016/j.cmpb.2022.107071","https://www.scopus.com/inward/record.uri?eid=2-s2.0-85139375209&doi=10.1016%2fj.cmpb.2022.107071&partnerID=40&md5=b665740a65dde7c5d55a92221bbf7118","Article","Final","","Scopus","2-s2.0-85139375209"
"Tian Z.; Liu W.; Zhang J.; Sun W.; Wu C.","Tian, Zhirui (57374129000); Liu, Weican (58178720100); Zhang, Jiahao (58811888300); Sun, Wenpu (59511408200); Wu, Chenye (55648102900)","57374129000; 58178720100; 58811888300; 59511408200; 55648102900","EDformer family: End-to-end multi-task load forecasting frameworks for day-ahead economic dispatch","2025","Applied Energy","383","","125319","","","","0","10.1016/j.apenergy.2025.125319","https://www.scopus.com/inward/record.uri?eid=2-s2.0-85214841800&doi=10.1016%2fj.apenergy.2025.125319&partnerID=40&md5=bd67e917a7cf79867285531879a8b477","Article","Final","","Scopus","2-s2.0-85214841800"
"Do T.-C.; Yang H.-J.; Kim S.-H.; Kho B.-G.; Park J.-K.","Do, Thanh-Cong (58576014900); Yang, Hyung-Jeong (7406566089); Kim, Soo-Hyung (23091127000); Kho, Bo-Gun (57202763008); Park, Jin-Kyung (57203764270)","58576014900; 7406566089; 23091127000; 57202763008; 57203764270","Multi-horizon event detection for in-hospital clinical deterioration using dual-channel graph attention network","2025","International Journal of Medical Informatics","195","","105745","","","","0","10.1016/j.ijmedinf.2024.105745","https://www.scopus.com/inward/record.uri?eid=2-s2.0-85211172616&doi=10.1016%2fj.ijmedinf.2024.105745&partnerID=40&md5=f2cdda8c074760641dc9aeec4312fdee","Article","Final","All Open Access; Hybrid Gold Open Access","Scopus","2-s2.0-85211172616"
"Corponi F.; Li B.M.; Anmella G.; Mas A.; Pacchiarotti I.; Valentí M.; Grande I.; Benabarre A.; Garriga M.; Vieta E.; Lawrie S.M.; Whalley H.C.; Hidalgo-Mazzei D.; Vergari A.","Corponi, Filippo (57195068257); Li, Bryan M. (57221149840); Anmella, Gerard (57207207030); Mas, Ariadna (57226123456); Pacchiarotti, Isabella (6506164168); Valentí, Marc (14024955800); Grande, Iria (36930279800); Benabarre, Antoni (57204866097); Garriga, Marina (56625679200); Vieta, Eduard (57208874880); Lawrie, Stephen M. (7006525184); Whalley, Heather C. (57200399438); Hidalgo-Mazzei, Diego (55773088300); Vergari, Antonio (57147788800)","57195068257; 57221149840; 57207207030; 57226123456; 6506164168; 14024955800; 36930279800; 57204866097; 56625679200; 57208874880; 7006525184; 57200399438; 55773088300; 57147788800","Automated mood disorder symptoms monitoring from multivariate time-series sensory data: getting the full picture beyond a single number","2024","Translational Psychiatry","14","1","161","","","","5","10.1038/s41398-024-02876-1","https://www.scopus.com/inward/record.uri?eid=2-s2.0-85188647900&doi=10.1038%2fs41398-024-02876-1&partnerID=40&md5=75b4a9294e25e5e0050b6cf0d3911035","Article","Final","All Open Access; Gold Open Access; Green Open Access","Scopus","2-s2.0-85188647900"
"Qin S.; Zhao J.; Xu J.; Wei M.","Qin, Shuo (58974813000); Zhao, Jian (57001565700); Xu, Jian (57792210000); Wei, Minjie (57224412616)","58974813000; 57001565700; 57792210000; 57224412616","Multivariate-load Forecasting of Integrated Energy System Based on Combined Multi-task Learning and Single-task Learning Model; [基于多任务学习和单任务学习组合模型的综合能源系统多元负荷预测]","2024","Dianwang Jishu/Power System Technology","48","4","","1510","1518","8","3","10.13335/j.1000-3673.pst.2023.0841","https://www.scopus.com/inward/record.uri?eid=2-s2.0-85189700138&doi=10.13335%2fj.1000-3673.pst.2023.0841&partnerID=40&md5=138585b6015383cef7ee14e623de6c51","Article","Final","","Scopus","2-s2.0-85189700138"
"Liu Y.; Zhang Z.; Qin S.; Bian J.","Liu, Yuxi (57219690229); Zhang, Zhenhao (57813832300); Qin, Shaowen (7202726989); Bian, Jiang (7103200005)","57219690229; 57813832300; 7202726989; 7103200005","Multi-Task Deep Neural Networks for Irregularly Sampled Multivariate Clinical Time Series","2024","Proceedings - 2024 IEEE 12th International Conference on Healthcare Informatics, ICHI 2024","","","","135","140","5","0","10.1109/ICHI61247.2024.00025","https://www.scopus.com/inward/record.uri?eid=2-s2.0-85203716766&doi=10.1109%2fICHI61247.2024.00025&partnerID=40&md5=3e121b2b9d0b1c5beadb31872ad62da0","Conference paper","Final","","Scopus","2-s2.0-85203716766"
"","","","KDD 2022 - Proceedings of the 28th ACM SIGKDD Conference on Knowledge Discovery and Data Mining","2022","Proceedings of the ACM SIGKDD International Conference on Knowledge Discovery and Data Mining","","","","","","4869","0","","https://www.scopus.com/inward/record.uri?eid=2-s2.0-85137252551&partnerID=40&md5=1f7af71628210d6df43b8394e9ec6094","Conference review","Final","","Scopus","2-s2.0-85137252551"
"Ma D.; Zhu J.; Song X.B.; Wang X.","Ma, Dongfang (23985697700); Zhu, Jiacheng (57222665595); Song, Xiang (Ben) (57072148200); Wang, Xin (57216497653)","23985697700; 57222665595; 57072148200; 57216497653","Traffic flow and speed forecasting through a Bayesian deep multi-linear relationship network","2023","Expert Systems with Applications","213","","119161","","","","11","10.1016/j.eswa.2022.119161","https://www.scopus.com/inward/record.uri?eid=2-s2.0-85141926037&doi=10.1016%2fj.eswa.2022.119161&partnerID=40&md5=fa2f488cbd260dbffc032e50acf57cd2","Article","Final","","Scopus","2-s2.0-85141926037"
"Orzechowski A.; Lugosch L.; Shu H.; Yang R.; Li W.; Meyer B.H.","Orzechowski, Alexander (58209210600); Lugosch, Loren (57197713717); Shu, Hao (58209210700); Yang, Raymond (58209502800); Li, Wei (58403466400); Meyer, Brett H. (8528575100)","58209210600; 57197713717; 58209210700; 58209502800; 58403466400; 8528575100","A data-driven framework for medium-term electric vehicle charging demand forecasting","2023","Energy and AI","14","","100267","","","","24","10.1016/j.egyai.2023.100267","https://www.scopus.com/inward/record.uri?eid=2-s2.0-85154621402&doi=10.1016%2fj.egyai.2023.100267&partnerID=40&md5=9262deccf125855d094eca288e036180","Article","Final","All Open Access; Gold Open Access","Scopus","2-s2.0-85154621402"
"Zhao P.; Xiao Y.; Lei Y.; Ren Y.; Xu Z.","Zhao, Peng (57192686487); Xiao, Yan (59143113100); Lei, Yuqing (57263803400); Ren, Yazhou (49964327400); Xu, Zenglin (22836748000)","57192686487; 59143113100; 57263803400; 49964327400; 22836748000","Interpretive Clinical Measurements Prediction and Diagnosis in ICU with Multi-Task Attention-Guided Sequential Feature Learning","2023","Proceedings of 2023 7th Asian Conference on Artificial Intelligence Technology, ACAIT 2023","","","","739","749","10","0","10.1109/ACAIT60137.2023.10528505","https://www.scopus.com/inward/record.uri?eid=2-s2.0-85194198013&doi=10.1109%2fACAIT60137.2023.10528505&partnerID=40&md5=acb6884e5c507993e81aa040cc90a9e8","Conference paper","Final","","Scopus","2-s2.0-85194198013"
"","","","22nd Joint European Conference on Machine Learning and Principles and Practice of Knowledge Discovery in Databases, ECML PKDD 2022","2023","Lecture Notes in Computer Science (including subseries Lecture Notes in Artificial Intelligence and Lecture Notes in Bioinformatics)","13717 LNAI","","","","","4095","0","","https://www.scopus.com/inward/record.uri?eid=2-s2.0-85151079061&partnerID=40&md5=92bdaf2b8e27ef050279d28ead05553f","Conference review","Final","","Scopus","2-s2.0-85151079061"
"Wang D.; Yan Y.; Qiu R.; Zhu Y.; Guan K.; Margenot A.; Tong H.","Wang, Dingsu (58339898300); Yan, Yuchen (57222727289); Qiu, Ruizhong (57933789700); Zhu, Yada (35323529600); Guan, Kaiyu (56382070400); Margenot, Andrew (56145435900); Tong, Hanghang (7201360533)","58339898300; 57222727289; 57933789700; 35323529600; 56382070400; 56145435900; 7201360533","Networked Time Series Imputation via Position-aware Graph Enhanced Variational Autoencoders","2023","Proceedings of the ACM SIGKDD International Conference on Knowledge Discovery and Data Mining","","","","2256","2268","12","19","10.1145/3580305.3599444","https://www.scopus.com/inward/record.uri?eid=2-s2.0-85171346881&doi=10.1145%2f3580305.3599444&partnerID=40&md5=3ff5a97f68f7c4012b10e67b637a3fc9","Conference paper","Final","All Open Access; Green Open Access; Hybrid Gold Open Access","Scopus","2-s2.0-85171346881"
"","","","10th International Work-Conference on the Interplay Between Natural and Artificial Computation, IWINAC 2024","2024","Lecture Notes in Computer Science (including subseries Lecture Notes in Artificial Intelligence and Lecture Notes in Bioinformatics)","14674 LNCS","","","","","1065","0","","https://www.scopus.com/inward/record.uri?eid=2-s2.0-85197125064&partnerID=40&md5=a7c1518e94091efd4da722ab8327e9e2","Conference review","Final","","Scopus","2-s2.0-85197125064"
"Wan C.; Li W.; Ding W.; Zhang Z.; Lu Q.; Qian L.; Xu J.; Lu J.; Cao R.; Ye B.; Lu S.","Wan, Chen (57222748586); Li, Wenzhong (24544580700); Ding, Wangxiang (57222745332); Zhang, Zhijie (57222657080); Lu, Qingning (57222746187); Qian, Lin (58351649800); Xu, Ji (57222743480); Lu, Jixiang (57206466502); Cao, Rongrong (58327188400); Ye, Baoliu (12792666700); Lu, Sanglu (7404227917)","57222748586; 24544580700; 57222745332; 57222657080; 57222746187; 58351649800; 57222743480; 57206466502; 58327188400; 12792666700; 7404227917","Multi-task sequence learning for performance prediction and KPI mining in database management system","2021","Information Sciences","568","","","1","12","11","6","10.1016/j.ins.2021.03.046","https://www.scopus.com/inward/record.uri?eid=2-s2.0-85103989333&doi=10.1016%2fj.ins.2021.03.046&partnerID=40&md5=dec087e22917ac4ffdbbe9336e40689f","Article","Final","","Scopus","2-s2.0-85103989333"
"","","","5th International Conference on Machine Learning, Optimization, and Data Science, LOD 2019","2019","Lecture Notes in Computer Science (including subseries Lecture Notes in Artificial Intelligence and Lecture Notes in Bioinformatics)","11943 LNCS","","","","","770","0","","https://www.scopus.com/inward/record.uri?eid=2-s2.0-85078492395&partnerID=40&md5=1f1aea0201a7a963eb1c5f7323a78082","Conference review","Final","","Scopus","2-s2.0-85078492395"
"","","","European Conference on Machine Learning and Principles and Practice of Knowledge Discovery in Databases, ECML PKDD 2021","2021","Lecture Notes in Computer Science (including subseries Lecture Notes in Artificial Intelligence and Lecture Notes in Bioinformatics)","12979 LNAI","","","","","3508","0","","https://www.scopus.com/inward/record.uri?eid=2-s2.0-85115682941&partnerID=40&md5=e01177abf404c5e92444fe7fbcdd1a18","Conference review","Final","","Scopus","2-s2.0-85115682941"
"Saeed A.; Ozcelebi T.; Lukkien J.; Van Erp J.; Trajanovski S.","Saeed, Aaqib (57201255062); Ozcelebi, Tanir (6507481211); Lukkien, Johan (6701399604); Van Erp, Jan (6603719358); Trajanovski, Stojan (36912112000)","57201255062; 6507481211; 6701399604; 6603719358; 36912112000","Model adaptation and personalization for physiological stress detection","2018","Proceedings - 2018 IEEE 5th International Conference on Data Science and Advanced Analytics, DSAA 2018","","","8631447","209","216","7","19","10.1109/DSAA.2018.00031","https://www.scopus.com/inward/record.uri?eid=2-s2.0-85062851088&doi=10.1109%2fDSAA.2018.00031&partnerID=40&md5=ca6abea0467b6bc808dedbbabfdebaac","Conference paper","Final","All Open Access; Green Open Access","Scopus","2-s2.0-85062851088"
"Dias Abreu G.; Pires L.F.; Campos L.C.D.; Goliatt L.","Dias Abreu, Gabriel (57268871300); Pires, Leticia F. (57211181929); Campos, Luciana C. D. (36845551800); Goliatt, Leonardo (57191839210)","57268871300; 57211181929; 36845551800; 57191839210","Multitask Learning for Predicting Natural Flows: A Case Study at Paraiba do Sul River","2021","Lecture Notes in Computer Science (including subseries Lecture Notes in Artificial Intelligence and Lecture Notes in Bioinformatics)","12981 LNAI","","","163","175","12","0","10.1007/978-3-030-86230-5_13","https://www.scopus.com/inward/record.uri?eid=2-s2.0-85115441262&doi=10.1007%2f978-3-030-86230-5_13&partnerID=40&md5=7f3ffb266d9dbd7b007bd6a7a05b860e","Conference paper","Final","","Scopus","2-s2.0-85115441262"
"Bejarano-Luque J.L.; Toril M.; Fernandez-Navarro M.; Gijon C.; Luna-Ramirez S.","Bejarano-Luque, Juan L. (57209246293); Toril, Matias (8860596800); Fernandez-Navarro, Mariano (6602231647); Gijon, Carolina (57211468831); Luna-Ramirez, Salvador (24475299900)","57209246293; 8860596800; 6602231647; 57211468831; 24475299900","A Deep-Learning Model for Estimating the Impact of Social Events on Traffic Demand on a Cell Basis","2021","IEEE Access","9","","9424560","71673","71686","13","15","10.1109/ACCESS.2021.3078113","https://www.scopus.com/inward/record.uri?eid=2-s2.0-85105876797&doi=10.1109%2fACCESS.2021.3078113&partnerID=40&md5=e5ddc6c67b59d0ce52f0b5b95151aa53","Article","Final","All Open Access; Gold Open Access","Scopus","2-s2.0-85105876797"
"Wang X.; Qi J.; Yang Y.; Yang P.","Wang, Xulong (57213424676); Qi, Jun (57188923015); Yang, Yun (15063715200); Yang, Po (57191521367)","57213424676; 57188923015; 15063715200; 57191521367","A survey of disease progression modeling techniques for alzheimer's diseases","2019","IEEE International Conference on Industrial Informatics (INDIN)","2019-July","","8972091","1237","1242","5","18","10.1109/INDIN41052.2019.8972091","https://www.scopus.com/inward/record.uri?eid=2-s2.0-85079031469&doi=10.1109%2fINDIN41052.2019.8972091&partnerID=40&md5=9308a16b802b334c80de828aaefdfc3c","Conference paper","Final","","Scopus","2-s2.0-85079031469"
"","","","European Conference on Machine Learning and Principles and Practice of Knowledge Discovery in Databases, ECML PKDD 2019","2020","Lecture Notes in Computer Science (including subseries Lecture Notes in Artificial Intelligence and Lecture Notes in Bioinformatics)","11908 LNAI","","","","","2284","0","","https://www.scopus.com/inward/record.uri?eid=2-s2.0-85084852089&partnerID=40&md5=3c68ae4d10204ed5c81e5085d9b77c26","Conference review","Final","","Scopus","2-s2.0-85084852089"
"Ziegler J.; McGranaghan R.M.","Ziegler, Jack (57221125930); McGranaghan, Ryan M. (55229795900)","57221125930; 55229795900","Harnessing expressive capacity of Machine Learning modeling to represent complex coupling of Earth's auroral space weather regimes","2021","Proceedings - 20th IEEE International Conference on Machine Learning and Applications, ICMLA 2021","","","","1189","1196","7","0","10.1109/ICMLA52953.2021.00193","https://www.scopus.com/inward/record.uri?eid=2-s2.0-85125841128&doi=10.1109%2fICMLA52953.2021.00193&partnerID=40&md5=5919aecf165949e4709046dbaf788fcc","Conference paper","Final","All Open Access; Green Open Access","Scopus","2-s2.0-85125841128"
"Xu R.-C.; Yan W.-W.; Wang G.-L.; Yang J.-C.; Zhang X.","Xu, Ren-Chao (57215608218); Yan, Wei-Wu (7402221606); Wang, Guo-Liang (57206908951); Yang, Jian-Cheng (57192458106); Zhang, Xi (57218401943)","57215608218; 7402221606; 57206908951; 57192458106; 57218401943","Time Series Forecasting Based on Seasonality Modeling and Its Application to Electricity Price Forecasting; [基于周期性建模的时间序列预测方法及电价预测研究]","2020","Zidonghua Xuebao/Acta Automatica Sinica","46","6","","1136","1144","8","18","10.16383/j.aas.c180712","https://www.scopus.com/inward/record.uri?eid=2-s2.0-85089094632&doi=10.16383%2fj.aas.c180712&partnerID=40&md5=ff86e92ebeb9000f7f0595d221ef1bf0","Article","Final","","Scopus","2-s2.0-85089094632"
"Schreiber J.; Sick B.","Schreiber, Jens (57205885709); Sick, Bernhard (7003387577)","57205885709; 7003387577","Emerging relation network and task embedding for multi-task regression problems","2020","Proceedings - International Conference on Pattern Recognition","","","9412476","2663","2670","7","9","10.1109/ICPR48806.2021.9412476","https://www.scopus.com/inward/record.uri?eid=2-s2.0-85110505007&doi=10.1109%2fICPR48806.2021.9412476&partnerID=40&md5=5076e8ef8efeacb92e25d2467a69078a","Conference paper","Final","All Open Access; Green Open Access","Scopus","2-s2.0-85110505007"
"Ye R.; Dai Q.","Ye, Rui (57194017910); Dai, Qun (35315440400)","57194017910; 35315440400","MultiTL-KELM: A multi-task learning algorithm for multi-step-ahead time series prediction","2019","Applied Soft Computing Journal","79","","","227","253","26","26","10.1016/j.asoc.2019.03.039","https://www.scopus.com/inward/record.uri?eid=2-s2.0-85063870927&doi=10.1016%2fj.asoc.2019.03.039&partnerID=40&md5=12472916ad8c0536439fd812009e82ff","Article","Final","","Scopus","2-s2.0-85063870927"
"Wang N.; Cao J.; Qi Q.; Gu Q.; Qian S.","Wang, Naixuan (57222154173); Cao, Jian (57218980017); Qi, Qing (57208839397); Gu, Qi (56583386700); Qian, Shiyou (55322690200)","57222154173; 57218980017; 57208839397; 56583386700; 55322690200","SONAS: A System to Obtain Insights on Web APIs from Stack Overflow","2021","Communications in Computer and Information Science","1330 CCIS","","","499","514","15","0","10.1007/978-981-16-2540-4_36","https://www.scopus.com/inward/record.uri?eid=2-s2.0-85111126630&doi=10.1007%2f978-981-16-2540-4_36&partnerID=40&md5=a4fb4d8a9ab52e55d91efac64143bf38","Conference paper","Final","","Scopus","2-s2.0-85111126630"
"","","","Workshops held at the 16th European Conference on Computer Vision, ECCV 2020","2020","Lecture Notes in Computer Science (including subseries Lecture Notes in Artificial Intelligence and Lecture Notes in Bioinformatics)","12540 LNCS","","","","","4363","0","","https://www.scopus.com/inward/record.uri?eid=2-s2.0-85101361856&partnerID=40&md5=a847ec50f33a2a69ec56782f9441a366","Conference review","Final","","Scopus","2-s2.0-85101361856"
"Xu D.; Cheng W.; Zong B.; Song D.; Ni J.; Yu W.; Liu Y.; Chen H.; Zhang X.","Xu, Dongkuan (57217726521); Cheng, Wei (57218967449); Zong, Bo (57203221691); Song, Dongjing (7402443773); Ni, Jingchao (56355100200); Yu, Wenchao (57188803893); Liu, Yanchi (35230234600); Chen, Haifeng (35241923100); Zhang, Xiang (55264772100)","57217726521; 57218967449; 57203221691; 7402443773; 56355100200; 57188803893; 35230234600; 35241923100; 55264772100","Tensorized LSTM with adaptive shared memory for learning trends in multivariate time series","2020","AAAI 2020 - 34th AAAI Conference on Artificial Intelligence","","","","1395","1402","7","30","","https://www.scopus.com/inward/record.uri?eid=2-s2.0-85086822252&partnerID=40&md5=a1e37bbb6ced0aec775e6cfc7ce4f645","Conference paper","Final","","Scopus","2-s2.0-85086822252"
"","","","European Conference on Machine Learning and Principles and Practice of Knowledge Discovery in Databases, ECML PKDD 2021","2021","Lecture Notes in Computer Science (including subseries Lecture Notes in Artificial Intelligence and Lecture Notes in Bioinformatics)","12975 LNAI","","","","","3508","0","","https://www.scopus.com/inward/record.uri?eid=2-s2.0-85115607999&partnerID=40&md5=943410491214681cef0a2884415f8bc2","Conference review","Final","","Scopus","2-s2.0-85115607999"
"Wang B.; Zhang L.; Ma H.; Wang H.; Wan S.; Bai X.","Wang, Bo (59173215600); Zhang, Liming (57193231218); Ma, Hengrui (57192423714); Wang, Hongxia (57210288106); Wan, Shaohua (35190004700); Bai, Xiaoqing (56288445600)","59173215600; 57193231218; 57192423714; 57210288106; 35190004700; 56288445600","Parallel LSTM-Based Regional Integrated Energy System Multienergy Source-Load Information Interactive Energy Prediction","2019","Complexity","2019","","7414318","","","","90","10.1155/2019/7414318","https://www.scopus.com/inward/record.uri?eid=2-s2.0-85076371034&doi=10.1155%2f2019%2f7414318&partnerID=40&md5=71876055b41be59c288ecfe659468a15","Article","Final","All Open Access; Gold Open Access","Scopus","2-s2.0-85076371034"
