"Authors","Author full names","Author(s) ID","Title","Year","Source title","Volume","Issue","Art. No.","Page start","Page end","Page count","Cited by","DOI","Link","Document Type","Publication Stage","Open Access","Source","EID"
"Huang M.; Ai Q.","Huang, Mei (59384430900); Ai, Qian (8704400400)","59384430900; 8704400400","Multi-task learning load time series situational prediction based on gated recurrent neural networks considering spatial correlations","2024","Frontiers in Energy Research","12","","1476613","","","","0","10.3389/fenrg.2024.1476613","https://www.scopus.com/inward/record.uri?eid=2-s2.0-85216486248&doi=10.3389%2ffenrg.2024.1476613&partnerID=40&md5=858c2bb1c740344ab160d52137ad7ea7","Article","Final","","Scopus","2-s2.0-85216486248"
"Wu S.; Peng D.","Wu, Shiling (57644250100); Peng, Dunlu (8556510900)","57644250100; 8556510900","Pre-SMATS: A multi-task learning based prediction model for small multi-stage seasonal time series","2022","Expert Systems with Applications","201","","117121","","","","9","10.1016/j.eswa.2022.117121","https://www.scopus.com/inward/record.uri?eid=2-s2.0-85128942582&doi=10.1016%2fj.eswa.2022.117121&partnerID=40&md5=084d0072c1f82054f8dcecf440567608","Article","Final","","Scopus","2-s2.0-85128942582"
"Liang W.; Zhang K.; Cao P.; Liu X.; Yang J.; Zaiane O.","Liang, Wei (59045214000); Zhang, Kai (57307411800); Cao, Peng (59438413100); Liu, Xiaoli (57190119226); Yang, Jinzhu (14829817400); Zaiane, Osmar (6602849837)","59045214000; 57307411800; 59438413100; 57190119226; 14829817400; 6602849837","Rethinking modeling Alzheimer's disease progression from a multi-task learning perspective with deep recurrent neural network","2021","Computers in Biology and Medicine","138","","104935","","","","27","10.1016/j.compbiomed.2021.104935","https://www.scopus.com/inward/record.uri?eid=2-s2.0-85117153572&doi=10.1016%2fj.compbiomed.2021.104935&partnerID=40&md5=ecdce97e94920c072d2efacfcc876455","Article","Final","","Scopus","2-s2.0-85117153572"
"Zhang Z.; Xie F.; Zhao X.; Zhou B.; Chen J.; Tian L.","Zhang, Zhong (57258488300); Xie, Feng (57869151400); Zhao, Xuechen (57868819000); Zhou, Bin (55501961000); Chen, Jian (57223440980); Tian, Lei (57933740600)","57258488300; 57869151400; 57868819000; 55501961000; 57223440980; 57933740600","Multitask Learning Neural Networks for Pandemic Prediction with Public Stance Enhancement","2022","Proceedings - International Conference on Tools with Artificial Intelligence, ICTAI","2022-October","","","1262","1270","8","1","10.1109/ICTAI56018.2022.00191","https://www.scopus.com/inward/record.uri?eid=2-s2.0-85156089787&doi=10.1109%2fICTAI56018.2022.00191&partnerID=40&md5=141cd817598d8de626c246153efa2d70","Conference paper","Final","","Scopus","2-s2.0-85156089787"
"Cheng J.; Huang K.; Zheng Z.","Cheng, Jiezhu (57219584963); Huang, Kaizhu (13403476100); Zheng, Zibin (25224189400)","57219584963; 13403476100; 25224189400","Fitting Imbalanced Uncertainties in Multi-output Time Series Forecasting","2023","ACM Transactions on Knowledge Discovery from Data","17","7","102","","","","1","10.1145/3584704","https://www.scopus.com/inward/record.uri?eid=2-s2.0-85164280448&doi=10.1145%2f3584704&partnerID=40&md5=6fa8b9763fdbbcd0d8397a7ad085f094","Article","Final","","Scopus","2-s2.0-85164280448"
"Chi C.-Y.; Ao S.; Winkler A.; Fu K.-C.; Xu J.; Ho Y.-L.; Huang C.-H.; Soltani R.","Chi, Chien-Yu (57216705595); Ao, Shuang (57270119500); Winkler, Adrian (57270423600); Fu, Kuan-Chun (57270576900); Xu, Jie (57269963300); Ho, Yi-Lwun (7402554868); Huang, Chien-Hua (36063485900); Soltani, Rohollah (57219587079)","57216705595; 57270119500; 57270423600; 57270576900; 57269963300; 7402554868; 36063485900; 57219587079","Predicting the mortality and readmission of in-hospital cardiac arrest patients with electronic health records:a machine learning approach","2021","Journal of Medical Internet Research","23","9","e27798","","","","10","10.2196/27798","https://www.scopus.com/inward/record.uri?eid=2-s2.0-85115635242&doi=10.2196%2f27798&partnerID=40&md5=8121696ae32268479e4059789705eedc","Article","Final","All Open Access; Gold Open Access; Green Open Access","Scopus","2-s2.0-85115635242"
"","","","9th China Health Information Processing Conference, CHIP 2023","2024","Communications in Computer and Information Science","1993 CCIS","","","","","430","0","","https://www.scopus.com/inward/record.uri?eid=2-s2.0-85186647964&partnerID=40&md5=260914bfd3d71ab837e01a09a54622db","Conference review","Final","","Scopus","2-s2.0-85186647964"
"Yan S.; Yao X.; Sun J.; Huang W.; Yang L.; Zhang C.; Gao B.; Yang J.; Yun W.; Zhu D.","Yan, Shuai (57214758758); Yao, Xiaochuang (56085211600); Sun, Jialin (58619445200); Huang, Weiming (57199323799); Yang, Longshan (57192695556); Zhang, Chao (56401277900); Gao, Bingbo (36246121200); Yang, Jianyu (57056765100); Yun, Wenju (8406695200); Zhu, Dehai (8903358300)","57214758758; 56085211600; 58619445200; 57199323799; 57192695556; 56401277900; 36246121200; 57056765100; 8406695200; 8903358300","TSANet: A deep learning framework for the delineation of agricultural fields utilizing satellite image time series","2024","Computers and Electronics in Agriculture","220","","108902","","","","4","10.1016/j.compag.2024.108902","https://www.scopus.com/inward/record.uri?eid=2-s2.0-85189936289&doi=10.1016%2fj.compag.2024.108902&partnerID=40&md5=353ff1580b575e2a74279f751cab18f5","Article","Final","","Scopus","2-s2.0-85189936289"
"Chen D.; Zang H.; Liu J.; Wei Z.; Sun G.; Li X.","Chen, Dianhao (57226285766); Zang, Haixiang (56870889000); Liu, Jingxuan (58179623000); Wei, Zhinong (7402258961); Sun, Guoqiang (9236400000); Li, Xinxin (58815427700)","57226285766; 56870889000; 58179623000; 7402258961; 9236400000; 58815427700","Multi-step Prediction of Photovoltaic Power Based on Multi-view Features Extraction and Multi-task Learning; [基于多视角特征提取与多任务学习的光伏功率多步预测]","2024","Gaodianya Jishu/High Voltage Engineering","50","9","","3924","3933","9","1","10.13336/j.1003-6520.hve.20232392","https://www.scopus.com/inward/record.uri?eid=2-s2.0-85205978452&doi=10.13336%2fj.1003-6520.hve.20232392&partnerID=40&md5=4010d924cc8bd78e0659e8a5e4fe59c9","Article","Final","","Scopus","2-s2.0-85205978452"
"Kim G.; Lim H.; Kim Y.; Kwon O.; Choi J.-H.","Kim, Gihyeon (57880759100); Lim, Heeryung (58072410100); Kim, Yunsoo (57205578025); Kwon, Oran (55713470100); Choi, Jang-Hwan (55850525400)","57880759100; 58072410100; 57205578025; 55713470100; 55850525400","Intra-person multi-task learning method for chronic-disease prediction","2023","Scientific Reports","13","1","1069","","","","4","10.1038/s41598-023-28383-9","https://www.scopus.com/inward/record.uri?eid=2-s2.0-85146603326&doi=10.1038%2fs41598-023-28383-9&partnerID=40&md5=93bc1c1e0acc4a70331fbaf0d3119ad5","Article","Final","All Open Access; Gold Open Access; Green Open Access","Scopus","2-s2.0-85146603326"
"Xing Y.; Hu Z.; Hang P.; Lv C.","Xing, Yang (57194045082); Hu, Zhongxu (57198788271); Hang, Peng (57156230600); Lv, Chen (36860537400)","57194045082; 57198788271; 57156230600; 36860537400","Learning from the Dark Side: A Parallel Time Series Modelling Framework for Forecasting and Fault Detection on Intelligent Vehicles","2024","IEEE Transactions on Intelligent Vehicles","9","2","","3205","3219","14","2","10.1109/TIV.2023.3342648","https://www.scopus.com/inward/record.uri?eid=2-s2.0-85180299133&doi=10.1109%2fTIV.2023.3342648&partnerID=40&md5=dbafcd8e0b4a4c46f70164ab075af997","Article","Final","All Open Access; Green Open Access","Scopus","2-s2.0-85180299133"
"Li X.; Ma X.; Xiao F.; Xiao C.; Wang F.; Zhang S.","Li, Xuechen (57223992070); Ma, Xinfang (15046655500); Xiao, Fengchao (56857129000); Xiao, Cong (56374459100); Wang, Fei (56835862600); Zhang, Shicheng (10038957600)","57223992070; 15046655500; 56857129000; 56374459100; 56835862600; 10038957600","Multistep Ahead Multiphase Production Prediction of Fractured Wells Using Bidirectional Gated Recurrent Unit and Multitask Learning","2023","SPE Journal","28","1","","381","400","19","11","10.2118/212290-PA","https://www.scopus.com/inward/record.uri?eid=2-s2.0-85152196835&doi=10.2118%2f212290-PA&partnerID=40&md5=af8827a655b39198573f7523b767f228","Article","Final","","Scopus","2-s2.0-85152196835"
"Nikentari N.; Wei H.-L.","Nikentari, Nerfita (57202789964); Wei, Hua-Liang (8346425700)","57202789964; 8346425700","Multi-Task Learning for Time Series Forecasting Using NARMAX-LSTM","2022","2022 27th International Conference on Automation and Computing: Smart Systems and Manufacturing, ICAC 2022","","","","","","","3","10.1109/ICAC55051.2022.9911071","https://www.scopus.com/inward/record.uri?eid=2-s2.0-85141212518&doi=10.1109%2fICAC55051.2022.9911071&partnerID=40&md5=f3eb3f28d086ac523de9fe022524401c","Conference paper","Final","","Scopus","2-s2.0-85141212518"
"Li C.; Jiang W.; Yang Y.; Pan S.; Huang G.; Guo L.","Li, Chaojie (57202605973); Jiang, Wensen (57450802000); Yang, Yin (35148742800); Pan, Shirui (55522732400); Huang, Gang (57550751700); Guo, Lijie (57450260000)","57202605973; 57450802000; 35148742800; 55522732400; 57550751700; 57450260000","Predicting Best-Selling New Products in a Major Promotion Campaign Through Graph Convolutional Networks","2023","IEEE Transactions on Neural Networks and Learning Systems","34","11","","9102","9115","13","3","10.1109/TNNLS.2022.3155690","https://www.scopus.com/inward/record.uri?eid=2-s2.0-85127046244&doi=10.1109%2fTNNLS.2022.3155690&partnerID=40&md5=26f3e775512f924fc722e13e311021db","Article","Final","","Scopus","2-s2.0-85127046244"
"Zeng Q.; Zhuang Z.; Yang H.-N.; Quan W.; Yin Z.; Pan Q.; Liang J.","Zeng, Qimiao (57828221000); Zhuang, Zhehao (58771654300); Yang, Hao-Nan (58533878600); Quan, Wei (57202672544); Yin, Zhifan (57828090200); Pan, Qing (58160973100); Liang, Jie (57431338400)","57828221000; 58771654300; 58533878600; 57202672544; 57828090200; 58160973100; 57431338400","A Hybrid MTL Framework with LSTM and Attention for Predicting Concurrent CDN Traffic","2024","IEEE International Conference on Communications","","","","1957","1962","5","1","10.1109/ICC51166.2024.10622391","https://www.scopus.com/inward/record.uri?eid=2-s2.0-85202850019&doi=10.1109%2fICC51166.2024.10622391&partnerID=40&md5=3d1281a6b3715c2434601d407f55aead","Conference paper","Final","","Scopus","2-s2.0-85202850019"
"Fan C.; Lu H.; Huang A.","Fan, Chenyou (57191411277); Lu, Hengyang (57188819636); Huang, Aimin (58683064100)","57191411277; 57188819636; 58683064100","A Novel Differentiable Rank Learning Method Towards Stock Movement Quantile Forecasting","2023","Frontiers in Artificial Intelligence and Applications","372","","","653","659","6","1","10.3233/FAIA230328","https://www.scopus.com/inward/record.uri?eid=2-s2.0-85175786210&doi=10.3233%2fFAIA230328&partnerID=40&md5=bea07e1e49c0e459204b27838bad5546","Conference paper","Final","All Open Access; Hybrid Gold Open Access","Scopus","2-s2.0-85175786210"
"Wang H.; Li Y.; Yan J.; Xiao W.; Han S.; Liu Y.","Wang, Han (58139513100); Li, Yunzhou (59489395400); Yan, Jie (55467807500); Xiao, Wuyang (59488539000); Han, Shuang (36084363500); Liu, Yongqian (55928266200)","58139513100; 59489395400; 55467807500; 59488539000; 36084363500; 55928266200","A novel minute-scale prediction method of incoming wind conditions with limited LiDAR data","2025","Renewable Energy","240","","122235","","","","0","10.1016/j.renene.2024.122235","https://www.scopus.com/inward/record.uri?eid=2-s2.0-85213287277&doi=10.1016%2fj.renene.2024.122235&partnerID=40&md5=69a85e104463fb911c5cf8213051c6e9","Article","Final","","Scopus","2-s2.0-85213287277"
"Khalil M.; McGough S.; Pourmirza Z.; Pazhoohesh M.; Walker S.","Khalil, Mohamad (57638836100); McGough, Stephen (6602384857); Pourmirza, Zoya (55332681200); Pazhoohesh, Mehdi (42062058100); Walker, Sara (37105142200)","57638836100; 6602384857; 55332681200; 42062058100; 37105142200","A Multi-task Learning Approach to Short-Term Load-Forecasting for Multiple Energy Loads in an Educational Building","2022","2022 IEEE International Conference on Advances in Electrical Engineering and Computer Applications, AEECA 2022","","","","357","363","6","2","10.1109/AEECA55500.2022.9919082","https://www.scopus.com/inward/record.uri?eid=2-s2.0-85141377040&doi=10.1109%2fAEECA55500.2022.9919082&partnerID=40&md5=17742f6bdc4db6517b3af32669f219ba","Conference paper","Final","","Scopus","2-s2.0-85141377040"
"Han X.; Huang Y.; Pan Z.; Li W.; Hu Y.; Lin G.","Han, Xiao (58598407400); Huang, Yongjie (58551720400); Pan, Zhisong (8426014800); Li, Wei (57213858117); Hu, Yahao (58249548300); Lin, Gengyou (58296085100)","58598407400; 58551720400; 8426014800; 57213858117; 58249548300; 58296085100","Multi-Task Time Series Forecasting Based on Graph Neural Networks","2023","Entropy","25","8","1136","","","","6","10.3390/e25081136","https://www.scopus.com/inward/record.uri?eid=2-s2.0-85168860312&doi=10.3390%2fe25081136&partnerID=40&md5=c7384a7e92bb7c4fe62bac7dd02f4692","Article","Final","All Open Access; Gold Open Access; Green Open Access","Scopus","2-s2.0-85168860312"
"Mittendorf M.; Nielsen U.D.; Bingham H.B.; Storhaug G.","Mittendorf, Malte (57218400102); Nielsen, Ulrik Dam (57224792997); Bingham, Harry B. (7007070600); Storhaug, Gaute (55907185400)","57218400102; 57224792997; 7007070600; 55907185400","Sea state identification using machine learning—A comparative study based on in-service data from a container vessel","2022","Marine Structures","85","","103274","","","","26","10.1016/j.marstruc.2022.103274","https://www.scopus.com/inward/record.uri?eid=2-s2.0-85134880379&doi=10.1016%2fj.marstruc.2022.103274&partnerID=40&md5=0dc7af154d303ad3f2c5a64cfacbb75e","Article","Final","All Open Access; Green Open Access","Scopus","2-s2.0-85134880379"
"Wang H.; Peng C.; Liao B.; Cao X.; Li S.","Wang, Hao (58608152600); Peng, Chen (55605931300); Liao, Bolin (55834248600); Cao, Xinwei (57215652987); Li, Shuai (58667863100)","58608152600; 55605931300; 55834248600; 57215652987; 58667863100","Wind Power Forecasting Based on WaveNet and Multitask Learning","2023","Sustainability (Switzerland)","15","14","10816","","","","5","10.3390/su151410816","https://www.scopus.com/inward/record.uri?eid=2-s2.0-85166233982&doi=10.3390%2fsu151410816&partnerID=40&md5=20241cb01d60b04e4c4aeccee9fc949c","Article","Final","All Open Access; Gold Open Access; Green Open Access","Scopus","2-s2.0-85166233982"
"Luo Y.; Chen N.; Huang Z.; Zheng J.; Qin S.; Wu D.O.","Luo, Yongcan (58535033500); Chen, Ning (57190396366); Huang, Zhanxiang (57829719800); Zheng, Jiahao (57219853445); Qin, Shuxin (58390075700); Wu, Dapeng Oliver (12807474900)","58535033500; 57190396366; 57829719800; 57219853445; 58390075700; 12807474900","Pyramid Transformer for Multivariate Time Series Anomaly Detection in IoUT","2024","Proceedings - 2024 IEEE International Conference on Smart Internet of Things, SmartIoT 2024","","","","533","539","6","0","10.1109/SmartIoT62235.2024.00088","https://www.scopus.com/inward/record.uri?eid=2-s2.0-85216536374&doi=10.1109%2fSmartIoT62235.2024.00088&partnerID=40&md5=c6afadf183cf9d78520c5ce5245f0768","Conference paper","Final","","Scopus","2-s2.0-85216536374"
"Schreiber J.; Sick B.","Schreiber, Jens (57205885709); Sick, Bernhard (7003387577)","57205885709; 7003387577","Multi-Task Autoencoders and Transfer Learning for Day-Ahead Wind and Photovoltaic Power Forecasts","2022","Energies","15","21","8062","","","","7","10.3390/en15218062","https://www.scopus.com/inward/record.uri?eid=2-s2.0-85141868640&doi=10.3390%2fen15218062&partnerID=40&md5=5186c065ce75767c452ac0a93e84acaf","Article","Final","All Open Access; Gold Open Access; Green Open Access","Scopus","2-s2.0-85141868640"
"Liu R.; Gao M.; Wu Y.; Zeng J.; Zhang J.; Gao J.","Liu, Ruiqi (59092927500); Gao, Min (35233111900); Wu, Yujiang (58668159600); Zeng, Jie (57209746686); Zhang, Jia (58748662500); Gao, Jinyong (57742950900)","59092927500; 35233111900; 58668159600; 57209746686; 58748662500; 57742950900","DT-MUSA: Dual Transfer Driven Multi-source Domain Adaptation for WEEE Reverse Logistics Return Prediction","2024","Lecture Notes of the Institute for Computer Sciences, Social-Informatics and Telecommunications Engineering, LNICST","563 LNICST","","","365","384","19","0","10.1007/978-3-031-54531-3_20","https://www.scopus.com/inward/record.uri?eid=2-s2.0-85187796447&doi=10.1007%2f978-3-031-54531-3_20&partnerID=40&md5=0be6dfc5f3a547dae8ee44970c0c3171","Conference paper","Final","","Scopus","2-s2.0-85187796447"
"","","","17th International Conference on Hybrid Artificial Intelligence Systems, HAIS 2022","2022","Lecture Notes in Computer Science (including subseries Lecture Notes in Artificial Intelligence and Lecture Notes in Bioinformatics)","13469 LNAI","","","","","516","0","","https://www.scopus.com/inward/record.uri?eid=2-s2.0-85139064586&partnerID=40&md5=bce4f72f329f50d1da20566983ab335e","Conference review","Final","","Scopus","2-s2.0-85139064586"
"Xia S.; Chu L.; Pei L.; Yu W.; Qiu R.C.","Xia, Songpengcheng (57218266603); Chu, Lei (57204648576); Pei, Ling (35099082600); Yu, Wenxian (7403913710); Qiu, Robert C. (57732575500)","57218266603; 57204648576; 35099082600; 7403913710; 57732575500","A Boundary Consistency-Aware Multitask Learning Framework for Joint Activity Segmentation and Recognition With Wearable Sensors","2023","IEEE Transactions on Industrial Informatics","19","3","","2984","2996","12","10","10.1109/TII.2022.3173957","https://www.scopus.com/inward/record.uri?eid=2-s2.0-85132516538&doi=10.1109%2fTII.2022.3173957&partnerID=40&md5=22db1c3ac1e71cc0cad03422aa56b554","Article","Final","","Scopus","2-s2.0-85132516538"
"Warrier S.; Rutter E.M.; Flores K.B.","Warrier, Sangeeta (57326991800); Rutter, Erica M. (37102556300); Flores, Kevin B. (43461192400)","57326991800; 37102556300; 43461192400","Multitask neural networks for predicting bladder pressure with time series data","2022","Biomedical Signal Processing and Control","72","","103298","","","","6","10.1016/j.bspc.2021.103298","https://www.scopus.com/inward/record.uri?eid=2-s2.0-85118705004&doi=10.1016%2fj.bspc.2021.103298&partnerID=40&md5=361ce2eb649a3ee7b95626317459b0f0","Article","Final","","Scopus","2-s2.0-85118705004"
"Sakharova T.; Mao S.; Osadchuk M.","Sakharova, Tatyana (36888165400); Mao, Siqi (57425375700); Osadchuk, Mikhail (6701741609)","36888165400; 57425375700; 6701741609","Updated Models of Alzheimer's Disease with Deep Neural Networks","2024","Journal of Alzheimer's Disease","100","2","","685","697","12","0","10.3233/JAD-240183","https://www.scopus.com/inward/record.uri?eid=2-s2.0-85199163024&doi=10.3233%2fJAD-240183&partnerID=40&md5=ce6c6c612b6f1830acb54e51c227995f","Article","Final","","Scopus","2-s2.0-85199163024"
"Hema P.; Babu U.R.; Manigandan E.; Rajesh Kumar A.; Devireddy N.; Rastogi R.","Hema, P. (57679429700); Babu, Uppara Raghu (58616314400); Manigandan, E. (58617123600); Rajesh Kumar, A. (58148936800); Devireddy, Nagamalleswari (57207250608); Rastogi, Ravi (55598718600)","57679429700; 58616314400; 58617123600; 58148936800; 57207250608; 55598718600","Empirical Analysis of Rainfall Prediction System using an DGRNN-SAM Approach","2023","Proceedings of the 5th International Conference on Inventive Research in Computing Applications, ICIRCA 2023","","","","790","795","5","1","10.1109/ICIRCA57980.2023.10220938","https://www.scopus.com/inward/record.uri?eid=2-s2.0-85172249715&doi=10.1109%2fICIRCA57980.2023.10220938&partnerID=40&md5=591c083aaaa133751e16b882b9f0c311","Conference paper","Final","","Scopus","2-s2.0-85172249715"
"","","","Workshop on Research and Applications of Foundation Models for Data Mining and Affective Computing, RAFDA 2024 and International Workshop on Temporal Analytics, IWTA 2024 held in conjunction with the 27th Pacific-Asia Conference on Knowledge Discovery and Data Mining, PAKDD 2023","2024","Lecture Notes in Computer Science (including subseries Lecture Notes in Artificial Intelligence and Lecture Notes in Bioinformatics)","14658 LNAI","","","","","173","0","","https://www.scopus.com/inward/record.uri?eid=2-s2.0-85192367686&partnerID=40&md5=509c4e9cf4e1d6d784e4552f22526023","Conference review","Final","","Scopus","2-s2.0-85192367686"
"","","","22nd Joint European Conference on Machine Learning and Principles and Practice of Knowledge Discovery in Databases, ECML PKDD 2022","2023","Lecture Notes in Computer Science (including subseries Lecture Notes in Artificial Intelligence and Lecture Notes in Bioinformatics)","13715 LNAI","","","","","4095","0","","https://www.scopus.com/inward/record.uri?eid=2-s2.0-85151086879&partnerID=40&md5=5ad8ab6cfade83680e431e79cda97c9b","Conference review","Final","","Scopus","2-s2.0-85151086879"
"Zhang Y.; Li S.; Zhang A.; An X.","Zhang, Yizong (57900229100); Li, Shaobo (7409243297); Zhang, Ansi (57201125545); An, Xue (58984363600)","57900229100; 7409243297; 57201125545; 58984363600","FW-UAV fault diagnosis based on knowledge complementary network under small sample","2024","Mechanical Systems and Signal Processing","215","","111418","","","","3","10.1016/j.ymssp.2024.111418","https://www.scopus.com/inward/record.uri?eid=2-s2.0-85190242190&doi=10.1016%2fj.ymssp.2024.111418&partnerID=40&md5=42168074cb4c795a97bdaff023c7347d","Article","Final","","Scopus","2-s2.0-85190242190"
"Cen S.; Lim C.G.","Cen, Senfeng (57454896900); Lim, Chang Gyoon (7403654370)","57454896900; 7403654370","Multi-Task Learning of the PatchTCN-TST Model for Short-Term Multi-Load Energy Forecasting Considering Indoor Environments in a Smart Building","2024","IEEE Access","12","","","19553","19568","15","7","10.1109/ACCESS.2024.3355448","https://www.scopus.com/inward/record.uri?eid=2-s2.0-85182928877&doi=10.1109%2fACCESS.2024.3355448&partnerID=40&md5=2471a1eef72eecf743b24e5c4017bf6b","Article","Final","All Open Access; Gold Open Access","Scopus","2-s2.0-85182928877"
"Jia D.; Cheng C.; Shen S.; Ning L.","Jia, Duo (57194393773); Cheng, Changxiu (15839192900); Shen, Shi (56991897300); Ning, Lixin (57186245900)","57194393773; 15839192900; 56991897300; 57186245900","Multitask Deep Learning Framework for Spatiotemporal Fusion of NDVI","2022","IEEE Transactions on Geoscience and Remote Sensing","60","","","","","","20","10.1109/TGRS.2021.3140144","https://www.scopus.com/inward/record.uri?eid=2-s2.0-85122581081&doi=10.1109%2fTGRS.2021.3140144&partnerID=40&md5=c19c60e59a4fdd558d8dc93d3fa8506a","Article","Final","","Scopus","2-s2.0-85122581081"
"Lu N.; Ouyang Q.; Huang L.; Wang Z.","Lu, Nan (58627480600); Ouyang, Quan (56383449900); Huang, Lianghui (57191923411); Wang, Zhisheng (55978365300)","58627480600; 56383449900; 57191923411; 55978365300","Capacity Prediction of Lithium-ion Batteries Based on Multi-task LSTM with Attention Mechanism; [基于注意力机制和多任务 LSTM 的锂电池容量预测方法]","2022","Journal of Electrical Engineering (China)","17","4","","41","50","9","1","10.11985/2022.04.006","https://www.scopus.com/inward/record.uri?eid=2-s2.0-85172933258&doi=10.11985%2f2022.04.006&partnerID=40&md5=c4a4f1ecc3f082b9819cee7881a7e2fe","Article","Final","","Scopus","2-s2.0-85172933258"
"","","","10th International Work-Conference on the Interplay Between Natural and Artificial Computation, IWINAC 2024","2024","Lecture Notes in Computer Science (including subseries Lecture Notes in Artificial Intelligence and Lecture Notes in Bioinformatics)","14675 LNCS","","","","","1065","0","","https://www.scopus.com/inward/record.uri?eid=2-s2.0-85197146574&partnerID=40&md5=98aef11ad3f0e6935171eedeb209b885","Conference review","Final","","Scopus","2-s2.0-85197146574"
"Bao X.; Liu Y.; Liu B.; Liu H.; Wang Y.","Bao, Xiang (58591687000); Liu, Yuefeng (56002608700); Liu, Bo (57223840110); Liu, Haofeng (58171529200); Wang, Yue (56301578700)","58591687000; 56002608700; 57223840110; 58171529200; 56301578700","Multi-State Online Estimation of Lithium-Ion Batteries Based on Multi-Task Learning","2023","Energies","16","7","3002","","","","8","10.3390/en16073002","https://www.scopus.com/inward/record.uri?eid=2-s2.0-85152766324&doi=10.3390%2fen16073002&partnerID=40&md5=4a54dbd773c8ccc8a56379394bdb99ea","Article","Final","All Open Access; Gold Open Access","Scopus","2-s2.0-85152766324"
"Yang M.; Dave D.; Erraguntla M.; Cote G.L.; Gutierrez-Osuna R.","Yang, Mu (57313921100); Dave, Darpit (57208529171); Erraguntla, Madhav (6602636473); Cote, Gerard L. (24429621800); Gutierrez-Osuna, Ricardo (6701926247)","57313921100; 57208529171; 6602636473; 24429621800; 6701926247","JOINT HYPOGLYCEMIA PREDICTION AND GLUCOSE FORECASTING VIA DEEP MULTI-TASK LEARNING","2022","ICASSP, IEEE International Conference on Acoustics, Speech and Signal Processing - Proceedings","2022-May","","","1136","1140","4","8","10.1109/ICASSP43922.2022.9746129","https://www.scopus.com/inward/record.uri?eid=2-s2.0-85131261841&doi=10.1109%2fICASSP43922.2022.9746129&partnerID=40&md5=1af9f9ed1bca353ec4cd8867b92ae156","Conference paper","Final","","Scopus","2-s2.0-85131261841"
"Yang L.; Gao T.; Wei W.; Dai M.; Fang C.; Duan J.","Yang, Luxuan (57362453300); Gao, Ting (55222277200); Wei, Wei (57219692634); Dai, Min (57219588806); Fang, Cheng (57679374500); Duan, Jinqiao (7202785947)","57362453300; 55222277200; 57219692634; 57219588806; 57679374500; 7202785947","Multi-task meta label correction for time series prediction","2024","Pattern Recognition","150","","110319","","","","2","10.1016/j.patcog.2024.110319","https://www.scopus.com/inward/record.uri?eid=2-s2.0-85185263711&doi=10.1016%2fj.patcog.2024.110319&partnerID=40&md5=6815acc3a82fb00b92cd8330d7a3b7ac","Article","Final","All Open Access; Green Open Access","Scopus","2-s2.0-85185263711"
