"Authors","Author full names","Author(s) ID","Title","Year","Source title","Volume","Issue","Art. No.","Page start","Page end","Page count","Cited by","DOI","Link","Document Type","Publication Stage","Open Access","Source","EID"
"Liu Y.; Yu Y.; Wang L.; Nyima T.; Zhaxi N.; Huang H.; Deng Q.","Liu, Ying (56101457900); Yu, Yongbin (16320294000); Wang, Lin (53664889800); Nyima, Tashi (57497896400); Zhaxi, Nima (57217101239); Huang, Hang (57221082167); Deng, Quanxin (57213186489)","56101457900; 16320294000; 53664889800; 57497896400; 57217101239; 57221082167; 57213186489","Classification of Tank Images Using Convolutional Neural Network","2020","Proceedings of 2020 IEEE 4th Information Technology, Networking, Electronic and Automation Control Conference, ITNEC 2020","","","9085151","210","214","4","2","10.1109/ITNEC48623.2020.9085151","https://www.scopus.com/inward/record.uri?eid=2-s2.0-85086223364&doi=10.1109%2fITNEC48623.2020.9085151&partnerID=40&md5=19df6a8a5d1d9e659776cbed4f10ab7c","Conference paper","Final","","Scopus","2-s2.0-85086223364"
"Wu J.; Xu L.; Wu F.; Kong Y.; Senhadji L.; Shu H.","Wu, Jiasong (34874119700); Xu, Ling (57216519819); Wu, Fuzhi (57198943431); Kong, Youyong (36082608100); Senhadji, Lotfi (7004293671); Shu, Huazhong (7203086899)","34874119700; 57216519819; 57198943431; 36082608100; 7004293671; 7203086899","Deep octonion networks","2020","Neurocomputing","397","","","179","191","12","33","10.1016/j.neucom.2020.02.053","https://www.scopus.com/inward/record.uri?eid=2-s2.0-85080026270&doi=10.1016%2fj.neucom.2020.02.053&partnerID=40&md5=85256d982246fa72694c0acc699ca2e1","Article","Final","All Open Access; Bronze Open Access; Green Open Access","Scopus","2-s2.0-85080026270"
"Ma Y.; Yin Z.; Nie L.","Ma, Yuefeng (57216550408); Yin, Zhishuai (57202836969); Nie, Linzhen (57202832476)","57216550408; 57202836969; 57202832476","Driver Distraction Detection with a Two-stream Convolutional Neural Network","2020","SAE Technical Papers","2020-April","April","","","","","4","10.4271/2020-01-1039","https://www.scopus.com/inward/record.uri?eid=2-s2.0-85083830105&doi=10.4271%2f2020-01-1039&partnerID=40&md5=40bdb21ba87c60252b1cbee49cabbf4a","Conference paper","Final","","Scopus","2-s2.0-85083830105"
"Cai Y.; Guo Y.; Lang S.; Liu J.; Hu S.","Cai, Yiheng (7401751113); Guo, Yajun (57211980330); Lang, Shinan (55320559000); Liu, Jiaqi (57212511741); Hu, Shaobin (57212872922)","7401751113; 57211980330; 55320559000; 57212511741; 57212872922","Classification of hyperspectral images by spectral-spatial dense-residual network","2020","Journal of Applied Remote Sensing","14","3","036513","","","","5","10.1117/1.JRS.14.036513","https://www.scopus.com/inward/record.uri?eid=2-s2.0-85092606202&doi=10.1117%2f1.JRS.14.036513&partnerID=40&md5=342095021e45b3b0e0b8d42e45985382","Article","Final","","Scopus","2-s2.0-85092606202"
"Ma B.; Li X.; Xia Y.; Zhang Y.","Ma, Benteng (57194215309); Li, Xiang (57221402996); Xia, Yong (26427407400); Zhang, Yanning (56075029000)","57194215309; 57221402996; 26427407400; 56075029000","Autonomous deep learning: A genetic DCNN designer for image classification","2020","Neurocomputing","379","","","152","161","9","83","10.1016/j.neucom.2019.10.007","https://www.scopus.com/inward/record.uri?eid=2-s2.0-85075525112&doi=10.1016%2fj.neucom.2019.10.007&partnerID=40&md5=4923d44ad5a73f2f4a93d5ce52b8668e","Article","Final","All Open Access; Green Open Access","Scopus","2-s2.0-85075525112"
"Khotimah W.N.; Bennamoun M.; Boussaid F.; Sohel F.; Edwards D.","Khotimah, Wijayanti Nurul (54784489700); Bennamoun, Mohammed (7004376121); Boussaid, Farid (6602749360); Sohel, Ferdous (9273356400); Edwards, David (7404087297)","54784489700; 7004376121; 6602749360; 9273356400; 7404087297","A high-performance spectral-spatial residual network for hyperspectral image classification with small training data","2020","Remote Sensing","12","19","3137","","","","18","10.3390/RS12193137","https://www.scopus.com/inward/record.uri?eid=2-s2.0-85092533820&doi=10.3390%2fRS12193137&partnerID=40&md5=ec7a5c88189fa519863161ba0175f753","Article","Final","All Open Access; Gold Open Access","Scopus","2-s2.0-85092533820"
"Kumar N.; Sukavanam N.","Kumar, N. (58082320000); Sukavanam, N. (12804420600)","58082320000; 12804420600","A weakly supervised CNN model for spatial localization of human activities in unconstraint environment","2020","Signal, Image and Video Processing","14","5","","1009","1016","7","5","10.1007/s11760-019-01633-y","https://www.scopus.com/inward/record.uri?eid=2-s2.0-85078937489&doi=10.1007%2fs11760-019-01633-y&partnerID=40&md5=581fb206efdc30470f2dc1e94fd6c153","Article","Final","","Scopus","2-s2.0-85078937489"
"Zhang G.; Pan G.; Liu J.","Zhang, Guimei (55738871900); Pan, Guofeng (57219008430); Liu, Jianxin (36773112200)","55738871900; 57219008430; 36773112200","Domain adaptation for semantic segmentation based on adaption learning rate; [域自适应城市场景语义分割]","2020","Journal of Image and Graphics","25","5","","913","925","12","3","10.11834/jig.190424","https://www.scopus.com/inward/record.uri?eid=2-s2.0-85091036197&doi=10.11834%2fjig.190424&partnerID=40&md5=b804a452f6b72fce0716d0c648a02511","Article","Final","","Scopus","2-s2.0-85091036197"
"Saini M.; Susan S.","Saini, Manisha (57220527264); Susan, Seba (26423246100)","57220527264; 26423246100","Deep transfer with minority data augmentation for imbalanced breast cancer dataset","2020","Applied Soft Computing Journal","97","","106759","","","","109","10.1016/j.asoc.2020.106759","https://www.scopus.com/inward/record.uri?eid=2-s2.0-85092491984&doi=10.1016%2fj.asoc.2020.106759&partnerID=40&md5=f642a77d53b89fea28887881885e3533","Article","Final","","Scopus","2-s2.0-85092491984"
"Ye S.; Lu S.; Bai X.; Gu J.","Ye, Sijing (56084884400); Lu, Shuhan (57201324762); Bai, Xuesong (57218197558); Gu, Jinfeng (57195391111)","56084884400; 57201324762; 57218197558; 57195391111","ResNet-locust-BN network-based automatic identification of east Asian migratory locust species and instars from RGB images","2020","Insects","11","8","458","1","17","16","30","10.3390/insects11080458","https://www.scopus.com/inward/record.uri?eid=2-s2.0-85088237556&doi=10.3390%2finsects11080458&partnerID=40&md5=214d58cba89c400dea6a44503284f045","Article","Final","All Open Access; Gold Open Access; Green Open Access","Scopus","2-s2.0-85088237556"
"Arora M.; Dhawan S.; Singh K.","Arora, Mamta (57208746429); Dhawan, Sanjeev (56828890500); Singh, Kulvinder (56309854100)","57208746429; 56828890500; 56309854100","Deep learning in health care: Automatic cervix image classification using convolutional neural network","2021","Lecture Notes in Networks and Systems","140","","","145","151","6","1","10.1007/978-981-15-7130-5_10","https://www.scopus.com/inward/record.uri?eid=2-s2.0-85092130569&doi=10.1007%2f978-981-15-7130-5_10&partnerID=40&md5=9ddd956a744c6a7b3e4fd2e690102508","Conference paper","Final","","Scopus","2-s2.0-85092130569"
"Meng L.; Ge K.; Song Y.; Yang D.","Meng, Lu (36093115100); Ge, Kang (57219572850); Song, Yang (57219568892); Yang, Dongming (57205388638)","36093115100; 57219572850; 57219568892; 57205388638","TSCNN: a convolutional neural network for the monitoring and analysis of the electrical signals of the heart from wearable devices; [TSCNN:面向可穿戴心电信号监测与分析的卷积神经网络]","2020","Journal of Image and Graphics","25","10","","2281","2292","11","0","10.11834/jig.200203","https://www.scopus.com/inward/record.uri?eid=2-s2.0-85093932492&doi=10.11834%2fjig.200203&partnerID=40&md5=4eee8f0f8627c04006198faec4046b4d","Article","Final","","Scopus","2-s2.0-85093932492"
"Amin J.; Sharif M.; Anjum M.A.; Khan H.U.; Malik M.S.A.; Kadry S.","Amin, Javaria (57192939275); Sharif, Muhammad (57549289700); Anjum, Muhammad Almas (16021202900); Khan, Habib Ullah (55507524000); Malik, Muhammad Sheraz Arshad (57505246800); Kadry, Seifedine (55906598300)","57192939275; 57549289700; 16021202900; 55507524000; 57505246800; 55906598300","An Integrated Design for Classification and Localization of Diabetic Foot Ulcer Based on CNN and YOLOv2-DFU Models","2020","IEEE Access","8","","9298774","228586","228597","11","40","10.1109/ACCESS.2020.3045732","https://www.scopus.com/inward/record.uri?eid=2-s2.0-85184684596&doi=10.1109%2fACCESS.2020.3045732&partnerID=40&md5=aa1897dfa5bde7a7a0ed485ac357c8d2","Article","Final","All Open Access; Gold Open Access; Green Open Access","Scopus","2-s2.0-85184684596"
"Wang Y.; Sun F.; Lu M.; Yao A.","Wang, Yikai (57211951907); Sun, Fuchun (57204699218); Lu, Ming (57022698900); Yao, Anbang (26638557800)","57211951907; 57204699218; 57022698900; 26638557800","Learning Deep Multimodal Feature Representation with Asymmetric Multi-layer Fusion","2020","MM 2020 - Proceedings of the 28th ACM International Conference on Multimedia","","","","3902","3910","8","37","10.1145/3394171.3413621","https://www.scopus.com/inward/record.uri?eid=2-s2.0-85106882576&doi=10.1145%2f3394171.3413621&partnerID=40&md5=ae59b656d860ad0c5878c832be127b76","Conference paper","Final","All Open Access; Green Open Access","Scopus","2-s2.0-85106882576"
"Mafi M.; Izquierdo W.; Martin H.; Cabrerizo M.; Adjouadi M.","Mafi, Mehdi (57202391513); Izquierdo, Walter (57203119211); Martin, Harold (56489512500); Cabrerizo, Mercedes (6603673705); Adjouadi, Malek (7004124475)","57202391513; 57203119211; 56489512500; 6603673705; 7004124475","Deep convolutional neural network for mixed random impulse and gaussian noise reduction in digital images","2020","IET Image Processing","14","15","","3791","3801","10","8","10.1049/iet-ipr.2019.0931","https://www.scopus.com/inward/record.uri?eid=2-s2.0-85102196842&doi=10.1049%2fiet-ipr.2019.0931&partnerID=40&md5=5f430c81e108dd3b8f0fa7db32e0fa88","Article","Final","All Open Access; Bronze Open Access","Scopus","2-s2.0-85102196842"
"Padmanabhan R.; Damodaran S.; Navkesh Batra V.; Gurugopinath S.","Padmanabhan, Ram (7102542476); Damodaran, Swaroop (57219485536); Navkesh Batra, Vidush (57219488413); Gurugopinath, Sanjeev (55005957900)","7102542476; 57219485536; 57219488413; 55005957900","A Convolutional Neural Network Architecture for Camera Model Identification with Small Datasets","2020","Proceedings of CONECCT 2020 - 6th IEEE International Conference on Electronics, Computing and Communication Technologies","","","9198595","","","","4","10.1109/CONECCT50063.2020.9198595","https://www.scopus.com/inward/record.uri?eid=2-s2.0-85093109748&doi=10.1109%2fCONECCT50063.2020.9198595&partnerID=40&md5=b647930cc841ff389ae605ca3305ae23","Conference paper","Final","","Scopus","2-s2.0-85093109748"
"Roy S.K.; Chatterjee S.; Bhattacharyya S.; Chaudhuri B.B.; Platos J.","Roy, Swalpa Kumar (56784776500); Chatterjee, Subhrasankar (57211139002); Bhattacharyya, Siddhartha (7402157487); Chaudhuri, Bidyut B. (7101623219); Platos, Jan (23397962200)","56784776500; 57211139002; 7402157487; 7101623219; 23397962200","Lightweight Spectral-Spatial Squeeze-and- Excitation Residual Bag-of-Features Learning for Hyperspectral Classification","2020","IEEE Transactions on Geoscience and Remote Sensing","58","8","8976424","5277","5290","13","75","10.1109/TGRS.2019.2961681","https://www.scopus.com/inward/record.uri?eid=2-s2.0-85086138500&doi=10.1109%2fTGRS.2019.2961681&partnerID=40&md5=f3e3751361d91ae4b53fc1098d9aacf8","Article","Final","","Scopus","2-s2.0-85086138500"
"Li J.; Liang B.; Wang Y.","Li, Jiangyun (27170441000); Liang, Binxiu (57205419953); Wang, Yuhao (56801438800)","27170441000; 57205419953; 56801438800","A hybrid neural network for hyperspectral image classification","2020","Remote Sensing Letters","11","1","","96","105","9","11","10.1080/2150704X.2019.1686780","https://www.scopus.com/inward/record.uri?eid=2-s2.0-85075066363&doi=10.1080%2f2150704X.2019.1686780&partnerID=40&md5=dd56f00b1fd14d898a656540a91cfe33","Article","Final","","Scopus","2-s2.0-85075066363"
"Astono I.P.; Welsh J.S.; Chalup S.; Greer P.","Astono, Indriani P. (57205525411); Welsh, James S. (7202711502); Chalup, Stephan (6507711151); Greer, Peter (57204782270)","57205525411; 7202711502; 6507711151; 57204782270","Optimisation of 2D U-Net model components for automatic prostate segmentation on MRI","2020","Applied Sciences (Switzerland)","10","7","2601","","","","13","10.3390/app10072601","https://www.scopus.com/inward/record.uri?eid=2-s2.0-85083298562&doi=10.3390%2fapp10072601&partnerID=40&md5=422abbc94f62a7f7efe44c2664a87cf9","Article","Final","All Open Access; Gold Open Access","Scopus","2-s2.0-85083298562"
"Wang Q.; Li Z.; Gu T.; Ye F.; Wang X.","Wang, Qizhen (57221612915); Li, Ziyin (55559816900); Gu, Ting (57221604726); Ye, Fei (57221608421); Wang, Xiaodong (57221485793)","57221612915; 55559816900; 57221604726; 57221608421; 57221485793","Cocoons counting and classification based on image processing","2020","Proceedings - 2020 13th International Congress on Image and Signal Processing, BioMedical Engineering and Informatics, CISP-BMEI 2020","","","9263489","148","152","4","4","10.1109/CISP-BMEI51763.2020.9263489","https://www.scopus.com/inward/record.uri?eid=2-s2.0-85099542872&doi=10.1109%2fCISP-BMEI51763.2020.9263489&partnerID=40&md5=5554cf4102dad6c04f0c0fd3ad7b4ee0","Conference paper","Final","","Scopus","2-s2.0-85099542872"
"Xue X.; Hao X.; Shi J.; Ding Y.; Wei W.; An H.","Xue, Xudong (57218453699); Hao, Xiaoyu (57218448775); Shi, Jun (58833713000); Ding, Yi (57200725556); Wei, Wei (57431057800); An, Hong (7202277376)","57218453699; 57218448775; 58833713000; 57200725556; 57431057800; 7202277376","Auto-segmentation of high-risk primary tumor gross target volume for the radiotherapy of nasopharyngeal carcinoma; [鼻咽癌原发肿瘤放疗靶区的自动分割]","2020","Journal of Image and Graphics","25","10","","2151","2158","7","3","10.11834/jig.200243","https://www.scopus.com/inward/record.uri?eid=2-s2.0-85093941472&doi=10.11834%2fjig.200243&partnerID=40&md5=cde7a761d318c9ad462ddfb00090a198","Article","Final","","Scopus","2-s2.0-85093941472"
"Li Y.; Iida M.; Suyama T.; Suguri M.; Masuda R.","Li, Yang (59292278100); Iida, Michihisa (7402237908); Suyama, Tomoya (57216808042); Suguri, Masahiko (15728488100); Masuda, Ryohei (36657513700)","59292278100; 7402237908; 57216808042; 15728488100; 36657513700","Implementation of deep-learning algorithm for obstacle detection and collision avoidance for robotic harvester","2020","Computers and Electronics in Agriculture","174","","105499","","","","33","10.1016/j.compag.2020.105499","https://www.scopus.com/inward/record.uri?eid=2-s2.0-85084730841&doi=10.1016%2fj.compag.2020.105499&partnerID=40&md5=0d192c37e5539d66a554783914639023","Article","Final","All Open Access; Green Open Access","Scopus","2-s2.0-85084730841"
"Hssayni E.H.; Ettaouil M.","Hssayni, El Houssaine (57216917031); Ettaouil, Mohamed (25224802300)","57216917031; 25224802300","A Novel Pooling Method for Regularization of Deep Neural networks","2020","2020 International Conference on Intelligent Systems and Computer Vision, ISCV 2020","","","9204322","","","","4","10.1109/ISCV49265.2020.9204322","https://www.scopus.com/inward/record.uri?eid=2-s2.0-85093844404&doi=10.1109%2fISCV49265.2020.9204322&partnerID=40&md5=f45ee6270c0536ac138762bdb301a732","Conference paper","Final","","Scopus","2-s2.0-85093844404"
"Kim H.; Kim J.; Choi J.; Lee J.; Song Y.H.","Kim, Hyunwoo (59052956400); Kim, Jeonghoon (57193000251); Choi, Jungwook (55513194500); Lee, Jungkeol (57203102189); Song, Yong Ho (9839166400)","59052956400; 57193000251; 55513194500; 57203102189; 9839166400","Binarized Encoder-Decoder Network and Binarized Deconvolution Engine for Semantic Segmentation","2021","IEEE Access","9","","9311614","8006","8027","21","6","10.1109/ACCESS.2020.3048375","https://www.scopus.com/inward/record.uri?eid=2-s2.0-85099501848&doi=10.1109%2fACCESS.2020.3048375&partnerID=40&md5=dbc5c870659707636d526fcca6fd4361","Article","Final","All Open Access; Gold Open Access","Scopus","2-s2.0-85099501848"
"Nasiri A.; Omid M.; Taheri-Garavand A.","Nasiri, Amin (57208238617); Omid, Mahmoud (57211027674); Taheri-Garavand, Amin (36941569000)","57208238617; 57211027674; 36941569000","An automatic sorting system for unwashed eggs using deep learning","2020","Journal of Food Engineering","283","","110036","","","","86","10.1016/j.jfoodeng.2020.110036","https://www.scopus.com/inward/record.uri?eid=2-s2.0-85081929471&doi=10.1016%2fj.jfoodeng.2020.110036&partnerID=40&md5=2aafd361098709e4f6b3dc0a7118886c","Article","Final","","Scopus","2-s2.0-85081929471"
"Agnes S.; Anitha J.","Agnes, S. (57203957904); Anitha, J. (35099994900)","57203957904; 35099994900","Appraisal of deep-learning techniques on computer-aided lung cancer diagnosis with computed tomography screening","2020","Journal of Medical Physics","45","2","","98","106","8","11","10.4103/jmp.JMP_101_19","https://www.scopus.com/inward/record.uri?eid=2-s2.0-85090628310&doi=10.4103%2fjmp.JMP_101_19&partnerID=40&md5=e33ca2ca0cd7cdb0dedbcee480b7dcaf","Article","Final","All Open Access; Gold Open Access; Green Open Access","Scopus","2-s2.0-85090628310"
"Chen J.; Han M.; Lian Y.; Zhang S.","Chen, Jin (56206257300); Han, Mengna (57204424136); Lian, Yi (57202399854); Zhang, Shuai (59061372500)","56206257300; 57204424136; 57202399854; 59061372500","Segmentation of impurity rice grain images based on U-Net model; [基于U-Net模型的含杂水稻籽粒图像分割]","2020","Nongye Gongcheng Xuebao/Transactions of the Chinese Society of Agricultural Engineering","36","10","","174","180","6","39","10.11975/j.issn.1002-6819.2020.10.021","https://www.scopus.com/inward/record.uri?eid=2-s2.0-85088367474&doi=10.11975%2fj.issn.1002-6819.2020.10.021&partnerID=40&md5=44510500aa5390bc3a6946181e2826f6","Article","Final","","Scopus","2-s2.0-85088367474"
"He H.; Chen S.","He, Hui (57217832363); Chen, Sheng (57171224800)","57217832363; 57171224800","Automatic tumor segmentation in PET by deep convolutional U-Net with pre-trained encoder; [改进预训练编码器U-Net模型的PET肿瘤自动分割]","2020","Journal of Image and Graphics","25","1","","171","179","8","4","10.11834/jig.190058","https://www.scopus.com/inward/record.uri?eid=2-s2.0-85091016291&doi=10.11834%2fjig.190058&partnerID=40&md5=7bc80b1ee6a3576e6af9db8420e7f480","Article","Final","","Scopus","2-s2.0-85091016291"
"Zaman F.H.K.","Zaman, Fadhlan Hafizhelmi Kamaru (57211748029)","57211748029","Gender classification using custom convolutional neural networks architecture","2020","International Journal of Electrical and Computer Engineering","10","6","","5758","5771","13","7","10.11591/ijece.v10i6.pp5758-5771","https://www.scopus.com/inward/record.uri?eid=2-s2.0-85089385707&doi=10.11591%2fijece.v10i6.pp5758-5771&partnerID=40&md5=ac52c9f62e18498887728133b2696c44","Article","Final","All Open Access; Gold Open Access; Green Open Access","Scopus","2-s2.0-85089385707"
"Lu X.; Huang H.; Li S.; Yin L.","Lu, Xinrui (36018309600); Huang, Handong (7405615295); Li, Shuai (57247004200); Yin, Long (58417237800)","36018309600; 7405615295; 57247004200; 58417237800","Salt-body Classification Method Based on U-Net; [基于U-Net的盐体识别方法]","2020","Jisuan Wuli/Chinese Journal of Computational Physics","37","3","","327","334","7","4","10.19596/j.cnki.1001-246x.8044","https://www.scopus.com/inward/record.uri?eid=2-s2.0-85088023989&doi=10.19596%2fj.cnki.1001-246x.8044&partnerID=40&md5=222df92004327c525fa5975bce17e71f","Article","Final","","Scopus","2-s2.0-85088023989"
"Kocaman V.; Shir O.M.; Bäck T.","Kocaman, Veysel (57220950496); Shir, Ofer M. (8916439000); Bäck, Thomas (57203312747)","57220950496; 8916439000; 57203312747","Improving model accuracy for imbalanced image classification tasks by adding a final batch normalization layer: An empirical study","2020","Proceedings - International Conference on Pattern Recognition","","","9412907","10404","10411","7","4","10.1109/ICPR48806.2021.9412907","https://www.scopus.com/inward/record.uri?eid=2-s2.0-85110518508&doi=10.1109%2fICPR48806.2021.9412907&partnerID=40&md5=8acda64908ca9bee335ecbebe1cba429","Conference paper","Final","All Open Access; Green Open Access","Scopus","2-s2.0-85110518508"
"Gouda N.; Amudha J.","Gouda, Niharika (57219917168); Amudha, J (35766448700)","57219917168; 35766448700","Skin Cancer Classification using ResNet","2020","2020 IEEE 5th International Conference on Computing Communication and Automation, ICCCA 2020","","","9250855","536","541","5","51","10.1109/ICCCA49541.2020.9250855","https://www.scopus.com/inward/record.uri?eid=2-s2.0-85097649571&doi=10.1109%2fICCCA49541.2020.9250855&partnerID=40&md5=4ceabebf4e557deb896df4ae751c63c3","Conference paper","Final","","Scopus","2-s2.0-85097649571"
"Jibhakate A.; Parnerkar P.; Mondal S.; Bharambe V.; Mantri S.","Jibhakate, Atharva (57221970018); Parnerkar, Pranav (57221951563); Mondal, Sahil (57221958144); Bharambe, Vastav (57221962290); Mantri, Shamla (57220347811)","57221970018; 57221951563; 57221958144; 57221962290; 57220347811","Skin lesion classification using deep learning and image processing","2020","Proceedings of the 3rd International Conference on Intelligent Sustainable Systems, ICISS 2020","","","9316092","333","340","7","11","10.1109/ICISS49785.2020.9316092","https://www.scopus.com/inward/record.uri?eid=2-s2.0-85100827535&doi=10.1109%2fICISS49785.2020.9316092&partnerID=40&md5=b1988b2e2bc0d99b09c8a69f4af1dba7","Conference paper","Final","","Scopus","2-s2.0-85100827535"
"Zhu Q.; He Z.; Zhang T.; Cui W.","Zhu, Qiuyu (13408185800); He, Zikuang (57216790963); Zhang, Tao (55636319374); Cui, Wennan (57193553611)","13408185800; 57216790963; 55636319374; 57193553611","Improving classification performance of softmax loss function based on scalable batch-normalization","2020","Applied Sciences (Switzerland)","10","8","2950","","","","46","10.3390/APP10082950","https://www.scopus.com/inward/record.uri?eid=2-s2.0-85084651247&doi=10.3390%2fAPP10082950&partnerID=40&md5=1a1714e5132d7d247e389dadf5ae99c8","Article","Final","All Open Access; Gold Open Access","Scopus","2-s2.0-85084651247"
"Loukmane A.; Grana M.; Mestari M.","Loukmane, Attoumane (57221265305); Grana, Manuel (7005388617); Mestari, Mohammed (6507574426)","57221265305; 7005388617; 6507574426","A Model for Classification of Traffic Signs Using Improved Convolutional Neural Network and Image Enhancement","2020","4th International Conference on Intelligent Computing in Data Sciences, ICDS 2020","","","9268761","","","","7","10.1109/ICDS50568.2020.9268761","https://www.scopus.com/inward/record.uri?eid=2-s2.0-85098636970&doi=10.1109%2fICDS50568.2020.9268761&partnerID=40&md5=e53d5eb17702225cec9e790fdc656e8b","Conference paper","Final","","Scopus","2-s2.0-85098636970"
"Lopez-Martin M.; Nevado A.; Carro B.","Lopez-Martin, Manuel (57195495275); Nevado, Angel (6603223768); Carro, Belen (6507185110)","57195495275; 6603223768; 6507185110","Detection of early stages of Alzheimer's disease based on MEG activity with a randomized convolutional neural network","2020","Artificial Intelligence in Medicine","107","","101924","","","","41","10.1016/j.artmed.2020.101924","https://www.scopus.com/inward/record.uri?eid=2-s2.0-85087769191&doi=10.1016%2fj.artmed.2020.101924&partnerID=40&md5=abfcd719bf2a0af214be8d3aa1e54727","Article","Final","All Open Access; Green Open Access","Scopus","2-s2.0-85087769191"
"Chang H.-H.; Yeh S.-J.; Chiang M.-C.; Hsieh S.-T.","Chang, Herng-Hua (7407521675); Yeh, Shin-Joe (25822827900); Chiang, Ming-Chang (57142825600); Hsieh, Sung-Tsang (7202057567)","7407521675; 25822827900; 57142825600; 7202057567","Infarct region segmentation in rat brain T2 MR images after stroke based on fully convolutional networks","2020","Progress in Biomedical Optics and Imaging - Proceedings of SPIE","11317","","113172G","","","","1","10.1117/12.2548561","https://www.scopus.com/inward/record.uri?eid=2-s2.0-85120859878&doi=10.1117%2f12.2548561&partnerID=40&md5=72df75bcd38761df59d2bd13c577fa8c","Conference paper","Final","","Scopus","2-s2.0-85120859878"
"Kishore P.V.V.; Perera D.G.; Kumar M.T.K.; Kumar D.A.; Kumar E.K.","Kishore, P.V.V. (57215302684); Perera, Darshika G. (22734516600); Kumar, M. Teja Kiran (57199856624); Kumar, D. Anil (57201007788); Kumar, E. Kiran (57201012363)","57215302684; 22734516600; 57199856624; 57201007788; 57201012363","A quad joint relational feature for 3D skeletal action recognition with circular CNNs","2020","Proceedings - IEEE International Symposium on Circuits and Systems","2020-October","","9180732","","","","5","","https://www.scopus.com/inward/record.uri?eid=2-s2.0-85109277363&partnerID=40&md5=e1c251fecb8eec1e37eeddc98dcf5f6d","Conference paper","Final","","Scopus","2-s2.0-85109277363"
"Chen L.; Geng L.; Gao Z.; Li S.; Fu X.; Wang W.; Feng Y.; Wang S.; Li Y.; Fang Y.; Tao S.; Ni Y.; Wang Z.","Chen, Lei (57218872771); Geng, Lei (35837861900); Gao, Zenglai (57204810789); Li, Shoujun (57224008291); Fu, Xubin (58591957000); Wang, Weishi (57224009177); Feng, Yuanbo (23479123300); Wang, Shuncong (57191531396); Li, Yue (57225006258); Fang, Yajun (7403457553); Tao, Stanley (57224012645); Ni, Yicheng (56835865400); Wang, Zhongqiang (57211493682)","57218872771; 35837861900; 57204810789; 57224008291; 58591957000; 57224009177; 23479123300; 57191531396; 57225006258; 7403457553; 57224012645; 56835865400; 57211493682","An Innovative Algorithm to Process Imaging Data for Detection of Weak Chick Embryos in Vaccine Production","2020","5th International Conference on Universal Village, UV 2020","","","9426201","","","","2","10.1109/UV50937.2020.9426201","https://www.scopus.com/inward/record.uri?eid=2-s2.0-85106694977&doi=10.1109%2fUV50937.2020.9426201&partnerID=40&md5=8951347f1fe526058d71996c07db605b","Conference paper","Final","","Scopus","2-s2.0-85106694977"
