"Authors","Author full names","Author(s) ID","Title","Year","Source title","Volume","Issue","Art. No.","Page start","Page end","Page count","Cited by","DOI","Link","Document Type","Publication Stage","Open Access","Source","EID"
"Vieira F.; Campos C.A.V.","Vieira, Flávio (58916359500); Campos, Carlos Alberto V. (57202639290)","58916359500; 57202639290","Exploring Normalization for High Convergence on Federated Learning for Drones","2024","Journal of the Brazilian Computer Society","30","1","","496","508","12","0","10.5753/jbcs.2024.4133","https://www.scopus.com/inward/record.uri?eid=2-s2.0-85208287468&doi=10.5753%2fjbcs.2024.4133&partnerID=40&md5=2fd68c72e915848fe0e2b5889b8da50e","Article","Final","","Scopus","2-s2.0-85208287468"
"Kafaf D.A.L.; Thamir N.N.; Al-Hadithy S.S.","Kafaf, Dhrgam A. L. (57194713771); Thamir, Noor N. (57226713718); Al-Hadithy, Samara S. (58184147300)","57194713771; 57226713718; 58184147300","MALARIA DISEASE PREDICTION BASED ON CONVOLUTIONAL NEURAL NETWORKS","2024","Journal of Applied Engineering and Technological Science","5","2","","1165","1181","16","0","10.37385/jaets.v5i2.3947","https://www.scopus.com/inward/record.uri?eid=2-s2.0-85196396708&doi=10.37385%2fjaets.v5i2.3947&partnerID=40&md5=08a118952627c79626edd5bef3413a9e","Article","Final","All Open Access; Gold Open Access","Scopus","2-s2.0-85196396708"
"Shiney S.A.; Seetharaman R.; Sharmila V.J.; Prathiba S.","Shiney, S. Arumai (58070613700); Seetharaman, R. (35099352800); Sharmila, V.J. (57354754600); Prathiba, S. (59333086500)","58070613700; 35099352800; 57354754600; 59333086500","Deep learning based gasket fault detection: a CNN approach","2025","Scientific Reports","15","1","4776","","","","0","10.1038/s41598-025-85223-8","https://www.scopus.com/inward/record.uri?eid=2-s2.0-85218214403&doi=10.1038%2fs41598-025-85223-8&partnerID=40&md5=01682c4c65fd4a59c06fa199bf1e9027","Article","Final","All Open Access; Gold Open Access","Scopus","2-s2.0-85218214403"
"Sodeinde O.R.; Koch M.; Moaveni B.; Baise L.G.","Sodeinde, Olalekan R. (59118839800); Koch, Magaly (58865628100); Moaveni, Babak (6508097192); Baise, Laurie G. (6507566653)","59118839800; 58865628100; 6508097192; 6507566653","One versus all: identifiability with a multi-hazard and multiclass building damage imagery dataset and a deep learning neural network","2024","Natural Hazards","120","9","","8337","8366","29","3","10.1007/s11069-024-06500-9","https://www.scopus.com/inward/record.uri?eid=2-s2.0-85192738887&doi=10.1007%2fs11069-024-06500-9&partnerID=40&md5=b5deaff8c3525fa97e73035ab10ffbd1","Article","Final","","Scopus","2-s2.0-85192738887"
"Sagar N.; Suresh K.P.; Sridhara S.; Patil B.; Archana C.A.; Sekar Y.S.; Naveesh Y.B.; Nandan A.S.; Sushma R.","Sagar, N. (58660085200); Suresh, K.P. (57217658013); Sridhara, Shankarappa (7005352874); Patil, Balanagouda (57673357400); Archana, C.A. (59005282400); Sekar, Yamini Sri (59005562200); Naveesh, Y.B. (57218855645); Nandan, A.S. (59287705900); Sushma, R. (59562282000)","58660085200; 57217658013; 7005352874; 57673357400; 59005282400; 59005562200; 57218855645; 59287705900; 59562282000","Precision detection of grapevine downy and powdery mildew diseased leaves and fruits using enhanced ResNet50 with batch normalization","2025","Computers and Electronics in Agriculture","232","","110144","","","","0","10.1016/j.compag.2025.110144","https://www.scopus.com/inward/record.uri?eid=2-s2.0-85218077646&doi=10.1016%2fj.compag.2025.110144&partnerID=40&md5=4213c99a4eff5f5d56d1f730df3ba6a4","Article","Final","","Scopus","2-s2.0-85218077646"
"Wan Y.; Diao S.; Jiang G.; Song C.","Wan, Yajie (59363189600); Diao, Su (59362799600); Jiang, Gaozhe (59461937200); Song, Chaoda (57226884635)","59363189600; 59362799600; 59461937200; 57226884635","Research on Tumor Images Segmentation based on Improved Convolutional Neural Network","2025","Proceedings of 2024 5th International Symposium on Artificial Intelligence for Medicine Science, ISAIMS 2024","","","","46","51","5","0","10.1145/3706890.3706898","https://www.scopus.com/inward/record.uri?eid=2-s2.0-85217797498&doi=10.1145%2f3706890.3706898&partnerID=40&md5=c6cc7a7ce775768b04ddb7254c687546","Conference paper","Final","","Scopus","2-s2.0-85217797498"
"Zhao C.; Song J.; Yuan Y.; Chu Y.-H.; Hsu Y.-C.; Huang Q.","Zhao, Chen (58734706400); Song, Jianping (37075873100); Yuan, Yifan (57224222919); Chu, Ying-Hua (59549738800); Hsu, Yi-Cheng (58036341700); Huang, Qiu (35435256100)","58734706400; 37075873100; 57224222919; 59549738800; 58036341700; 35435256100","An improved attention module based on nnU-Net for segmenting primary central nervous system lymphoma (PCNSL) in MRI images","2024","Journal of X-Ray Science and Technology","32","4","","993","1009","16","0","10.3233/XST-240016","https://www.scopus.com/inward/record.uri?eid=2-s2.0-85201438545&doi=10.3233%2fXST-240016&partnerID=40&md5=9020ac95a573e95749629e9bd65c4a12","Article","Final","","Scopus","2-s2.0-85201438545"
"Torkey H.; Abdelnabi A.M.; El-Bahnasawy N.A.","Torkey, Hanaa (57220251815); Abdelnabi, Amira M. (59327499600); El-Bahnasawy, Nirmeen A. (57193137667)","57220251815; 59327499600; 57193137667","An Enhanced Deep Learning Model for MRI Image Classifications","2024","Menoufia Journal of Electronic Engineering Research","33","2","","32","40","8","0","10.21608/mjeer.2024.275185.1090","https://www.scopus.com/inward/record.uri?eid=2-s2.0-85203902176&doi=10.21608%2fmjeer.2024.275185.1090&partnerID=40&md5=0eca316dcecf9bc9f24dbd4cf411ff3c","Article","Final","","Scopus","2-s2.0-85203902176"
"Radočaj P.; Radočaj D.; Martinović G.","Radočaj, Petra (58788088500); Radočaj, Dorijan (57212464809); Martinović, Goran (6506080275)","58788088500; 57212464809; 6506080275","Image-Based Leaf Disease Recognition Using Transfer Deep Learning with a Novel Versatile Optimization Module","2024","Big Data and Cognitive Computing","8","6","52","","","","6","10.3390/bdcc8060052","https://www.scopus.com/inward/record.uri?eid=2-s2.0-85197196343&doi=10.3390%2fbdcc8060052&partnerID=40&md5=2761dff2d19ea9c8a66d423f4cf90657","Article","Final","All Open Access; Gold Open Access","Scopus","2-s2.0-85197196343"
"Akhtar S.; Aftab S.; Ali O.; Ahmad M.; Khan M.A.; Abbas S.; Ghazal T.M.","Akhtar, Samia (59155648300); Aftab, Shabib (57202829701); Ali, Oualid (59423676100); Ahmad, Munir (57226132376); Khan, Muhammad Adnan (57226797214); Abbas, Sagheer (57202833192); Ghazal, Taher M. (57224545303)","59155648300; 57202829701; 59423676100; 57226132376; 57226797214; 57202833192; 57224545303","A deep learning based model for diabetic retinopathy grading","2025","Scientific Reports","15","1","3763","","","","0","10.1038/s41598-025-87171-9","https://www.scopus.com/inward/record.uri?eid=2-s2.0-85217357166&doi=10.1038%2fs41598-025-87171-9&partnerID=40&md5=fecd9b5f818f328ac5a37508019bb61a","Article","Final","All Open Access; Gold Open Access","Scopus","2-s2.0-85217357166"
"Ahmad I.; Amin J.; IkramUllah Lali M.; Abbas F.; Imran Sharif M.","Ahmad, Iqra (58891787800); Amin, Javaria (57192939275); IkramUllah Lali, Muhammad (57195971867); Abbas, Farhat (57205505283); Imran Sharif, Muhammad (26422599200)","58891787800; 57192939275; 57195971867; 57205505283; 26422599200","A novel Deeplabv3+ and vision-based transformer model for segmentation and classification of skin lesions","2024","Biomedical Signal Processing and Control","92","","106084","","","","6","10.1016/j.bspc.2024.106084","https://www.scopus.com/inward/record.uri?eid=2-s2.0-85185248253&doi=10.1016%2fj.bspc.2024.106084&partnerID=40&md5=ff1d573170281942f2b19798342396c4","Article","Final","","Scopus","2-s2.0-85185248253"
"Anand V.; Gupta S.; Koundal D.; Alghamdi W.Y.; Alsharbi B.M.","Anand, Vatsala (57197116465); Gupta, Sheifali (57072019200); Koundal, Deepika (55446289500); Alghamdi, Wael Y. (57519997900); Alsharbi, Bayan M. (57194569269)","57197116465; 57072019200; 55446289500; 57519997900; 57194569269","Deep learning-based image annotation for leukocyte segmentation and classification of blood cell morphology","2024","BMC Medical Imaging","24","1","83","","","","4","10.1186/s12880-024-01254-z","https://www.scopus.com/inward/record.uri?eid=2-s2.0-85189826075&doi=10.1186%2fs12880-024-01254-z&partnerID=40&md5=ec8e458ce31ce38303d3ad84606e0ee5","Article","Final","All Open Access; Gold Open Access","Scopus","2-s2.0-85189826075"
"Su J.; Wang B.; Fan Z.; Zhang Y.; Zeng L.-L.; Shen H.; Hu D.","Su, Jianpo (57189701650); Wang, Bo (59446252800); Fan, Zhipeng (57286730200); Zhang, Yifan (57223918168); Zeng, Ling-Li (35147001500); Shen, Hui (35436091400); Hu, Dewen (7402585423)","57189701650; 59446252800; 57286730200; 57223918168; 35147001500; 35436091400; 7402585423","MDC: A Meta-Learning Framework for Generalizable Diagnostic Classification of Major Depressive Disorder","2025","IEEE Transactions on Medical Imaging","44","2","","855","867","12","0","10.1109/TMI.2024.3461312","https://www.scopus.com/inward/record.uri?eid=2-s2.0-85210470745&doi=10.1109%2fTMI.2024.3461312&partnerID=40&md5=4279ae9807a0bb44001530c43de6bc15","Article","Final","","Scopus","2-s2.0-85210470745"
"Deo A.J.; Behera S.K.; Das D.P.","Deo, Arya Jyoti (57226686296); Behera, Santosh Kumar (37057132600); Das, Debi Prasad (24558993600)","57226686296; 37057132600; 24558993600","Online Monitoring of Iron Ore Pellet Size Distribution Using Lightweight Convolutional Neural Network","2024","IEEE Transactions on Automation Science and Engineering","21","2","","1974","1985","11","3","10.1109/TASE.2023.3253574","https://www.scopus.com/inward/record.uri?eid=2-s2.0-85151549313&doi=10.1109%2fTASE.2023.3253574&partnerID=40&md5=a64ffc63ba8cd2d28108d1c737d9fee0","Article","Final","","Scopus","2-s2.0-85151549313"
"Talib L.F.; Amin J.; Sharif M.; Raza M.","Talib, Lareib Fatima (58894265800); Amin, Javaria (57192939275); Sharif, Muhammad (57549289700); Raza, Mudassar (56303305000)","58894265800; 57192939275; 57549289700; 56303305000","Transformer-based semantic segmentation and CNN network for detection of histopathological lung cancer","2024","Biomedical Signal Processing and Control","92","","106106","","","","10","10.1016/j.bspc.2024.106106","https://www.scopus.com/inward/record.uri?eid=2-s2.0-85185400513&doi=10.1016%2fj.bspc.2024.106106&partnerID=40&md5=e6d5c378da717d8bb708cee8d72a50d8","Article","Final","","Scopus","2-s2.0-85185400513"
"Zhao J.; Liu C.; Han J.; Zhou Y.; Li Y.; Zhang L.","Zhao, Jin (59420130900); Liu, Chengzhong (55285701300); Han, Junying (55992955800); Zhou, Yuqian (57213435062); Li, Yongsheng (57200528657); Zhang, Linzhe (59506886400)","59420130900; 55285701300; 55992955800; 57213435062; 57200528657; 59506886400","Real-Time Corn Variety Recognition Using an Efficient DenXt Architecture with Lightweight Optimizations","2025","Agriculture (Switzerland)","15","1","79","","","","0","10.3390/agriculture15010079","https://www.scopus.com/inward/record.uri?eid=2-s2.0-85214495851&doi=10.3390%2fagriculture15010079&partnerID=40&md5=aec36b9aea205867a56f90e4171dc7f4","Article","Final","","Scopus","2-s2.0-85214495851"
"Li Y.; Hindriks K.; Kunneman F.","Li, Yue (58925068100); Hindriks, Koen (55904124900); Kunneman, Florian (55618992200)","58925068100; 55904124900; 55618992200","Single-Channel Robot Ego-Speech Filtering during Human-Robot Interaction","2024","ACM International Conference Proceeding Series","","","","20","28","8","0","10.1145/3648536.3648539","https://www.scopus.com/inward/record.uri?eid=2-s2.0-85204085225&doi=10.1145%2f3648536.3648539&partnerID=40&md5=684f8af5fa299890b5fe5cd16898b317","Conference paper","Final","All Open Access; Green Open Access; Hybrid Gold Open Access","Scopus","2-s2.0-85204085225"
"Assim O.M.; Mahmood A.F.","Assim, Ola Marwan (57541434700); Mahmood, Ahlam Fadhil (57226574545)","57541434700; 57226574545","A novel universal deep learning approach for accurate detection of epilepsy","2024","Medical Engineering and Physics","131","","104219","","","","0","10.1016/j.medengphy.2024.104219","https://www.scopus.com/inward/record.uri?eid=2-s2.0-85201142984&doi=10.1016%2fj.medengphy.2024.104219&partnerID=40&md5=438a20035c88c66171e7092c0a818868","Article","Final","","Scopus","2-s2.0-85201142984"
"Khaled A.","Khaled, Afifa (57219548948)","57219548948","BCN: Batch Channel Normalization for Image Classification","2025","Lecture Notes in Computer Science (including subseries Lecture Notes in Artificial Intelligence and Lecture Notes in Bioinformatics) ","15311 LNCS","","","295","308","13","0","10.1007/978-3-031-78195-7_20","https://www.scopus.com/inward/record.uri?eid=2-s2.0-85211924862&doi=10.1007%2f978-3-031-78195-7_20&partnerID=40&md5=df5bab8946d08d8bfc39748ee81ee68f","Conference paper","Final","","Scopus","2-s2.0-85211924862"
"Natarajan S.; Humbert L.; Ballester M.A.G.","Natarajan, Sai (57219686289); Humbert, Ludovic (24178179100); Ballester, Miguel A. González (11639980600)","57219686289; 24178179100; 11639980600","Domain adaptation using AdaBN and AdaIN for high-resolution IVD mesh reconstruction from clinical MRI","2024","International Journal of Computer Assisted Radiology and Surgery","19","10","","2063","2068","5","0","10.1007/s11548-024-03233-9","https://www.scopus.com/inward/record.uri?eid=2-s2.0-85198466250&doi=10.1007%2fs11548-024-03233-9&partnerID=40&md5=a42b08d2dc0f931f56f3a9cb90b42df2","Article","Final","","Scopus","2-s2.0-85198466250"
"Neshov N.; Tonchev K.; Manolova A.","Neshov, Nikolay (39861785100); Tonchev, Krasimir (54421373600); Manolova, Agata (57212850980)","39861785100; 54421373600; 57212850980","LBCNIN: Local Binary Convolution Network with Intra-Class Normalization for Texture Recognition with Applications in Tactile Internet","2024","Electronics (Switzerland)","13","15","2942","","","","0","10.3390/electronics13152942","https://www.scopus.com/inward/record.uri?eid=2-s2.0-85200750194&doi=10.3390%2felectronics13152942&partnerID=40&md5=40e785462e261017e4eb153277fa651b","Article","Final","All Open Access; Gold Open Access","Scopus","2-s2.0-85200750194"
"Liu H.; Brailsford T.; Bull L.; Goulding J.; Smith G.","Liu, Haixia (58426251300); Brailsford, Tim (58347694400); Bull, Larry (35582487100); Goulding, James (6701633840); Smith, Gavin (7406741683)","58426251300; 58347694400; 35582487100; 6701633840; 7406741683","Examining Neural Networks Through Architectural Variation Analysis for Image Classification","2025","ICISS 2024 - Proceedings of the 7th International Conference on Information Science and Systems","","","","55","61","6","0","10.1145/3700706.3700715","https://www.scopus.com/inward/record.uri?eid=2-s2.0-85218347441&doi=10.1145%2f3700706.3700715&partnerID=40&md5=caaf6b0a21a6cb3326d24abe3ec6f659","Conference paper","Final","","Scopus","2-s2.0-85218347441"
"Rao K.Y.; Rao K.S.","Rao, Kalla Yogeswara (57022238000); Rao, Konda Srinivasa (58310756400)","57022238000; 58310756400","BREAST CANCER IMAGE CLASSIFICATION USING CUSTOM CNN","2024","Journal of Theoretical and Applied Information Technology","102","6","","2493","2506","13","0","","https://www.scopus.com/inward/record.uri?eid=2-s2.0-85189442230&partnerID=40&md5=94ee45f71a3a0789aa6ca39e684707a7","Article","Final","","Scopus","2-s2.0-85189442230"
"Chen X.; Chen H.; Wan J.; Li J.; Wei F.","Chen, Xu (56877965800); Chen, Hongkun (57785396800); Wan, Junming (57199499026); Li, Jianjun (56269028500); Wei, Fuxin (35106496200)","56877965800; 57785396800; 57199499026; 56269028500; 35106496200","An enhanced AlexNet-Based model for femoral bone tumor classification and diagnosis using magnetic resonance imaging","2024","Journal of Bone Oncology","48","","100626","","","","3","10.1016/j.jbo.2024.100626","https://www.scopus.com/inward/record.uri?eid=2-s2.0-85203270341&doi=10.1016%2fj.jbo.2024.100626&partnerID=40&md5=5d0d5429fd74388d2d9bde6748f86070","Article","Final","All Open Access; Gold Open Access","Scopus","2-s2.0-85203270341"
"R S.; M S.","R, Sanakaranarayanan (59350082400); M, Senthilkumar (59229293600)","59350082400; 59229293600","Optimized twin spatio-temporal convolutional neural network with squeezenet transfer learning model for cancer miRNA biomarker classification","2024","Applied Soft Computing","167","","112270","","","","0","10.1016/j.asoc.2024.112270","https://www.scopus.com/inward/record.uri?eid=2-s2.0-85205342451&doi=10.1016%2fj.asoc.2024.112270&partnerID=40&md5=4476ac4c1763ca5d185b45acc7f14c37","Article","Final","","Scopus","2-s2.0-85205342451"
"Chen J.; Zeng H.; Cheng Y.; Yang B.","Chen, Junhua (57224488059); Zeng, Haiyan (57193321989); Cheng, Yanyan (59182698100); Yang, Banghua (23391052600)","57224488059; 57193321989; 59182698100; 23391052600","Identifying radiogenomic associations of breast cancer based on DCE-MRI by using Siamese Neural Network with manufacturer bias normalization","2024","Medical Physics","51","10","","7269","7281","12","0","10.1002/mp.17266","https://www.scopus.com/inward/record.uri?eid=2-s2.0-85196623061&doi=10.1002%2fmp.17266&partnerID=40&md5=d07b673fdfdcd3d7f7a4d5054c3ea4cd","Article","Final","","Scopus","2-s2.0-85196623061"
"Xia W.; Han T.; Tao K.; Wang W.; Gao J.","Xia, Wei (58183955300); Han, Tingting (36120220800); Tao, Kuiyuan (57195356459); Wang, Wei (56939439500); Gao, Jing (58184382300)","58183955300; 36120220800; 57195356459; 56939439500; 58184382300","IVOCT Coronary Artery Calcification Plaque Segmentation Based on Convolutional Neural Network; [基于卷积神经网络的 IVOCT 冠状动脉钙化斑块分割方法]","2024","Zhongguo Jiguang/Chinese Journal of Lasers","51","18","1801019","","","","0","10.3788/CJL240833","https://www.scopus.com/inward/record.uri?eid=2-s2.0-85203430792&doi=10.3788%2fCJL240833&partnerID=40&md5=d60f55fef482ef59cfbcd07ec2ccebbc","Article","Final","","Scopus","2-s2.0-85203430792"
"Li F.; Mou Y.; Zhang Z.; Liu Q.; Jeschke S.","Li, Feifei (59287186500); Mou, Yongli (57222763429); Zhang, Zeyu (57193798118); Liu, Quan (59166284300); Jeschke, Sabina (23093981800)","59287186500; 57222763429; 57193798118; 59166284300; 23093981800","A novel model for the pavement distress segmentation based on multi-level attention DeepLabV3+","2024","Engineering Applications of Artificial Intelligence","137","","109175","","","","1","10.1016/j.engappai.2024.109175","https://www.scopus.com/inward/record.uri?eid=2-s2.0-85201700632&doi=10.1016%2fj.engappai.2024.109175&partnerID=40&md5=32b6fd4e272925d1e078f8d1236ac2b3","Article","Final","","Scopus","2-s2.0-85201700632"
"Wang Z.; Wang X.; Li G.; Wu W.; Liu Y.; Song Z.; Song H.","Wang, Zhihao (58382636800); Wang, Xueqian (35338454400); Li, Gang (55547117794); Wu, Wei (57224468931); Liu, Yu (57386764900); Song, Zhaohui (35849336900); Song, Huina (57191965406)","58382636800; 35338454400; 55547117794; 57224468931; 57386764900; 35849336900; 57191965406","Historical information fusion of dense multi-source satellite image time series for flood extent mapping","2024","Information Fusion","109","","102445","","","","1","10.1016/j.inffus.2024.102445","https://www.scopus.com/inward/record.uri?eid=2-s2.0-85192180782&doi=10.1016%2fj.inffus.2024.102445&partnerID=40&md5=e775d16d1506482c8df7a59379e09598","Article","Final","","Scopus","2-s2.0-85192180782"
"Alshamrani A.F.A.; Saleh Zuhair Alshomrani F.","Alshamrani, Abdullah Fahad A. (57214940704); Saleh Zuhair Alshomrani, Faisal (59515741300)","57214940704; 59515741300","Optimizing Breast Cancer Mammogram Classification Through a Dual Approach: A Deep Learning Framework Combining ResNet50, SMOTE, and Fully Connected Layers for Balanced and Imbalanced Data","2025","IEEE Access","13","","","4815","4826","11","0","10.1109/ACCESS.2024.3524633","https://www.scopus.com/inward/record.uri?eid=2-s2.0-85214312962&doi=10.1109%2fACCESS.2024.3524633&partnerID=40&md5=50d7575cec0ec7a54318207598ce22d0","Article","Final","All Open Access; Gold Open Access","Scopus","2-s2.0-85214312962"
"Gautam A.; Faruqui M.B.; Akhtar N.; Rashidullah Khan U.B.","Gautam, Amarsh (59393760100); Faruqui, Mohammad Basil (59393341700); Akhtar, Nadeem (11439890000); Rashidullah Khan, Usama Bin (57996777700)","59393760100; 59393341700; 11439890000; 57996777700","Boosting Precision Agriculture Using Deep Learning Models on Edge Devices","2025","Smart Innovation, Systems and Technologies","389 SIST","","","193","209","16","0","10.1007/978-981-97-2147-4_14","https://www.scopus.com/inward/record.uri?eid=2-s2.0-85208073066&doi=10.1007%2f978-981-97-2147-4_14&partnerID=40&md5=d443c7e50bf9f378409016e51e33f6e8","Conference paper","Final","","Scopus","2-s2.0-85208073066"
"Arulananth T.S.; Kuppusamy P.G.; Ayyasamy R.K.; Alhashmi S.M.; Mahalakshmi M.; Vasanth K.; Chinnasamy P.","Arulananth, T.S. (56304201800); Kuppusamy, P.G. (55636390300); Ayyasamy, Ramesh Kumar (36607455000); Alhashmi, Saadat M. (14919130700); Mahalakshmi, M. (57213573549); Vasanth, K. (56350125300); Chinnasamy, P. (57201503238)","56304201800; 55636390300; 36607455000; 14919130700; 57213573549; 56350125300; 57201503238","Semantic segmentation of urban environments: Leveraging U-Net deep learning model for cityscape image analysis","2024","PLoS ONE","19","4 April","e0300767","","","","13","10.1371/journal.pone.0300767","https://www.scopus.com/inward/record.uri?eid=2-s2.0-85189680555&doi=10.1371%2fjournal.pone.0300767&partnerID=40&md5=008a2e9d0afc4f28402024824dbe9b52","Article","Final","All Open Access; Gold Open Access","Scopus","2-s2.0-85189680555"
"Karande S.; Garg B.","Karande, Shital (58991511400); Garg, Bindu (36918208900)","58991511400; 36918208900","Performance evaluation and optimization of convolutional neural network architectures for Tomato plant disease eleven classes based on augmented leaf images dataset","2024","Neural Computing and Applications","36","20","","11919","11943","24","1","10.1007/s00521-024-09670-6","https://www.scopus.com/inward/record.uri?eid=2-s2.0-85190680008&doi=10.1007%2fs00521-024-09670-6&partnerID=40&md5=ade97c3ec6d6c8d4dc58a0c91018a262","Article","Final","","Scopus","2-s2.0-85190680008"
"Wang H.; Wang H.; Wu L.","Wang, Huiqing (58506386500); Wang, Huajun (55689029400); Wu, Linfeng (57225127032)","58506386500; 55689029400; 57225127032","IFF-Net: Irregular Feature Fusion Network for Multimodal Remote Sensing Image Classification","2024","Applied Sciences (Switzerland)","14","12","5061","","","","0","10.3390/app14125061","https://www.scopus.com/inward/record.uri?eid=2-s2.0-85197296209&doi=10.3390%2fapp14125061&partnerID=40&md5=015b0f85f89b63490ed6430906849a00","Article","Final","All Open Access; Gold Open Access","Scopus","2-s2.0-85197296209"
"Banerjee A.; Banik D.","Banerjee, Anasua (57219490816); Banik, Debajyoty (55794721900)","57219490816; 55794721900","Resnet based hybrid convolution LSTM for hyperspectral image classification","2024","Multimedia Tools and Applications","83","15","","45059","45070","11","6","10.1007/s11042-023-16241-9","https://www.scopus.com/inward/record.uri?eid=2-s2.0-85174393785&doi=10.1007%2fs11042-023-16241-9&partnerID=40&md5=f866429c19488de0e9929e35c0750297","Article","Final","","Scopus","2-s2.0-85174393785"
"Geng X.; Gao J.; Zhang Y.; Xu D.","Geng, Xu (58209905300); Gao, Jinxiong (57220197502); Zhang, Yonghui (56541860600); Xu, Dingtan (58923325700)","58209905300; 57220197502; 56541860600; 58923325700","Complex hybrid weighted pruning method for accelerating convolutional neural networks","2024","Scientific Reports","14","1","5570","","","","6","10.1038/s41598-024-55942-5","https://www.scopus.com/inward/record.uri?eid=2-s2.0-85186946997&doi=10.1038%2fs41598-024-55942-5&partnerID=40&md5=d9713a60946c10efa9a4a2f8b9071062","Article","Final","All Open Access; Gold Open Access; Green Open Access","Scopus","2-s2.0-85186946997"
"Zhang J.; Zhang B.; Chen Z.; Nyalala I.; Chen K.; Gao J.","Zhang, Jiayu (57204437460); Zhang, Baohua (55578391700); Chen, Zixuan (59342941600); Nyalala, Innocent (57190215419); Chen, Kunjie (57200038504); Gao, Junfeng (59234523900)","57204437460; 55578391700; 59342941600; 57190215419; 57200038504; 59234523900","A salient feature establishment tactic for cassava disease recognition","2024","Artificial Intelligence in Agriculture","14","","","115","132","17","0","10.1016/j.aiia.2024.11.004","https://www.scopus.com/inward/record.uri?eid=2-s2.0-85210753141&doi=10.1016%2fj.aiia.2024.11.004&partnerID=40&md5=c0fb34805300758f88b1cf759294841e","Article","Final","All Open Access; Gold Open Access","Scopus","2-s2.0-85210753141"
"Park S.-Y.; Ayana G.; Wako B.D.; Jeong K.C.; Yoon S.-D.; Choe S.-W.","Park, So-Yun (59557677800); Ayana, Gelan (57221909735); Wako, Beshatu Debela (57921685200); Jeong, Kwangcheol Casey (57146347400); Yoon, Soon-Do (8516122800); Choe, Se-Woon (34970866700)","59557677800; 57221909735; 57921685200; 57146347400; 8516122800; 34970866700","Vision Transformers for Low-Quality Histopathological Images: A Case Study on Squamous Cell Carcinoma Margin Classification","2025","Diagnostics","15","3","260","","","","0","10.3390/diagnostics15030260","https://www.scopus.com/inward/record.uri?eid=2-s2.0-85217782504&doi=10.3390%2fdiagnostics15030260&partnerID=40&md5=2c5de22aff928ad57c42e83eca6b1d4e","Article","Final","All Open Access; Gold Open Access","Scopus","2-s2.0-85217782504"
"Fatihia W.M.; Fariza A.; Karlita T.","Fatihia, Wifda Muna (58142350500); Fariza, Arna (57189232284); Karlita, Tita (57194779042)","58142350500; 57189232284; 57194779042","Convolutional neural network enhancement for mobile application of offline handwritten signature verification","2024","Telkomnika (Telecommunication Computing Electronics and Control)","22","4","","931","940","9","0","10.12928/TELKOMNIKA.v22i4.25849","https://www.scopus.com/inward/record.uri?eid=2-s2.0-85197188472&doi=10.12928%2fTELKOMNIKA.v22i4.25849&partnerID=40&md5=72b702712187750c2075a0835fbf1c0f","Article","Final","","Scopus","2-s2.0-85197188472"
