"Authors","Author full names","Author(s) ID","Title","Year","Source title","Volume","Issue","Art. No.","Page start","Page end","Page count","Cited by","DOI","Link","Document Type","Publication Stage","Open Access","Source","EID"
"Momeny M.; Neshat A.A.; Gholizadeh A.; Jafarnezhad A.; Rahmanzadeh E.; Marhamati M.; Moradi B.; Ghafoorifar A.; Zhang Y.-D.","Momeny, Mohammad (56165401100); Neshat, Ali Asghar (26325042000); Gholizadeh, Abdolmajid (55626417800); Jafarnezhad, Ahad (57193858676); Rahmanzadeh, Elham (57204913813); Marhamati, Mahmoud (57226458225); Moradi, Bagher (57147208500); Ghafoorifar, Ali (57390650900); Zhang, Yu-Dong (35786830100)","56165401100; 26325042000; 55626417800; 57193858676; 57204913813; 57226458225; 57147208500; 57390650900; 35786830100","Greedy Autoaugment for classification of mycobacterium tuberculosis image via generalized deep CNN using mixed pooling based on minimum square rough entropy","2022","Computers in Biology and Medicine","141","","105175","","","","31","10.1016/j.compbiomed.2021.105175","https://www.scopus.com/inward/record.uri?eid=2-s2.0-85121962200&doi=10.1016%2fj.compbiomed.2021.105175&partnerID=40&md5=d7ac68738f88b3b5a049522a633efd44","Article","Final","","Scopus","2-s2.0-85121962200"
"Shi Y.; Wang Z.; Du X.; Ling G.; Jia W.; Lu Y.","Shi, Yaoke (57214808114); Wang, Zhiwen (55719758700); Du, Xianjun (35239583700); Ling, Guobi (57611489100); Jia, Wenchao (57476686700); Lu, Yanrong (57184462600)","57214808114; 55719758700; 35239583700; 57611489100; 57476686700; 57184462600","Research on the membrane fouling diagnosis of MBR membrane module based on ECA-CNN","2022","Journal of Environmental Chemical Engineering","10","3","107649","","","","28","10.1016/j.jece.2022.107649","https://www.scopus.com/inward/record.uri?eid=2-s2.0-85128739210&doi=10.1016%2fj.jece.2022.107649&partnerID=40&md5=0a64058ced2683743cd7b29694b33545","Article","Final","","Scopus","2-s2.0-85128739210"
"Cao Y.; Zhao H.; Xu Z.; Yu H.; Long K.; Xu W.","Cao, Yang (57226777635); Zhao, Han (58842697000); Xu, Zhen (58138053800); Yu, Hui (57155355200); Long, Kaifang (57894129600); Xu, Weizhi (36626534800)","57226777635; 58842697000; 58138053800; 57155355200; 57894129600; 36626534800","A Channel-level Neural Network Compression Method Based on K-order Statistics","2022","Proceedings - 2022 12th International Conference on Information Technology in Medicine and Education, ITME 2022","","","","117","120","3","0","10.1109/ITME56794.2022.00034","https://www.scopus.com/inward/record.uri?eid=2-s2.0-85153939285&doi=10.1109%2fITME56794.2022.00034&partnerID=40&md5=74d2c8393f30b5ed31acfe15bc5f842c","Conference paper","Final","","Scopus","2-s2.0-85153939285"
"Chen H.; Su Y.-P.; Chen Y.-R.; Chiu C.-C.; Chen S.-J.","Chen, Hang (59288107600); Su, Yi-Pei (54791449000); Chen, Yean-Ru (13105936900); Chiu, Chi-Chieh (58141413900); Chen, Sao-Jie (35247405300)","59288107600; 54791449000; 13105936900; 58141413900; 35247405300","Robustness Analysis of Neural Network Designs for ReLU Family and Batch Normalization","2022","Proceedings - 2022 International Conference on Technologies and Applications of Artificial Intelligence, TAAI 2022","","","","1","6","5","1","10.1109/TAAI57707.2022.00010","https://www.scopus.com/inward/record.uri?eid=2-s2.0-85150012402&doi=10.1109%2fTAAI57707.2022.00010&partnerID=40&md5=8e6160aa925c718923b1016d2dd24c56","Conference paper","Final","","Scopus","2-s2.0-85150012402"
"Kawaguchi K.; Zhang L.; Deng Z.","Kawaguchi, Kenji (57189097784); Zhang, Linjun (56370071100); Deng, Zhun (57219620456)","57189097784; 56370071100; 57219620456","Understanding dynamics of nonlinear representation learning and its application","2022","Neural Computation","34","4","","991","1018","27","3","10.1162/neco_a_01483","https://www.scopus.com/inward/record.uri?eid=2-s2.0-85127486961&doi=10.1162%2fneco_a_01483&partnerID=40&md5=a7cf3d746bb3c35e20f161db583d0e79","Letter","Final","All Open Access; Green Open Access; Hybrid Gold Open Access","Scopus","2-s2.0-85127486961"
"Kanavos A.; Kolovos E.; Papadimitriou O.; Maragoudakis M.","Kanavos, Athanasios (57222342747); Kolovos, Efstratios (57971694900); Papadimitriou, Orestis (57638511800); Maragoudakis, Manolis (56209990000)","57222342747; 57971694900; 57638511800; 56209990000","Breast Cancer Classification of Histopathological Images using Deep Convolutional Neural Networks","2022","7th South-East Europe Design Automation, Computer Engineering, Computer Networks and Social Media Conference, SEEDA-CECNSM 2022","","","","","","","15","10.1109/SEEDA-CECNSM57760.2022.9932898","https://www.scopus.com/inward/record.uri?eid=2-s2.0-85142233791&doi=10.1109%2fSEEDA-CECNSM57760.2022.9932898&partnerID=40&md5=47cb449e88b3d4e6d042604457525640","Conference paper","Final","","Scopus","2-s2.0-85142233791"
"Huang L.; Zhang Z.; Xiao P.; Sun J.; Zhou X.","Huang, Liang (58295918700); Zhang, Zhendong (57193139309); Xiao, Pengfei (57203125292); Sun, Jiaqing (58476137400); Zhou, Xuecheng (58475664100)","58295918700; 57193139309; 57203125292; 58476137400; 58475664100","Classification and application of highway visibility based on deep learning; [基于深度学习的公路能见度分类及应用]","2022","Transactions of Atmospheric Sciences","45","2","","203","211","8","5","10.13878/j.cnki.dqkxxb.20220104002","https://www.scopus.com/inward/record.uri?eid=2-s2.0-85164112076&doi=10.13878%2fj.cnki.dqkxxb.20220104002&partnerID=40&md5=c0ea097ec38ea592f52087149892321f","Article","Final","","Scopus","2-s2.0-85164112076"
"Halbouni A.; Gunawan T.S.; Habaebi M.H.; Halbouni M.; Kartiwi M.; Ahmad R.","Halbouni, Asmaa (57272051500); Gunawan, Teddy Surya (8286407700); Habaebi, Mohamed Hadi (6602298043); Halbouni, Murad (57455317700); Kartiwi, Mira (35310925800); Ahmad, Robiah (57200986655)","57272051500; 8286407700; 6602298043; 57455317700; 35310925800; 57200986655","CNN-LSTM: Hybrid Deep Neural Network for Network Intrusion Detection System","2022","IEEE Access","10","","","99837","99849","12","155","10.1109/ACCESS.2022.3206425","https://www.scopus.com/inward/record.uri?eid=2-s2.0-85139391426&doi=10.1109%2fACCESS.2022.3206425&partnerID=40&md5=8d607fd4f4ade59830db8fc94f18d5d4","Article","Final","All Open Access; Gold Open Access","Scopus","2-s2.0-85139391426"
"Xiong J.; Zhou Y.; Bi R.; Wan L.; Tian Y.","Xiong, Jinbo (35094715500); Zhou, Yongjie (57447606400); Bi, Renwan (57217247736); Wan, Liang (36765093000); Tian, Youliang (55480173200)","35094715500; 57447606400; 57217247736; 36765093000; 55480173200","Towards edge-collaborative, lightweight and privacy-preserving classification framework; [边缘协同的轻量级隐私保护分类框架]","2022","Tongxin Xuebao/Journal on Communications","43","1","","127","137","10","6","10.11959/j.issn.1000-436x.2022004","https://www.scopus.com/inward/record.uri?eid=2-s2.0-85124403476&doi=10.11959%2fj.issn.1000-436x.2022004&partnerID=40&md5=14c2da075f0b8b42e301c04bbf64436c","Article","Final","","Scopus","2-s2.0-85124403476"
"Thakur R.S.; Chatterjee S.; Yadav R.N.; Gupta L.","Thakur, Rini Smita (57211981146); Chatterjee, Shubhojeet (57220550076); Yadav, Ram Narayan (56535923400); Gupta, Lalita (57201636212)","57211981146; 57220550076; 56535923400; 57201636212","Analysis of CNN Digit Classifier Parameters","2022","2022 2nd Asian Conference on Innovation in Technology, ASIANCON 2022","","","","","","","0","10.1109/ASIANCON55314.2022.9909081","https://www.scopus.com/inward/record.uri?eid=2-s2.0-85141549772&doi=10.1109%2fASIANCON55314.2022.9909081&partnerID=40&md5=cbcebb0fd982ba426e4e64aa972cf402","Conference paper","Final","","Scopus","2-s2.0-85141549772"
"Sun Y.; Yang H.; Zhou J.; Wang Y.","Sun, Yihao (56770264000); Yang, Hongjian (57453919300); Zhou, Jiliu (21234416400); Wang, Yan (56039981100)","56770264000; 57453919300; 21234416400; 56039981100","ISSMF: Integrated semantic and spatial information of multi-level features for automatic segmentation in prenatal ultrasound images","2022","Artificial Intelligence in Medicine","125","","102254","","","","15","10.1016/j.artmed.2022.102254","https://www.scopus.com/inward/record.uri?eid=2-s2.0-85124647427&doi=10.1016%2fj.artmed.2022.102254&partnerID=40&md5=48d0d89754d31bbbabe4a440a0013e63","Article","Final","","Scopus","2-s2.0-85124647427"
"Ergen T.; Sahiner A.; Ozturkler B.; Pauly J.; Mardani M.; Pilanci M.","Ergen, Tolga (57195223149); Sahiner, Arda (57215195115); Ozturkler, Batu (57216454606); Pauly, John (7101724924); Mardani, Morteza (26325501300); Pilanci, Mert (35076270900)","57195223149; 57215195115; 57216454606; 7101724924; 26325501300; 35076270900","DEMYSTIFYING BATCH NORMALIZATION IN RELU NETWORKS: EQUIVALENT CONVEX OPTIMIZATION MODELS AND IMPLICIT REGULARIZATION","2022","ICLR 2022 - 10th International Conference on Learning Representations","","","","","","","8","","https://www.scopus.com/inward/record.uri?eid=2-s2.0-85150341653&partnerID=40&md5=de65267b80b45567de46e006858ee1da","Conference paper","Final","","Scopus","2-s2.0-85150341653"
"Maniraju M.; Adithya R.; Srilekha G.","Maniraju, Medishetty (57863006500); Adithya, Rudrangi (57191363496); Srilekha, Gandu (57202198805)","57863006500; 57191363496; 57202198805","Recognition of Type of Skin Disease Using CNN","2022","2022 1st International Conference on Artificial Intelligence Trends and Pattern Recognition, ICAITPR 2022","","","","","","","6","10.1109/ICAITPR51569.2022.9844199","https://www.scopus.com/inward/record.uri?eid=2-s2.0-85136807373&doi=10.1109%2fICAITPR51569.2022.9844199&partnerID=40&md5=ba68ab1f61ed14f4fcf25f29590a02b8","Conference paper","Final","","Scopus","2-s2.0-85136807373"
"Eldeeb A.H.; Amr M.N.; Ibrahim A.S.; Kamel H.; Fouad S.","Eldeeb, Ahmed H. (24821665000); Amr, Mohammed Nagah (57221596240); Ibrahim, Amin S. (58954363800); Kamel, Hesham (57196760372); Fouad, Sara (58038755700)","24821665000; 57221596240; 58954363800; 57196760372; 58038755700","A Robust CNN Model for Diagnosis of COVID-19 Based on CT Scan Images and DL Techniques","2022","International Journal of Electronics and Telecommunications","68","4","","731","739","8","1","10.24425/ijet.2022.143879","https://www.scopus.com/inward/record.uri?eid=2-s2.0-85145346244&doi=10.24425%2fijet.2022.143879&partnerID=40&md5=49f9d609520d76016120bad595f434f5","Article","Final","All Open Access; Gold Open Access; Green Open Access","Scopus","2-s2.0-85145346244"
"Sobahi N.; Sengur A.; Tan R.-S.; Acharya U.R.","Sobahi, Nebras (55207271000); Sengur, Abdulkadir (12545159900); Tan, Ru-San (7201984906); Acharya, U. Rajendra (7004510847)","55207271000; 12545159900; 7201984906; 7004510847","Attention-based 3D CNN with residual connections for efficient ECG-based COVID-19 detection","2022","Computers in Biology and Medicine","143","","105335","","","","28","10.1016/j.compbiomed.2022.105335","https://www.scopus.com/inward/record.uri?eid=2-s2.0-85125012738&doi=10.1016%2fj.compbiomed.2022.105335&partnerID=40&md5=3fa169e0ec7ff74503199ddbd09859c6","Article","Final","All Open Access; Green Open Access","Scopus","2-s2.0-85125012738"
"Zhang F.; Huang Y.; Fang Z.; Guo W.","Zhang, Fan (57214101079); Huang, Yun (57667447300); Fang, Zizhuo (57668107800); Guo, Wei (57199262930)","57214101079; 57667447300; 57668107800; 57199262930","Lost-minimum post-training parameter quantization method for convolutional neural network; [卷积神经网络的损失最小训练后参数量化方法]","2022","Tongxin Xuebao/Journal on Communications","43","4","","114","122","8","3","10.11959/j.issn.1000-436x.2022068","https://www.scopus.com/inward/record.uri?eid=2-s2.0-85129475830&doi=10.11959%2fj.issn.1000-436x.2022068&partnerID=40&md5=994b6fee632024820871f5f71546b0c1","Article","Final","","Scopus","2-s2.0-85129475830"
"Ullah N.; Khan J.A.; Almakdi S.; Khan M.S.; Alshehri M.; Alboaneen D.; Raza A.","Ullah, Naeem (57431950400); Khan, Javed Ali (57209631963); Almakdi, Sultan (57211498975); Khan, Mohammad Sohail (57737573800); Alshehri, Mohammed (57210193521); Alboaneen, Dabiah (56530765900); Raza, Asaf (57563158400)","57431950400; 57209631963; 57211498975; 57737573800; 57210193521; 56530765900; 57563158400","A Novel CovidDetNet Deep Learning Model for Effective COVID-19 Infection Detection Using Chest Radiograph Images","2022","Applied Sciences (Switzerland)","12","12","6269","","","","33","10.3390/app12126269","https://www.scopus.com/inward/record.uri?eid=2-s2.0-85132944528&doi=10.3390%2fapp12126269&partnerID=40&md5=18ce2c73dec5048ac536265beffb4c31","Article","Final","All Open Access; Gold Open Access","Scopus","2-s2.0-85132944528"
"Hayat S.; She K.; Mateen M.; Suwansrikham P.; Alghaili M.A.A.","Hayat, Shaukat (57202985744); She, Kun (6603966856); Mateen, Muhammad (57205367635); Suwansrikham, Parinya (57191868254); Alghaili, Muhammad Abdullah Ahmed (57218608519)","57202985744; 6603966856; 57205367635; 57191868254; 57218608519","Tuning-up Learning Parameters for Deep Convolutional Neural Network: A Case Study for Hand-Drawn Sketch Images","2022","Journal of Electronic Science and Technology","20","3","","305","318","13","1","10.11989/JEST.1674-862X.90521018","https://www.scopus.com/inward/record.uri?eid=2-s2.0-85141750529&doi=10.11989%2fJEST.1674-862X.90521018&partnerID=40&md5=9967dbb05e14d7db04bb47374d8f7429","Article","Final","","Scopus","2-s2.0-85141750529"
"Bodapati J.D.; Srilakshmi U.; Veeranjaneyulu N.","Bodapati, Jyostna Devi (57209269087); Srilakshmi, U. (57493876800); Veeranjaneyulu, N. (56195255000)","57209269087; 57493876800; 56195255000","FERNet: A Deep CNN Architecture for Facial Expression Recognition in the Wild","2022","Journal of The Institution of Engineers (India): Series B","103","2","","439","448","9","35","10.1007/s40031-021-00681-8","https://www.scopus.com/inward/record.uri?eid=2-s2.0-85116659046&doi=10.1007%2fs40031-021-00681-8&partnerID=40&md5=0360438ed92b1fb75436feb4bc486d7d","Article","Final","","Scopus","2-s2.0-85116659046"
"Ghosh S.K.; Ghosh A.","Ghosh, Swarup Kr (57209784792); Ghosh, Anupam (57207840134)","57209784792; 57207840134","ENResNet: A novel residual neural network for chest X-ray enhancement based COVID-19 detection","2022","Biomedical Signal Processing and Control","72","","103286","","","","24","10.1016/j.bspc.2021.103286","https://www.scopus.com/inward/record.uri?eid=2-s2.0-85118493078&doi=10.1016%2fj.bspc.2021.103286&partnerID=40&md5=912bbca02426b9a3daf6e7a7d895a3f3","Article","Final","All Open Access; Green Open Access","Scopus","2-s2.0-85118493078"
"Kumar Pathak D.; Kumar Kalita S.; Kumar Bhattacharya D.","Kumar Pathak, Diganta (56022825200); Kumar Kalita, Sanjib (57222129903); Kumar Bhattacharya, Dhruba (57226541528)","56022825200; 57222129903; 57226541528","Spectral spatial joint feature based convolution neural network for hyperspectral image classification","2022","Concurrency and Computation: Practice and Experience","34","3","e6547","","","","0","10.1002/cpe.6547","https://www.scopus.com/inward/record.uri?eid=2-s2.0-85111795300&doi=10.1002%2fcpe.6547&partnerID=40&md5=517d67266be64ffab8b2ab966b39ddf1","Article","Final","","Scopus","2-s2.0-85111795300"
"Saleem M.H.; Velayudhan K.K.; Potgieter J.; Arif K.M.","Saleem, Muhammad Hammad (57212779883); Velayudhan, Kesini Krishnan (57679625000); Potgieter, Johan (7006502375); Arif, Khalid Mahmood (58174208000)","57212779883; 57679625000; 7006502375; 58174208000","Weed Identification by Single-Stage and Two-Stage Neural Networks: A Study on the Impact of Image Resizers and Weights Optimization Algorithms","2022","Frontiers in Plant Science","13","","850666","","","","22","10.3389/fpls.2022.850666","https://www.scopus.com/inward/record.uri?eid=2-s2.0-85129862863&doi=10.3389%2ffpls.2022.850666&partnerID=40&md5=61937cfd20510eb38a84921d4f01c527","Article","Final","All Open Access; Gold Open Access; Green Open Access","Scopus","2-s2.0-85129862863"
"Zhou Y.; Yang Q.; Ma Q.; Xue B.; Kong X.","Zhou, Yuan (58432670000); Yang, Qingqing (57885951000); Ma, Qiang (57885494500); Xue, Bowei (59573257400); Kong, Xiangnan (57886649500)","58432670000; 57885951000; 57885494500; 59573257400; 57886649500","Improved one-stage fully convolutional network for oblique object detection in remote sensing imagery; [一阶全卷积遥感影像倾斜目标检测]","2022","Journal of Image and Graphics","27","8","","2537","2548","11","0","10.11834/jig.210157","https://www.scopus.com/inward/record.uri?eid=2-s2.0-85137753470&doi=10.11834%2fjig.210157&partnerID=40&md5=dea2f1c22bdb8c1b05a3e04b0af37d07","Article","Final","","Scopus","2-s2.0-85137753470"
"Lilhore U.K.; Imoize A.L.; Lee C.-C.; Simaiya S.; Pani S.K.; Goyal N.; Kumar A.; Li C.-T.","Lilhore, Umesh Kumar (55445409800); Imoize, Agbotiname Lucky (37053839500); Lee, Cheng-Chi (57193123962); Simaiya, Sarita (57216622514); Pani, Subhendu Kumar (35956708700); Goyal, Nitin (57197133706); Kumar, Arun (36968281100); Li, Chun-Ta (27167640600)","55445409800; 37053839500; 57193123962; 57216622514; 35956708700; 57197133706; 36968281100; 27167640600","Enhanced Convolutional Neural Network Model for Cassava Leaf Disease Identification and Classification","2022","Mathematics","10","4","580","","","","72","10.3390/math10040580","https://www.scopus.com/inward/record.uri?eid=2-s2.0-85125996691&doi=10.3390%2fmath10040580&partnerID=40&md5=0440892a2413e07ff12db12999876451","Article","Final","All Open Access; Gold Open Access","Scopus","2-s2.0-85125996691"
"Mirasol I.V.O.; Abu P.A.R.; Reyes R.S.J.","Mirasol, Ian Vincent O. (57191751434); Abu, Patricia Angela R. (57191241918); Reyes, Rosula S. J. (7102095301)","57191751434; 57191241918; 7102095301","Construction of a Repeatable Framework for Prostate Cancer Lesion Binary Semantic Segmentation using Convolutional Neural Networks","2022","International Journal of Advanced Computer Science and Applications","13","6","","819","823","4","1","10.14569/IJACSA.2022.0130697","https://www.scopus.com/inward/record.uri?eid=2-s2.0-85133365608&doi=10.14569%2fIJACSA.2022.0130697&partnerID=40&md5=8bd65e122bfc420209133c18bc0a88d3","Article","Final","All Open Access; Gold Open Access","Scopus","2-s2.0-85133365608"
"Zhang H.; Feng L.; Zhang X.; Yang Y.; Li J.","Zhang, Huibin (56104518300); Feng, Liping (57411995100); Zhang, Xiaohua (15074468100); Yang, Yuchi (57203341651); Li, Jing (57841565400)","56104518300; 57411995100; 15074468100; 57203341651; 57841565400","Necessary conditions for convergence of CNNs and initialization of convolution kernels","2022","Digital Signal Processing: A Review Journal","123","","103397","","","","28","10.1016/j.dsp.2022.103397","https://www.scopus.com/inward/record.uri?eid=2-s2.0-85122821447&doi=10.1016%2fj.dsp.2022.103397&partnerID=40&md5=3ee0486291497fd28a47391efe30bffb","Review","Final","All Open Access; Hybrid Gold Open Access","Scopus","2-s2.0-85122821447"
"Tippannavar S.S.; Harshith R.; Shashidhar R.; Sweekar S.C.; Jain S.","Tippannavar, Sanjay S (57645701400); Harshith, R. (58174955000); Shashidhar, R. (57200788874); Sweekar, S.C. (58175411300); Jain, Sourab (58176124200)","57645701400; 58174955000; 57200788874; 58175411300; 58176124200","ECG based Heart Disease Classification and Validation using 2D CNN","2022","Proceedings of 5th International Conference on Contemporary Computing and Informatics, IC3I 2022","","","","1182","1186","4","4","10.1109/IC3I56241.2022.10073094","https://www.scopus.com/inward/record.uri?eid=2-s2.0-85151938927&doi=10.1109%2fIC3I56241.2022.10073094&partnerID=40&md5=36c63425a3baa335c693b5f470b440af","Conference paper","Final","","Scopus","2-s2.0-85151938927"
"Raen R.; Islam M.M.; Islam R.","Raen, Reana (57703650500); Islam, Muhammad Muinul (55547121400); Islam, Redwanul (57564600400)","57703650500; 55547121400; 57564600400","Diagnosis of Retinal Diseases by Classifying Lesions in Retinal Layers using a Modified ResNet Architecture","2022","2022 International Conference on Advancement in Electrical and Electronic Engineering, ICAEEE 2022","","","","","","","2","10.1109/ICAEEE54957.2022.9836427","https://www.scopus.com/inward/record.uri?eid=2-s2.0-85136176601&doi=10.1109%2fICAEEE54957.2022.9836427&partnerID=40&md5=a80207b2f8bf708549b5f7b27ea283c3","Conference paper","Final","","Scopus","2-s2.0-85136176601"
"Sun W.-B.; Wang R.; Gao R.-H.; Li Q.-F.; Wu H.-R.; Feng L.","Sun, Wen-Bin (57912256700); Wang, Rong (57221059245); Gao, Rong-Hua (24824729600); Li, Qi-Feng (57205964175); Wu, Hua-Rui (15822720700); Feng, Lu (57223331687)","57912256700; 57221059245; 24824729600; 57205964175; 15822720700; 57223331687","Crop Disease Recognition Based on Visible Spectrum and Improved Attention Module; [基于可见光谱和改进注意力的农作物病害识别]","2022","Guang Pu Xue Yu Guang Pu Fen Xi/Spectroscopy and Spectral Analysis","42","5","","1572","1580","8","11","10.3964/j.issn.1000-0593(2022)05-1572-09","https://www.scopus.com/inward/record.uri?eid=2-s2.0-85129743679&doi=10.3964%2fj.issn.1000-0593%282022%2905-1572-09&partnerID=40&md5=f5a98acdf93dd7d54ae2e0b43e41ec66","Article","Final","","Scopus","2-s2.0-85129743679"
"Khan R.A.; Luo Y.; Wu F.-X.","Khan, Rayyan Azam (57193138638); Luo, Yigang (56200746900); Wu, Fang-Xiang (55843631800)","57193138638; 56200746900; 55843631800","RMS-UNet: Residual multi-scale UNet for liver and lesion segmentation","2022","Artificial Intelligence in Medicine","124","","102231","","","","48","10.1016/j.artmed.2021.102231","https://www.scopus.com/inward/record.uri?eid=2-s2.0-85123008909&doi=10.1016%2fj.artmed.2021.102231&partnerID=40&md5=8cd487d360d29482f0c0954d734c6a17","Article","Final","","Scopus","2-s2.0-85123008909"
"Mittal R.; Malik V.; Rana A.","Mittal, Ruchi (57210932810); Malik, Varun (57220515306); Rana, Ajay (55290452600)","57210932810; 57220515306; 55290452600","DL-ASD: A Deep Learning Approach for Autism Spectrum Disorder","2022","Proceedings of 5th International Conference on Contemporary Computing and Informatics, IC3I 2022","","","","1767","1770","3","11","10.1109/IC3I56241.2022.10072429","https://www.scopus.com/inward/record.uri?eid=2-s2.0-85151993300&doi=10.1109%2fIC3I56241.2022.10072429&partnerID=40&md5=46de03a660d82c825a2339b22989458a","Conference paper","Final","","Scopus","2-s2.0-85151993300"
"Zhang J.; Bao W.","Zhang, Jian (57225122136); Bao, Wenxing (35770357700)","57225122136; 35770357700","Research on classification method of hyperspectral remote sensing image based on Generative Adversarial Network; [生成式对抗网络的高光谱遥感图像分类方法研究]","2022","National Remote Sensing Bulletin","26","2","","416","430","14","1","10.11834/jrs.20219192","https://www.scopus.com/inward/record.uri?eid=2-s2.0-85135788024&doi=10.11834%2fjrs.20219192&partnerID=40&md5=b6d81ea5d2cd2dd4dbfef6db7b94bb1e","Article","Final","All Open Access; Bronze Open Access","Scopus","2-s2.0-85135788024"
"Zada S.; Benou I.; Irani M.","Zada, Shiran (57385251500); Benou, Itay (55546897000); Irani, Michal (56988856000)","57385251500; 55546897000; 56988856000","Pure Noise to the Rescue of Insufficient Data: Improving Imbalanced Classification by Training on Random Noise Images","2022","Proceedings of Machine Learning Research","162","","","25817","25833","16","9","","https://www.scopus.com/inward/record.uri?eid=2-s2.0-85148703677&partnerID=40&md5=125dc5e8362f876c3319913270e6cafd","Conference paper","Final","","Scopus","2-s2.0-85148703677"
"Shah D.; Trivedi V.; Sheth V.; Shah A.; Chauhan U.","Shah, Dhruvil (57223048788); Trivedi, Vishvesh (57224776387); Sheth, Vinay (57224766563); Shah, Aakash (57218674883); Chauhan, Uttam (56045696400)","57223048788; 57224776387; 57224766563; 57218674883; 56045696400","ResTS: Residual Deep interpretable architecture for plant disease detection","2022","Information Processing in Agriculture","9","2","","212","223","11","86","10.1016/j.inpa.2021.06.001","https://www.scopus.com/inward/record.uri?eid=2-s2.0-85108257140&doi=10.1016%2fj.inpa.2021.06.001&partnerID=40&md5=2f766d7f2bda817c0a55f237c155c137","Article","Final","All Open Access; Gold Open Access","Scopus","2-s2.0-85108257140"
"Azadnia R.; Jahanbakhshi A.; Rashidi S.; khajehzadeh M.","Azadnia, Rahim (57215595562); Jahanbakhshi, Ahmad (56206284000); Rashidi, Shima (57191821213); khajehzadeh, Mohammad (36716343700)","57215595562; 56206284000; 57191821213; 36716343700","Developing an automated monitoring system for fast and accurate prediction of soil texture using an image-based deep learning network and machine vision system","2022","Measurement: Journal of the International Measurement Confederation","190","","110669","","","","38","10.1016/j.measurement.2021.110669","https://www.scopus.com/inward/record.uri?eid=2-s2.0-85123601069&doi=10.1016%2fj.measurement.2021.110669&partnerID=40&md5=13baf93eb662bd78cc7d356573523c15","Article","Final","","Scopus","2-s2.0-85123601069"
"Topalova I.; Staeva Y.","Topalova, Irina (6602886581); Staeva, Yuliana (57911993900)","6602886581; 57911993900","CLASSIFICATION OF TWO-DIMENSIONAL MECHANICAL PARTS USING A CONVOLUTIONAL NEURAL NETWORK","2022","Annals of DAAAM and Proceedings of the International DAAAM Symposium","33","1","","42","49","7","1","10.2507/33rd.daaam.proceedings.007","https://www.scopus.com/inward/record.uri?eid=2-s2.0-85149436966&doi=10.2507%2f33rd.daaam.proceedings.007&partnerID=40&md5=654abd83b283015a77c4563e96c99afd","Conference paper","Final","All Open Access; Gold Open Access","Scopus","2-s2.0-85149436966"
"Dai M.; Xing S.; Xu Q.; Li P.; Chen K.","Dai, Mofan (57224314596); Xing, Shuai (8624937400); Xu, Qing (55722554000); Li, Pengcheng (55494986400); Chen, Kun (57226889209)","57224314596; 8624937400; 55722554000; 55494986400; 57226889209","Semantic segmentation of airborne LiDAR point cloud based on multi-feature fusion and geometric convolution; [多特征融合与几何卷积的机载LiDAR点云地物分类]","2022","Journal of Image and Graphics","27","2","","574","585","11","5","10.11834/jig.210555","https://www.scopus.com/inward/record.uri?eid=2-s2.0-85125345340&doi=10.11834%2fjig.210555&partnerID=40&md5=d7e92b9576bb57025721662e2677dd33","Article","Final","","Scopus","2-s2.0-85125345340"
