"Authors","Author full names","Author(s) ID","Title","Year","Source title","Volume","Issue","Art. No.","Page start","Page end","Page count","Cited by","DOI","Link","Document Type","Publication Stage","Open Access","Source","EID"
"Xu Y.; Ma Y.","Xu, Yang (57874207500); Ma, Yongjie (55847282300)","57874207500; 55847282300","Evolutionary neural architecture search based on group whitening residual ConvNet and large kernel subspace attention module","2024","International Journal of Computers and Applications","46","4","","195","207","12","0","10.1080/1206212X.2023.2300221","https://www.scopus.com/inward/record.uri?eid=2-s2.0-85181519709&doi=10.1080%2f1206212X.2023.2300221&partnerID=40&md5=83fda3716ae5012e1953da2b71c9406a","Article","Final","","Scopus","2-s2.0-85181519709"
"Gao Z.; Wu F.; Gao W.; Zhuang X.","Gao, Zheyao (57438884500); Wu, Fuping (57203971535); Gao, Weiguo (7402758491); Zhuang, Xiahai (13610254200)","57438884500; 57203971535; 7402758491; 13610254200","A New Framework of Swarm Learning Consolidating Knowledge From Multi-Center Non-IID Data for Medical Image Segmentation","2023","IEEE Transactions on Medical Imaging","42","7","","2118","2129","11","6","10.1109/TMI.2022.3220750","https://www.scopus.com/inward/record.uri?eid=2-s2.0-85141640534&doi=10.1109%2fTMI.2022.3220750&partnerID=40&md5=df64b3e99d1f48aeb7acf21e14e3baa8","Article","Final","","Scopus","2-s2.0-85141640534"
"Asif S.; Khan S.U.R.; Zheng X.; Zhao M.","Asif, Sohaib (57221248320); Khan, Saif Ur Rehman (55746684000); Zheng, Xiaolong (57957660700); Zhao, Ming (57189875649)","57221248320; 55746684000; 57957660700; 57189875649","MozzieNet: A deep learning approach to efficiently detect malaria parasites in blood smear images","2024","International Journal of Imaging Systems and Technology","34","1","e22953","","","","13","10.1002/ima.22953","https://www.scopus.com/inward/record.uri?eid=2-s2.0-85168446560&doi=10.1002%2fima.22953&partnerID=40&md5=1856a4a3a9ed7a00fb40962c03f9c378","Article","Final","","Scopus","2-s2.0-85168446560"
"Md. Muttakin G.K.; Yesmin F.; Alam S.S.; Ashraf M.S.; Akuthota V.; Quader M.A.","Md. Muttakin, G.K. (59008359000); Yesmin, Farhana (59008572000); Alam, Syeda Sadia (59007753900); Ashraf, Md Sadi (58591516500); Akuthota, Vishwanath (58985609200); Quader, Montaser Abdul (57557738100)","59008359000; 59008572000; 59007753900; 58591516500; 58985609200; 57557738100","Comparative Analysis of Diverse Architectures for Accurate Blood Cancer Cell Classification","2024","ICCECE 2024 - International Conference on Computer, Electrical and Communication Engineering","","","","","","","1","10.1109/ICCECE58645.2024.10497341","https://www.scopus.com/inward/record.uri?eid=2-s2.0-85191714782&doi=10.1109%2fICCECE58645.2024.10497341&partnerID=40&md5=c5a40ce4ae4ed382f7bdffe310c7ee78","Conference paper","Final","","Scopus","2-s2.0-85191714782"
"Bompem G.; Pandluri D.","Bompem, Gouri (58133686100); Pandluri, Dhanalakshmi (57194332037)","58133686100; 57194332037","Batch Normalization Based Convolutional Neural Network for Segmentation and Classification of Brain Tumor MRI Images","2024","International Journal of Intelligent Engineering and Systems","17","2","","39","49","10","1","10.22266/ijies2024.0430.04","https://www.scopus.com/inward/record.uri?eid=2-s2.0-85188152655&doi=10.22266%2fijies2024.0430.04&partnerID=40&md5=470ad8d3bb3eb69d0e2eb56f49111ba6","Article","Final","All Open Access; Bronze Open Access","Scopus","2-s2.0-85188152655"
"Khan A.A.; Mahendran R.K.; Perumal K.; Faheem M.","Khan, Arfat Ahmad (58106961000); Mahendran, Rakesh Kumar (58151259500); Perumal, Kumar (58265901700); Faheem, Muhammad (58648789900)","58106961000; 58151259500; 58265901700; 58648789900","Dual-3DM3AD: Mixed Transformer Based Semantic Segmentation and Triplet Pre-Processing for Early Multi-Class Alzheimer's Diagnosis","2024","IEEE Transactions on Neural Systems and Rehabilitation Engineering","32","","","696","707","11","23","10.1109/TNSRE.2024.3357723","https://www.scopus.com/inward/record.uri?eid=2-s2.0-85183664828&doi=10.1109%2fTNSRE.2024.3357723&partnerID=40&md5=407787bbe4f56aba2d575507877c93af","Article","Final","All Open Access; Gold Open Access; Green Open Access","Scopus","2-s2.0-85183664828"
"Kazi S.; Palkar B.","Kazi, Sanam (59572542100); Palkar, Bhakti (57201354050)","59572542100; 57201354050","Design of Enhanced CNN Model for Rice Disease Classification with Comparative Analysis on Different Variants of Dataset","2024","2nd International Conference on Emerging Trends in Information Technology and Engineering, ic-ETITE 2024","","","","","","","0","10.1109/ic-ETITE58242.2024.10493787","https://www.scopus.com/inward/record.uri?eid=2-s2.0-85192565663&doi=10.1109%2fic-ETITE58242.2024.10493787&partnerID=40&md5=ff2f5237dc9a6827ea2ecffeb37ed618","Conference paper","Final","","Scopus","2-s2.0-85192565663"
"Balaji N.S.; Hemachandran M.; Jansi R.","Balaji, N. Sathish (59171496400); Hemachandran, M. (59172351900); Jansi, R. (57201913625)","59171496400; 59172351900; 57201913625","Precision Brain Tumor Detection Using Integrated Batch Normalization","2024","Proceedings of the 2024 10th International Conference on Communication and Signal Processing, ICCSP 2024","","","","438","443","5","0","10.1109/ICCSP60870.2024.10544028","https://www.scopus.com/inward/record.uri?eid=2-s2.0-85195986765&doi=10.1109%2fICCSP60870.2024.10544028&partnerID=40&md5=2452318747640e0e5815733f9458cb28","Conference paper","Final","","Scopus","2-s2.0-85195986765"
"Alam F.B.; Podder P.; Mondal M.R.H.","Alam, Fatema Binte (58289247900); Podder, Prajoy (56607203500); Mondal, M. Rubaiyat Hossain (57219750977)","58289247900; 56607203500; 57219750977","RVCNet: A hybrid deep neural network framework for the diagnosis of lung diseases","2023","PLoS ONE","18","12 December","e0293125","","","","7","10.1371/journal.pone.0293125","https://www.scopus.com/inward/record.uri?eid=2-s2.0-85181108052&doi=10.1371%2fjournal.pone.0293125&partnerID=40&md5=e12347c6d7f1be8f580a5d6a832d8f28","Article","Final","All Open Access; Gold Open Access; Green Open Access","Scopus","2-s2.0-85181108052"
"Li Y.; Wang X.; Zhang X.; Fang J.; Zhang X.","Li, Yujie (58648287100); Wang, Xing (58393058900); Zhang, Xiaojuan (58882196900); Fang, Jiahao (58881763800); Zhang, Xuefeng (37122980800)","58648287100; 58393058900; 58882196900; 58881763800; 37122980800","WRBSNet: A Novel Sea-Land Segmentation Network With a Wider Range of Batch Sizes","2024","IEEE Geoscience and Remote Sensing Letters","21","","6006005","1","5","4","2","10.1109/LGRS.2024.3362756","https://www.scopus.com/inward/record.uri?eid=2-s2.0-85184827618&doi=10.1109%2fLGRS.2024.3362756&partnerID=40&md5=a62b52fe8dbb1e00a4f2ec4b82d02faa","Article","Final","","Scopus","2-s2.0-85184827618"
"Xie T.; Huang X.; Choi S.-K.","Xie, Tingli (57193406007); Huang, Xufeng (57218095975); Choi, Seung-Kyum (24074141400)","57193406007; 57218095975; 24074141400","Metric-Based Meta-Learning for Cross-Domain Few-Shot Identification of Welding Defect","2023","Journal of Computing and Information Science in Engineering","23","4","030902","","","","5","10.1115/1.4056219","https://www.scopus.com/inward/record.uri?eid=2-s2.0-85187898357&doi=10.1115%2f1.4056219&partnerID=40&md5=97e6bc38093be06a492564151a43196c","Article","Final","","Scopus","2-s2.0-85187898357"
"Imani Z.; Ezoji M.","Imani, Zahra (57210059771); Ezoji, Mehdi (14319123400)","57210059771; 14319123400","Multi-level brain-guided fusion to reinforce spiking neural network in image classification","2024","Multimedia Tools and Applications","","","","","","","1","10.1007/s11042-024-19665-z","https://www.scopus.com/inward/record.uri?eid=2-s2.0-85196380160&doi=10.1007%2fs11042-024-19665-z&partnerID=40&md5=be9858bdcbe543a463cf31611da613cb","Article","Article in press","","Scopus","2-s2.0-85196380160"
"Wary A.; Gupta N.; Garg P.; Rajoria A.","Wary, Alongbar (57203892763); Gupta, Navya (58828337400); Garg, Pratha (59134925000); Rajoria, Anushka (59134524300)","57203892763; 58828337400; 59134925000; 59134524300","FloraCheck: Pioneering for Leaf Disease Recognition","2024","CEUR Workshop Proceedings","3682","","","39","54","15","0","","https://www.scopus.com/inward/record.uri?eid=2-s2.0-85193614952&partnerID=40&md5=c8c27d37e2bebe798369717bdc49be71","Conference paper","Final","","Scopus","2-s2.0-85193614952"
"Ramya R.; Kumar P.","Ramya, R. (57214386779); Kumar, P. (26423006100)","57214386779; 26423006100","High-performance deep transfer learning model with batch normalization based on multiscale feature fusion for tomato plant disease identification and categorization","2023","Environmental Research Communications","5","12","125015","","","","4","10.1088/2515-7620/ace594","https://www.scopus.com/inward/record.uri?eid=2-s2.0-85183413432&doi=10.1088%2f2515-7620%2face594&partnerID=40&md5=076b41dea5221e8850ea644159669d0b","Article","Final","All Open Access; Gold Open Access","Scopus","2-s2.0-85183413432"
"Wu S.; Bai X.; Cai L.; Wang L.; Zhang X.; Ke Q.; Huang J.","Wu, Shiqiang (57138848600); Bai, Xiaoming (57965290300); Cai, Liquan (57225687713); Wang, Liangming (57220191033); Zhang, XiaoLu (56674852300); Ke, Qingfeng (57139969200); Huang, Jianlong (57210983352)","57138848600; 57965290300; 57225687713; 57220191033; 56674852300; 57139969200; 57210983352","Bone tumor examination based on FCNN-4s and CRF fine segmentation fusion algorithm","2023","Journal of Bone Oncology","42","","100502","","","","2","10.1016/j.jbo.2023.100502","https://www.scopus.com/inward/record.uri?eid=2-s2.0-85171368756&doi=10.1016%2fj.jbo.2023.100502&partnerID=40&md5=dde657256bf6481ff775389c15485954","Article","Final","All Open Access; Gold Open Access; Green Open Access","Scopus","2-s2.0-85171368756"
"Jia S.; Lysenko A.; Boroevich K.A.; Sharma A.; Tsunoda T.","Jia, Shangru (58258027100); Lysenko, Artem (35105526200); Boroevich, Keith A (8505888200); Sharma, Alok (55482800200); Tsunoda, Tatsuhiko (7203020452)","58258027100; 35105526200; 8505888200; 55482800200; 7203020452","scDeepInsight: a supervised cell-type identification method for scRNA-seq data with deep learning","2023","Briefings in Bioinformatics","24","5","bbad266","","","","17","10.1093/bib/bbad266","https://www.scopus.com/inward/record.uri?eid=2-s2.0-85172423866&doi=10.1093%2fbib%2fbbad266&partnerID=40&md5=00baaa5abba7f4b2b6771f6daa7371af","Article","Final","All Open Access; Green Open Access; Hybrid Gold Open Access","Scopus","2-s2.0-85172423866"
"Xue D.; Huang J.; Zhou R.; Tai Y.; Zhang J.","Xue, Dandan (58701592500); Huang, Jiechun (55745238900); Zhou, Rui (57222999443); Tai, Yonghang (36984437500); Zhang, Jun (58397674000)","58701592500; 55745238900; 57222999443; 36984437500; 58397674000","Secured COVID-19 CT image classification based on human-centric IoT and vision transformer","2024","Journal of Ambient Intelligence and Humanized Computing","","","","","","","0","10.1007/s12652-024-04797-9","https://www.scopus.com/inward/record.uri?eid=2-s2.0-85190697967&doi=10.1007%2fs12652-024-04797-9&partnerID=40&md5=e77baa344aff5705b50eaa0879f2f52c","Article","Article in press","","Scopus","2-s2.0-85190697967"
"Radhi E.; Kamil M.","Radhi, Eman (57223428851); Kamil, Mohammed (57192644848)","57223428851; 57192644848","An Automatic Segmentation of Breast Ultrasound Images Using U-Net Model","2023","Serbian Journal of Electrical Engineering","20","2","","191","203","12","5","10.2298/SJEE2302191R","https://www.scopus.com/inward/record.uri?eid=2-s2.0-85165980491&doi=10.2298%2fSJEE2302191R&partnerID=40&md5=3334540435dad24e1cc07a49992a6c29","Article","Final","All Open Access; Gold Open Access","Scopus","2-s2.0-85165980491"
"Yang H.; Xu M.; Cai B.; Liang P.; Sun Z.; Song B.; Cheng E.","Yang, Han (57218712735); Xu, Minxia (58778372000); Cai, Bin (56896723300); Liang, Pengpeng (55416704400); Sun, Zhiyong (56039956300); Song, Bo (56457219400); Cheng, Erkang (57224190343)","57218712735; 58778372000; 56896723300; 55416704400; 56039956300; 56457219400; 57224190343","Distance Transform Guided Medical Image Segmentation With Channel Information Exchange","2023","ACM International Conference Proceeding Series","","","","82","87","5","0","10.1145/3639631.3639645","https://www.scopus.com/inward/record.uri?eid=2-s2.0-85185846094&doi=10.1145%2f3639631.3639645&partnerID=40&md5=7c537c8cdd7f874951b40d6e0af8baa3","Conference paper","Final","","Scopus","2-s2.0-85185846094"
"Pan H.; Hamdan E.; Zhu X.; Atici S.; Cetin A.E.","Pan, Hongyi (57216394593); Hamdan, Emadeldeen (58482520400); Zhu, Xin (57286508800); Atici, Salih (57778542200); Cetin, Ahmet Enis (57197548971)","57216394593; 58482520400; 57286508800; 57778542200; 57197548971","Multichannel Orthogonal Transform-Based Perceptron Layers for Efficient ResNets","2024","IEEE Transactions on Neural Networks and Learning Systems","","","","1","12","11","2","10.1109/TNNLS.2024.3384316","https://www.scopus.com/inward/record.uri?eid=2-s2.0-85191348593&doi=10.1109%2fTNNLS.2024.3384316&partnerID=40&md5=478ad857da84d188abac50aace9a767c","Article","Article in press","All Open Access; Green Open Access","Scopus","2-s2.0-85191348593"
"Guan X.; Zhong Z.; Zhan J.; Xi T.; Ye H.; Gao S.; Cheng J.; Liao S.; Cai J.","Guan, Xin (36133378900); Zhong, Zhaohui (57439773700); Zhan, Jun (57206309902); Xi, Tenglong (58628492400); Ye, Hao (58628696900); Gao, Shenzhen (58629101400); Cheng, Jian (59039763400); Liao, Shihui (58612549900); Cai, Jun (58629101500)","36133378900; 57439773700; 57206309902; 58628492400; 58628696900; 58629101400; 59039763400; 58612549900; 58629101500","Vehicle Handling and Stability Test Type Recognition Method Based on Convolutional Neural Network; [基于卷积神经网络的汽车操纵稳定性试验类型识别方法]","2023","Qiche Gongcheng/Automotive Engineering","45","9","","1765","1771","6","0","10.19562/j.chinasae.qcgc.2023.09.024","https://www.scopus.com/inward/record.uri?eid=2-s2.0-85172985235&doi=10.19562%2fj.chinasae.qcgc.2023.09.024&partnerID=40&md5=53de3bddbcbc861530ff9bf39dea4d9e","Article","Final","","Scopus","2-s2.0-85172985235"
"Islam M.T.; Islam M.R.; Uddin M.P.; Ulhaq A.","Islam, Md Touhid (58143394400); Islam, Md Rashedul (57208680683); Uddin, Md Palash (56297419700); Ulhaq, Anwaar (57191592708)","58143394400; 57208680683; 56297419700; 57191592708","A Deep Learning-Based Hyperspectral Object Classification Approach via Imbalanced Training Samples Handling","2023","Remote Sensing","15","14","3532","","","","10","10.3390/rs15143532","https://www.scopus.com/inward/record.uri?eid=2-s2.0-85166181658&doi=10.3390%2frs15143532&partnerID=40&md5=b9b093b4048f1d7a987fed6dd4c48e8e","Article","Final","All Open Access; Gold Open Access; Green Open Access","Scopus","2-s2.0-85166181658"
"Mehul D.; Sasikala D.","Mehul, Daripelli (58982254900); Sasikala, D. (57200240595)","58982254900; 57200240595","Deciphering Poxvirus Strains: Feature-Driven classification of Monkeypox","2024","2024 4th International Conference on Advances in Electrical, Computing, Communication and Sustainable Technologies, ICAECT 2024","","","","","","","0","10.1109/ICAECT60202.2024.10468861","https://www.scopus.com/inward/record.uri?eid=2-s2.0-85190150890&doi=10.1109%2fICAECT60202.2024.10468861&partnerID=40&md5=a01639ce65c5cbfaca22fe339ce32f26","Conference paper","Final","","Scopus","2-s2.0-85190150890"
"Huang J.; Huang A.; Xu R.; Wu M.; Wang P.; Wang Q.","Huang, Jun (58729566500); Huang, Aiyue (57413492700); Xu, Ruqin (58727982100); Wu, Musheng (58729566600); Wang, Peng (58220567100); Wang, Qing (55507833200)","58729566500; 57413492700; 58727982100; 58729566600; 58220567100; 55507833200","Automatic Segmentation and Assessment of Valvular Regurgitations with Color Doppler Echocardiography Images: A VABC-UNet-Based Framework","2023","Bioengineering","10","11","1319","","","","2","10.3390/bioengineering10111319","https://www.scopus.com/inward/record.uri?eid=2-s2.0-85178159989&doi=10.3390%2fbioengineering10111319&partnerID=40&md5=38bb7c4d0ee4c33a07f3680fd2fe7b90","Article","Final","All Open Access; Gold Open Access; Green Open Access","Scopus","2-s2.0-85178159989"
"Koshy S.S.; Jani Anbarasi L.","Koshy, Soumya Sara (57942163700); Jani Anbarasi, L. (57222292455)","57942163700; 57222292455","LMHistNet: Levenberg-Marquardt Based Deep Neural Network for Classification of Breast Cancer Histopathological Images","2024","IEEE Access","12","","","52051","52066","15","8","10.1109/ACCESS.2024.3385011","https://www.scopus.com/inward/record.uri?eid=2-s2.0-85189821268&doi=10.1109%2fACCESS.2024.3385011&partnerID=40&md5=114410cf17a68dbe682e567706022859","Article","Final","All Open Access; Gold Open Access","Scopus","2-s2.0-85189821268"
"Qin H.; Ding Y.; Zhang X.; Wang J.; Liu X.; Lu J.","Qin, Haotong (57215219668); Ding, Yifu (57221152316); Zhang, Xiangguo (57222379444); Wang, Jiakai (57221358581); Liu, Xianglong (36100195100); Lu, Jiwen (14065346100)","57215219668; 57221152316; 57222379444; 57221358581; 36100195100; 14065346100","Diverse Sample Generation: Pushing the Limit of Generative Data-Free Quantization","2023","IEEE Transactions on Pattern Analysis and Machine Intelligence","45","10","","11689","11706","17","42","10.1109/TPAMI.2023.3272925","https://www.scopus.com/inward/record.uri?eid=2-s2.0-85159801338&doi=10.1109%2fTPAMI.2023.3272925&partnerID=40&md5=0283290c672dca1bf150280a4b292e62","Article","Final","All Open Access; Green Open Access","Scopus","2-s2.0-85159801338"
"Alam M.J.; Zaman S.; Hakim M.A.; Das S.; Shill P.C.","Alam, Md. Jafril (58119498500); Zaman, Sakib (58195205100); Hakim, Md. Azizul (58938942900); Das, Sunanda (57215370179); Shill, Pintu Chandra (24448482100)","58119498500; 58195205100; 58938942900; 57215370179; 24448482100","DeepRegYLab: A Dilated Convolution and Network Design Space Based Image Segmentation Model to Segment Healthy GI Tract of Cancer Patients to Automate Radiotherapy","2024","Proceedings - 6th International Conference on Electrical Engineering and Information and Communication Technology, ICEEICT 2024","","","","43","48","5","1","10.1109/ICEEICT62016.2024.10534368","https://www.scopus.com/inward/record.uri?eid=2-s2.0-85195239581&doi=10.1109%2fICEEICT62016.2024.10534368&partnerID=40&md5=9c213eade8e01194f8077c4ee14a15db","Conference paper","Final","","Scopus","2-s2.0-85195239581"
"Xie X.; Xu J.; Hu P.; Zhang W.; Huang Y.; Zheng W.; Wang R.","Xie, Xuchen (58799910900); Xu, Junjie (57220137822); Hu, Ping (58828947900); Zhang, Weizhuo (58799614000); Huang, Yujun (58741072000); Zheng, Weishi (25928152800); Wang, Ruixuan (14822745000)","58799910900; 57220137822; 58828947900; 58799614000; 58741072000; 25928152800; 14822745000","Task-Incremental Medical Image Classification with Task-Specific Batch Normalization","2024","Lecture Notes in Computer Science (including subseries Lecture Notes in Artificial Intelligence and Lecture Notes in Bioinformatics)","14437 LNCS","","","309","320","11","0","10.1007/978-981-99-8558-6_26","https://www.scopus.com/inward/record.uri?eid=2-s2.0-85181765663&doi=10.1007%2f978-981-99-8558-6_26&partnerID=40&md5=c8867d3d9ac18982dc19e6f6467ca64c","Conference paper","Final","","Scopus","2-s2.0-85181765663"
"Yang G.; Luo S.; Greer P.","Yang, Guang (58119267400); Luo, Suhuai (13103725600); Greer, Peter (57204782270)","58119267400; 13103725600; 57204782270","A Novel Vision Transformer Model for Skin Cancer Classification","2023","Neural Processing Letters","55","7","","9335","9351","16","38","10.1007/s11063-023-11204-5","https://www.scopus.com/inward/record.uri?eid=2-s2.0-85150891644&doi=10.1007%2fs11063-023-11204-5&partnerID=40&md5=ec84d897646771923f3e894cf7570c02","Article","Final","All Open Access; Hybrid Gold Open Access","Scopus","2-s2.0-85150891644"
"Siddiqua M.; Ferdousee Z.","Siddiqua, Morseda (59157589400); Ferdousee, Zannatul (58930249300)","59157589400; 58930249300","Deep Transfer Learning Based Approaches for Classification of Chest CT Scans: Normal, COVID-19, and Pneumonia","2024","Proceedings - 6th International Conference on Electrical Engineering and Information and Communication Technology, ICEEICT 2024","","","","841","846","5","1","10.1109/ICEEICT62016.2024.10534572","https://www.scopus.com/inward/record.uri?eid=2-s2.0-85195241249&doi=10.1109%2fICEEICT62016.2024.10534572&partnerID=40&md5=25b9af0b3d5db18ea95b4aee3608d95d","Conference paper","Final","","Scopus","2-s2.0-85195241249"
"Kumaravel T.; Natesan P.","Kumaravel, T. (57222980522); Natesan, P. (56829436200)","57222980522; 56829436200","Deep Residual Network with Pelican Cuckoo Search for Traffic Sign Detection","2024","International Journal of Pattern Recognition and Artificial Intelligence","38","1","2355017","","","","3","10.1142/S0218001423550170","https://www.scopus.com/inward/record.uri?eid=2-s2.0-85186730637&doi=10.1142%2fS0218001423550170&partnerID=40&md5=321e527bf19a02738dbe7a46e3b616e1","Article","Final","","Scopus","2-s2.0-85186730637"
"Nancy V.A.O.; Prabhavathy P.; Arya M.S.; Ahamed B.S.","Nancy, V. Auxilia Osvin (57220984995); Prabhavathy, P. (57207268535); Arya, Meenakshi S. (57189231080); Ahamed, B. Shamreen (57210759959)","57220984995; 57207268535; 57189231080; 57210759959","Comparative study and analysis on skin cancer detection using machine learning and deep learning algorithms","2023","Multimedia Tools and Applications","82","29","","45913","45957","44","9","10.1007/s11042-023-16422-6","https://www.scopus.com/inward/record.uri?eid=2-s2.0-85168085065&doi=10.1007%2fs11042-023-16422-6&partnerID=40&md5=79e9576bfa7d7d5233f0f3c0499fc103","Article","Final","","Scopus","2-s2.0-85168085065"
"Delenia E.; Putra Y.H.; Triwibowo B.A.; Croix N.J.D.L.; Ahmad T.","Delenia, Erick (59171247000); Putra, Yoggy Harisusilo (59170959600); Triwibowo, Bayu Aditya (59419450800); Croix, Ntivuguruzwa Jean De La (57422987900); Ahmad, Tohari (35241970700)","59171247000; 59170959600; 59419450800; 57422987900; 35241970700","Detecting Hidden Data in Images Using Convolutional Neural Networks","2024","Mathematical Modelling of Engineering Problems","11","5","","1227","1235","8","2","10.18280/mmep.110511","https://www.scopus.com/inward/record.uri?eid=2-s2.0-85195844121&doi=10.18280%2fmmep.110511&partnerID=40&md5=4deaced09967455a562caa0429749636","Article","Final","All Open Access; Hybrid Gold Open Access","Scopus","2-s2.0-85195844121"
"Abd Alaziz H.M.; Elmannai H.; Saleh H.; Hadjouni M.; Anter A.M.; Koura A.; Kayed M.","Abd Alaziz, Hadeer M. (58670713200); Elmannai, Hela (55366208300); Saleh, Hager (57218799328); Hadjouni, Myriam (23396729500); Anter, Ahmed M. (55497871400); Koura, Abdelrahim (58114905500); Kayed, Mohammed (14422375000)","58670713200; 55366208300; 57218799328; 23396729500; 55497871400; 58114905500; 14422375000","Enhancing Fashion Classification with Vision Transformer (ViT) and Developing Recommendation Fashion Systems Using DINOVA2","2023","Electronics (Switzerland)","12","20","4263","","","","6","10.3390/electronics12204263","https://www.scopus.com/inward/record.uri?eid=2-s2.0-85175254994&doi=10.3390%2felectronics12204263&partnerID=40&md5=b8fa3efe3ae3b576d5f878a20be74f8e","Article","Final","All Open Access; Gold Open Access","Scopus","2-s2.0-85175254994"
"De A.; Mishra N.; Chang H.-T.","De, Anubhav (58618754800); Mishra, Nilamadhab (57220117710); Chang, Hsien-Tsung (23392069300)","58618754800; 57220117710; 23392069300","Hybridized CNN-Densenet Model for Dermatological Classification of Histopathological Skin Images","2024","Proceedings of 2nd International Conference on Advancements in Smart, Secure and Intelligent Computing, ASSIC 2024","","","","","","","0","10.1109/ASSIC60049.2024.10507955","https://www.scopus.com/inward/record.uri?eid=2-s2.0-85193017843&doi=10.1109%2fASSIC60049.2024.10507955&partnerID=40&md5=9a5198d23c51a0175dc9470bea4e729d","Conference paper","Final","","Scopus","2-s2.0-85193017843"
"Gilbert Chandra D.; Srinivasulu Reddy U.; Uma G.; Umapathy M.","Gilbert Chandra, D. (57398005400); Srinivasulu Reddy, U. (55848070900); Uma, G. (56496600900); Umapathy, M. (57204849479)","57398005400; 55848070900; 56496600900; 57204849479","Group normalization-based 2D-convolutional neural network for intelligent bearing fault diagnosis","2023","Journal of the Brazilian Society of Mechanical Sciences and Engineering","45","11","584","","","","6","10.1007/s40430-023-04491-5","https://www.scopus.com/inward/record.uri?eid=2-s2.0-85174175198&doi=10.1007%2fs40430-023-04491-5&partnerID=40&md5=c95ec933894811f962fd3dc0faeeffc2","Article","Final","","Scopus","2-s2.0-85174175198"
"Bai X.; Wang A.; Zhang C.; Hu H.","Bai, Xuemei (59354011800); Wang, Ao (58985244900); Zhang, Chenjie (57202201642); Hu, Hanping (58647523900)","59354011800; 58985244900; 57202201642; 58647523900","Cross-Domain Person Re-Identification Based on Normalized IBN-Net","2024","IEEE Access","12","","","54220","54228","8","4","10.1109/ACCESS.2024.3387478","https://www.scopus.com/inward/record.uri?eid=2-s2.0-85190321612&doi=10.1109%2fACCESS.2024.3387478&partnerID=40&md5=c060b420bd279d516999b30001e18f3f","Article","Final","All Open Access; Gold Open Access","Scopus","2-s2.0-85190321612"
"Hao L.; Zhu X.; Zhang Q.; Chen K.; Wang J.; Liu Y.","Hao, Lei (58119295600); Zhu, Xiaodong (57219034814); Zhang, Qixian (57210640472); Chen, Kai (57212866154); Wang, Jiahao (58119180400); Liu, Yunning (7410220515)","58119295600; 57219034814; 57210640472; 57212866154; 58119180400; 7410220515","Robust iris segmentation based on ConvNeXts","2023","Journal of Electronic Imaging","32","4","043020","","","","0","10.1117/1.JEI.32.4.043020","https://www.scopus.com/inward/record.uri?eid=2-s2.0-85173272070&doi=10.1117%2f1.JEI.32.4.043020&partnerID=40&md5=98191b933e353cac04f75ecc7398390f","Article","Final","","Scopus","2-s2.0-85173272070"
