"Authors","Author full names","Author(s) ID","Title","Year","Source title","Volume","Issue","Art. No.","Page start","Page end","Page count","Cited by","DOI","Link","Document Type","Publication Stage","Open Access","Source","EID"
"Nemade V.; Pathak S.; Dubey A.K.","Nemade, Varsha (57202706497); Pathak, Sunil (57769489600); Dubey, Ashutosh Kumar (55424779500)","57202706497; 57769489600; 55424779500","Hybrid Deep Convolutional Neural Network Approach for Detecting Breast Cancer in Mammography Images","2023","SSRG International Journal of Electrical and Electronics Engineering","10","5","","102","119","17","3","10.14445/23488379/IJEEE-V10I5P110","https://www.scopus.com/inward/record.uri?eid=2-s2.0-85162204857&doi=10.14445%2f23488379%2fIJEEE-V10I5P110&partnerID=40&md5=a3c49eddec21c86f043835ab19967a88","Article","Final","All Open Access; Hybrid Gold Open Access","Scopus","2-s2.0-85162204857"
"Hu Z.; Mei W.; Chen H.; Hou W.","Hu, Zhentao (35205238000); Mei, Weiqiang (58948025400); Chen, Hongyu (57272916900); Hou, Wei (57762569800)","35205238000; 58948025400; 57272916900; 57762569800","Multi-scale feature fusion and class weight loss for skin lesion classification","2024","Computers in Biology and Medicine","176","","108594","","","","4","10.1016/j.compbiomed.2024.108594","https://www.scopus.com/inward/record.uri?eid=2-s2.0-85193436794&doi=10.1016%2fj.compbiomed.2024.108594&partnerID=40&md5=15193bf2818bfebccca5c096be053316","Article","Final","","Scopus","2-s2.0-85193436794"
"Xu C.; Zhu G.; Shu J.","Xu, Chengjun (57216585205); Zhu, Guobin (7402633123); Shu, Jingqian (57221661275)","57216585205; 7402633123; 57221661275","A Combination of Lie Group Machine Learning and Deep Learning for Remote Sensing Scene Classification Using Multi-Layer Heterogeneous Feature Extraction and Fusion","2022","Remote Sensing","14","6","1445","","","","20","10.3390/rs14061445","https://www.scopus.com/inward/record.uri?eid=2-s2.0-85127152380&doi=10.3390%2frs14061445&partnerID=40&md5=c47314eb2dc9e730d42194e4bd077f7f","Article","Final","All Open Access; Gold Open Access","Scopus","2-s2.0-85127152380"
"Gong B.; Dai K.; Shao J.; Jing L.; Chen Y.","Gong, Bo (58081603600); Dai, Kanyuan (58403243200); Shao, Ji (58400492200); Jing, Ling (35883781000); Chen, Yingyi (24079892700)","58081603600; 58403243200; 58400492200; 35883781000; 24079892700","Fish-TViT: A novel fish species classification method in multi water areas based on transfer learning and vision transformer","2023","Heliyon","9","6","e16761","","","","15","10.1016/j.heliyon.2023.e16761","https://www.scopus.com/inward/record.uri?eid=2-s2.0-85163549118&doi=10.1016%2fj.heliyon.2023.e16761&partnerID=40&md5=0cefd4975851349f531ff50d1352a6e2","Article","Final","All Open Access; Gold Open Access; Green Open Access","Scopus","2-s2.0-85163549118"
"Bi J.; Dornaika F.","Bi, Jingjun (57191850283); Dornaika, Fadi (55967501800)","57191850283; 55967501800","Sample-weighted fused graph-based semi-supervised learning on multi-view data","2024","Information Fusion","104","","102175","","","","6","10.1016/j.inffus.2023.102175","https://www.scopus.com/inward/record.uri?eid=2-s2.0-85179007317&doi=10.1016%2fj.inffus.2023.102175&partnerID=40&md5=bda538dfcd73b6d097be6f57b9ccd085","Article","Final","All Open Access; Hybrid Gold Open Access","Scopus","2-s2.0-85179007317"
"Jiang L.-Q.; Ning C.-Y.; Yu H.-T.","Jiang, Lin-Qi (58096735600); Ning, Chun-Yu (35766772900); Yu, Hai-Tao (58096735700)","58096735600; 35766772900; 58096735700","Classification model based on fusion of multi-scale feature and channel feature for benign and malignant brain tumors; [基于多尺度特征与通道特征融合的脑肿瘤良恶性分类模型]","2022","Chinese Optics","15","6","","1339","1349","10","4","10.37188/CO.2022-0067","https://www.scopus.com/inward/record.uri?eid=2-s2.0-85147732498&doi=10.37188%2fCO.2022-0067&partnerID=40&md5=cdedf38f2fb9c14a0d0f8a9576ad4268","Article","Final","","Scopus","2-s2.0-85147732498"
"Gao F.; Luo X.; Yang Z.; Zhang Q.","Gao, Farong (55972435200); Luo, Xingsheng (57923392300); Yang, Zhangyi (57222260769); Zhang, Qizhong (36995131400)","55972435200; 57923392300; 57222260769; 36995131400","Label smoothing and task-adaptive loss function based on prototype network for few-shot learning","2022","Neural Networks","156","","","39","48","9","16","10.1016/j.neunet.2022.09.018","https://www.scopus.com/inward/record.uri?eid=2-s2.0-85139593784&doi=10.1016%2fj.neunet.2022.09.018&partnerID=40&md5=e2a3652c6090d0df531779fcd9d967f1","Article","Final","","Scopus","2-s2.0-85139593784"
"Xu M.; Islam M.; Glocker B.; Ren H.","Xu, Mengya (57223735761); Islam, Mobarakol (57200950445); Glocker, Ben (23396784900); Ren, Hongliang (14030501000)","57223735761; 57200950445; 23396784900; 14030501000","Confidence-Aware Paced-Curriculum Learning by Label Smoothing for Surgical Scene Understanding","2024","IEEE Transactions on Automation Science and Engineering","21","3","","3170","3181","11","1","10.1109/TASE.2023.3276361","https://www.scopus.com/inward/record.uri?eid=2-s2.0-85161025923&doi=10.1109%2fTASE.2023.3276361&partnerID=40&md5=682c64ac114672d660a81d62618288a9","Article","Final","All Open Access; Green Open Access","Scopus","2-s2.0-85161025923"
"Shen E.; Deng Y.; Xiong K.; Ke D.; Zhao Y.; Yi F.","Shen, Enwei (58847540900); Deng, Yingjiao (57223296063); Xiong, Kouhong (57211961617); Ke, Dang (58847906700); Zhao, Yuliang (57196327240); Yi, Feng (58847541000)","58847540900; 57223296063; 57211961617; 58847906700; 57196327240; 58847541000","ResNet50-based classification of footwear in nuclear power plants surveillance images","2023","Proceedings - 2023 16th International Congress on Image and Signal Processing, BioMedical Engineering and Informatics, CISP-BMEI 2023","","","","","","","0","10.1109/CISP-BMEI60920.2023.10373252","https://www.scopus.com/inward/record.uri?eid=2-s2.0-85183315134&doi=10.1109%2fCISP-BMEI60920.2023.10373252&partnerID=40&md5=a6aaf0e4d3233d3dd76e61bab7b29e81","Conference paper","Final","","Scopus","2-s2.0-85183315134"
"Wang J.; Yan J.; Xu Y.; Chen J.","Wang, Jianqi (58789571100); Yan, Jieni (59199910000); Xu, Yinzhe (59199533300); Chen, Jia (59199533400)","58789571100; 59199910000; 59199533300; 59199533400","A Computer Vision Engineering Management System for Automated Defect Detection in Electronic Components Manufacturing","2024","International Journal of Uncertainty, Fuzziness and Knowledge-Based Systems","32","4","","515","534","19","0","10.1142/S0218488524400075","https://www.scopus.com/inward/record.uri?eid=2-s2.0-85197361719&doi=10.1142%2fS0218488524400075&partnerID=40&md5=74eacd4028252b540f16a6e2b0e246be","Article","Final","","Scopus","2-s2.0-85197361719"
"Paing M.P.; Cho O.-S.; Cho J.-W.","Paing, May Phu (57193688862); Cho, One-Sun (58123816500); Cho, Jae-Wan (58123756100)","57193688862; 58123816500; 58123756100","Histopathological Classification of Colorectal Polyps using Deep Learning","2023","International Conference on Information Networking","2023-January","","","472","477","5","1","10.1109/ICOIN56518.2023.10048925","https://www.scopus.com/inward/record.uri?eid=2-s2.0-85149166978&doi=10.1109%2fICOIN56518.2023.10048925&partnerID=40&md5=44e1e25c345d483feb1b9505c18eb040","Conference paper","Final","","Scopus","2-s2.0-85149166978"
"Ayon S.T.K.; Siraj F.Md.; Uddin J.","Ayon, Syed Tasnimul Karim (58777516900); Siraj, Farhan Md (58777722600); Uddin, Jia (54994936900)","58777516900; 58777722600; 54994936900","Steel Surface Defect Detection Using Learnable Memory Vision Transformer","2025","Computers, Materials and Continua","82","1","","499","520","21","0","10.32604/cmc.2025.058361","https://www.scopus.com/inward/record.uri?eid=2-s2.0-85214413256&doi=10.32604%2fcmc.2025.058361&partnerID=40&md5=22a468915e2685c4c3826a48135a2142","Article","Final","All Open Access; Gold Open Access","Scopus","2-s2.0-85214413256"
"Liu S.; Li H.; Jiang C.; Feng J.","Liu, Shuai (57191659661); Li, Hongfei (58666659300); Jiang, Chengji (58932845900); Feng, Jie (55468528100)","57191659661; 58666659300; 58932845900; 55468528100","Spectral–Spatial Graph Convolutional Network with Dynamic-Synchronized Multiscale Features for Few-Shot Hyperspectral Image Classification","2024","Remote Sensing","16","5","895","","","","4","10.3390/rs16050895","https://www.scopus.com/inward/record.uri?eid=2-s2.0-85187481962&doi=10.3390%2frs16050895&partnerID=40&md5=f0ee79d3a48a8232a38f1785b254908d","Article","Final","All Open Access; Gold Open Access","Scopus","2-s2.0-85187481962"
"Park H.; Noh J.; Oh Y.; Baek D.; Ham B.","Park, Hyekang (57845893100); Noh, Jongyoun (57219595897); Oh, Youngmin (57223757653); Baek, Donghyeon (57238864400); Ham, Bumsub (36061611900)","57845893100; 57219595897; 57223757653; 57238864400; 36061611900","ACLS: Adaptive and Conditional Label Smoothing for Network Calibration","2023","Proceedings of the IEEE International Conference on Computer Vision","","","","3913","3922","9","6","10.1109/ICCV51070.2023.00364","https://www.scopus.com/inward/record.uri?eid=2-s2.0-85188255669&doi=10.1109%2fICCV51070.2023.00364&partnerID=40&md5=a35c9a7ed5a0469fc90ef20babbcba88","Conference paper","Final","All Open Access; Green Open Access","Scopus","2-s2.0-85188255669"
"Qin J.; He Y.; Ge J.; Liang Y.","Qin, Jian (57482943700); He, Yongjun (55498902100); Ge, Jinping (57737496300); Liang, Yiqin (57737927000)","57482943700; 55498902100; 57737496300; 57737927000","A Multi-Task Feature Fusion Model for Cervical Cell Classification","2022","IEEE Journal of Biomedical and Health Informatics","26","9","","4668","4678","10","21","10.1109/JBHI.2022.3180989","https://www.scopus.com/inward/record.uri?eid=2-s2.0-85131834341&doi=10.1109%2fJBHI.2022.3180989&partnerID=40&md5=dc596e4b6904987d93b9b9740c4d020d","Article","Final","","Scopus","2-s2.0-85131834341"
"Ao S.; Rueger S.; Siddharthan A.","Ao, Shuang (57226330806); Rueger, Stefan (57209594366); Siddharthan, Advaith (57203429695)","57226330806; 57209594366; 57203429695","Confidence-Aware Calibration and Scoring Functions for Curriculum Learning","2023","Proceedings of SPIE - The International Society for Optical Engineering","12701","","127011U","","","","0","10.1117/12.2679353","https://www.scopus.com/inward/record.uri?eid=2-s2.0-85172897253&doi=10.1117%2f12.2679353&partnerID=40&md5=1cfd2997ab331272d24f88aee5399e5a","Conference paper","Final","All Open Access; Green Open Access","Scopus","2-s2.0-85172897253"
"Song B.; Wu Z.; Xu Y.; Xia X.; Xie Y.; Zhan T.; Wei Z.","Song, Bo (57997820700); Wu, Zebin (20437030300); Xu, Yang (57188730185); Xia, Xinyuan (59194104100); Xie, Yu (59442239100); Zhan, Tianming (36669723100); Wei, Zhihui (55761764700)","57997820700; 20437030300; 57188730185; 59194104100; 59442239100; 36669723100; 55761764700","3DCNN-NF: Few-Shot Hyperspectral Image Change Detection Based on 3-D Convolution Neural Network and Normalizing Flow","2024","IEEE Transactions on Geoscience and Remote Sensing","62","","5530615","","","","1","10.1109/TGRS.2024.3419111","https://www.scopus.com/inward/record.uri?eid=2-s2.0-85197084361&doi=10.1109%2fTGRS.2024.3419111&partnerID=40&md5=9608352d4096b3e29143787cfb507aed","Article","Final","","Scopus","2-s2.0-85197084361"
"Guo T.; Liang Z.; Gu Y.; Liu K.; Xu X.; Yang J.; Yu Q.","Guo, Tianjiao (57249440400); Liang, Ziyun (57249579700); Gu, Yun (55836552300); Liu, Kun (56424350200); Xu, Xun (59044861300); Yang, Jie (15039078800); Yu, Qi (57191919659)","57249440400; 57249579700; 55836552300; 56424350200; 59044861300; 15039078800; 57191919659","Learning for retinal image quality assessment with label regularization","2023","Computer Methods and Programs in Biomedicine","228","","107238","","","","6","10.1016/j.cmpb.2022.107238","https://www.scopus.com/inward/record.uri?eid=2-s2.0-85142309144&doi=10.1016%2fj.cmpb.2022.107238&partnerID=40&md5=4042c8598f7310212f21c00c73682814","Article","Final","","Scopus","2-s2.0-85142309144"
"Liu Q.; Dong Y.","Liu, Q. (57438356400); Dong, Y. (56585094400)","57438356400; 56585094400","Deep feature extraction based on dynamic graph convolutional networks for accelerated hyperspectral image classification","2022","ISPRS Annals of the Photogrammetry, Remote Sensing and Spatial Information Sciences","5","3","","139","146","7","4","10.5194/isprs-Annals-V-3-2022-139-2022","https://www.scopus.com/inward/record.uri?eid=2-s2.0-85132024617&doi=10.5194%2fisprs-Annals-V-3-2022-139-2022&partnerID=40&md5=affc3ce74bee32afcc6a72b804cac450","Conference paper","Final","All Open Access; Gold Open Access","Scopus","2-s2.0-85132024617"
"Weng Y.; Guo Y.","Weng, Yufeng (59535916200); Guo, Yongde (57198927008)","59535916200; 57198927008","Remote Scene Image Classification Based on Vision-LSTM Model","2024","Proceedings - 2024 Cross Strait Radio Science and Wireless Technology Conference, CSRSWTC 2024","","","","","","","0","10.1109/CSRSWTC64338.2024.10811590","https://www.scopus.com/inward/record.uri?eid=2-s2.0-85216531428&doi=10.1109%2fCSRSWTC64338.2024.10811590&partnerID=40&md5=bcff7a4a37578a88fbccdd7be9f03ff2","Conference paper","Final","","Scopus","2-s2.0-85216531428"
"Lin M.; Li G.; Hao Y.","Lin, Meiling (58182653400); Li, Gongyan (16637859100); Hao, Yuexing (55596615200)","58182653400; 16637859100; 55596615200","Bridging local and global representations for self-supervised monocular depth estimation","2024","Engineering Applications of Artificial Intelligence","133","","108277","","","","2","10.1016/j.engappai.2024.108277","https://www.scopus.com/inward/record.uri?eid=2-s2.0-85188827393&doi=10.1016%2fj.engappai.2024.108277&partnerID=40&md5=3f620a0562404c60e315224d540027c0","Article","Final","","Scopus","2-s2.0-85188827393"
"Wang S.; Ren J.; Guo X.","Wang, Shujuan (57191712588); Ren, Jialin (58934066000); Guo, Xiaoli (25928400000)","57191712588; 58934066000; 25928400000","A high-accuracy lightweight network model for X-ray image diagnosis: A case study of COVID detection","2024","PLoS ONE","19","6 June","e0303049","","","","1","10.1371/journal.pone.0303049","https://www.scopus.com/inward/record.uri?eid=2-s2.0-85196269994&doi=10.1371%2fjournal.pone.0303049&partnerID=40&md5=919cc07a9862f98abaf0d2a06d978db6","Article","Final","All Open Access; Gold Open Access; Green Open Access","Scopus","2-s2.0-85196269994"
"Zou Y.; Wu L.; Zuo C.; Chen L.; Zhou B.; Zhang H.","Zou, Yujie (58662448900); Wu, Lianghong (14046236200); Zuo, Cili (56903719500); Chen, Liang (57192609325); Zhou, Bowen (56096531200); Zhang, Hongqiang (16508335500)","58662448900; 14046236200; 56903719500; 57192609325; 56096531200; 16508335500","White blood cell classification network using MobileNetv2 with multiscale feature extraction module and attention mechanism","2025","Biomedical Signal Processing and Control","99","","106820","","","","1","10.1016/j.bspc.2024.106820","https://www.scopus.com/inward/record.uri?eid=2-s2.0-85203650794&doi=10.1016%2fj.bspc.2024.106820&partnerID=40&md5=f3399ea15fffcab22197bc5414fecd29","Article","Final","","Scopus","2-s2.0-85203650794"
"Xin H.; Jiang Q.","Xin, Haitao (15833589400); Jiang, Qilu (59347408300)","15833589400; 59347408300","Research on Fine-Grained Image Classification Based on Data Enhancement and Attention Mechanism","2024","2024 5th International Conference on Information Science, Parallel and Distributed Systems, ISPDS 2024","","","","329","334","5","0","10.1109/ISPDS62779.2024.10667582","https://www.scopus.com/inward/record.uri?eid=2-s2.0-85205256655&doi=10.1109%2fISPDS62779.2024.10667582&partnerID=40&md5=369401c4896474f2b5b6c5d87f537e75","Conference paper","Final","","Scopus","2-s2.0-85205256655"
"Bieck R.; Heuermann K.; Pirlich M.; Neumann J.; Neumuth T.","Bieck, Richard (56258597200); Heuermann, Katharina (57212256434); Pirlich, Markus (56536454900); Neumann, Juliane (56393847100); Neumuth, Thomas (14023288300)","56258597200; 57212256434; 56536454900; 56393847100; 14023288300","Language-based translation and prediction of surgical navigation steps for endoscopic wayfinding assistance in minimally invasive surgery","2020","International Journal of Computer Assisted Radiology and Surgery","15","12","","2089","2100","11","11","10.1007/s11548-020-02264-2","https://www.scopus.com/inward/record.uri?eid=2-s2.0-85092402607&doi=10.1007%2fs11548-020-02264-2&partnerID=40&md5=0bdad2e487f2c686944b890bbd017872","Article","Final","All Open Access; Green Open Access; Hybrid Gold Open Access","Scopus","2-s2.0-85092402607"
"Gao M.; Chen Y.; Zhang Z.; Feng Y.; Fan W.","Gao, Ming (57199670456); Chen, Yuhan (57219116638); Zhang, Zehui (57211268269); Feng, Yu (57211274481); Fan, Weiguo (58255646800)","57199670456; 57219116638; 57211268269; 57211274481; 58255646800","Classification algorithm of garbage images based on novel spatial attention mechanism and transfer learning","2021","Xitong Gongcheng Lilun yu Shijian/System Engineering Theory and Practice","41","2","","498","512","14","11","10.12011/SETP2020-1645","https://www.scopus.com/inward/record.uri?eid=2-s2.0-85103965969&doi=10.12011%2fSETP2020-1645&partnerID=40&md5=58a44e46f07cba8e35bf43bda0399fe0","Article","Final","","Scopus","2-s2.0-85103965969"
"Ouyang X.; Xue Z.; Zhan Y.; Zhou X.S.; Wang Q.; Zhou Y.; Wang Q.; Cheng J.-Z.","Ouyang, Xi (57188922178); Xue, Zhong (7203058609); Zhan, Yiqiang (10041768000); Zhou, Xiang Sean (7410091143); Wang, Qingfeng (55840221600); Zhou, Ying (57205199749); Wang, Qian (57192157811); Cheng, Jie-Zhi (9845624100)","57188922178; 7203058609; 10041768000; 7410091143; 55840221600; 57205199749; 57192157811; 9845624100","Weakly Supervised Segmentation Framework with Uncertainty: A Study on Pneumothorax Segmentation in Chest X-ray","2019","Lecture Notes in Computer Science (including subseries Lecture Notes in Artificial Intelligence and Lecture Notes in Bioinformatics)","11769 LNCS","","","613","621","8","29","10.1007/978-3-030-32226-7_68","https://www.scopus.com/inward/record.uri?eid=2-s2.0-85075827094&doi=10.1007%2f978-3-030-32226-7_68&partnerID=40&md5=fe8aad6877fe6e0e9de2eb0cf613fe5b","Conference paper","Final","","Scopus","2-s2.0-85075827094"
"Wei Y.; Liu Q.; Zhang G.; Peng Y.; Shen C.","Wei, Yuxuan (57222248818); Liu, Qixuan (57213199635); Zhang, Guixu (55803635500); Peng, Yaxin (55962184600); Shen, Chaomin (15081309500)","57222248818; 57213199635; 55803635500; 55962184600; 15081309500","Label Smoothing Technique for Ordinal Classification in Cloud Assessment","2020","International Geoscience and Remote Sensing Symposium (IGARSS)","","","9323714","2264","2267","3","3","10.1109/IGARSS39084.2020.9323714","https://www.scopus.com/inward/record.uri?eid=2-s2.0-85101970578&doi=10.1109%2fIGARSS39084.2020.9323714&partnerID=40&md5=4cab837d8bafd2c1be863bd3b9a28da2","Conference paper","Final","","Scopus","2-s2.0-85101970578"
"Müller R.; Kornblith S.; Hinton G.","Müller, Rafael (57218717272); Kornblith, Simon (57214131049); Hinton, Geoffrey (7006699573)","57218717272; 57214131049; 7006699573","When does label smoothing help?","2019","Advances in Neural Information Processing Systems","32","","","","","","1196","","https://www.scopus.com/inward/record.uri?eid=2-s2.0-85087971310&partnerID=40&md5=f23176b436d90ec8d42962e0783e625c","Conference paper","Final","","Scopus","2-s2.0-85087971310"
"Ni P.; Chen Z.; Cao M.","Ni, Peng (57226192894); Chen, Zhen (57269968000); Cao, Maoyong (7202868473)","57226192894; 57269968000; 7202868473","Research on crop disease recognition based on uniting multi-layer features","2021","Journal of Physics: Conference Series","1961","1","012030","","","","1","10.1088/1742-6596/1961/1/012030","https://www.scopus.com/inward/record.uri?eid=2-s2.0-85110870713&doi=10.1088%2f1742-6596%2f1961%2f1%2f012030&partnerID=40&md5=988d089cecd80d7a7244563d6af24a97","Conference paper","Final","All Open Access; Gold Open Access","Scopus","2-s2.0-85110870713"
"Zhu C.; Mei K.; Peng T.; Luo Y.; Liu J.; Wang Y.; Jin M.","Zhu, Chuang (55937877500); Mei, Ke (57219057497); Peng, Ting (57217991458); Luo, Yihao (57209897943); Liu, Jun (57880801800); Wang, Ying (57206997530); Jin, Mulan (59100244600)","55937877500; 57219057497; 57217991458; 57209897943; 57880801800; 57206997530; 59100244600","Multi-level colonoscopy malignant tissue detection with adversarial CAC-UNet","2021","Neurocomputing","438","","","165","183","18","21","10.1016/j.neucom.2020.04.154","https://www.scopus.com/inward/record.uri?eid=2-s2.0-85100770385&doi=10.1016%2fj.neucom.2020.04.154&partnerID=40&md5=70bf26911ef41a36166dc5f5ab5ac6dc","Article","Final","All Open Access; Green Open Access","Scopus","2-s2.0-85100770385"
"Petrovska B.; Atanasova-Pacemska T.; Corizzo R.; Mignone P.; Lameski P.; Zdravevski E.","Petrovska, Biserka (57218093154); Atanasova-Pacemska, Tatjana (55612796100); Corizzo, Roberto (56344740700); Mignone, Paolo (56712994200); Lameski, Petre (35107267200); Zdravevski, Eftim (39362601000)","57218093154; 55612796100; 56344740700; 56712994200; 35107267200; 39362601000","Aerial scene classification through fine-tuning with adaptive learning rates and label smoothing","2020","Applied Sciences (Switzerland)","10","17","5792","","","","37","10.3390/app10175792","https://www.scopus.com/inward/record.uri?eid=2-s2.0-85089997525&doi=10.3390%2fapp10175792&partnerID=40&md5=04bf4f66dd5fdb3e860324f7fdeda271","Article","Final","All Open Access; Gold Open Access; Green Open Access","Scopus","2-s2.0-85089997525"
"He X.; Chen Y.; Lin Z.","He, Xin (57201259373); Chen, Yushi (15059992600); Lin, Zhouhan (55567081300)","57201259373; 15059992600; 55567081300","Spatial–spectral transformer for hyperspectral image classification","2021","Remote Sensing","13","3","498","1","22","21","294","10.3390/rs13030498","https://www.scopus.com/inward/record.uri?eid=2-s2.0-85100533501&doi=10.3390%2frs13030498&partnerID=40&md5=4a0e61462889c6952c4a41055ac80ca8","Article","Final","All Open Access; Gold Open Access","Scopus","2-s2.0-85100533501"
"Zhao Y.; Sun Z.; Tian E.; Hu C.; Zong H.; Yang F.","Zhao, Yang (57225061658); Sun, Zhanquan (59092188600); Tian, Engang (55752795700); Hu, Chuanfei (57215187609); Zong, Hui (58388399400); Yang, Fan (57226014045)","57225061658; 59092188600; 55752795700; 57215187609; 58388399400; 57226014045","A CNN Model for Herb Identification Based on Part Priority Attention Mechanism","2020","Conference Proceedings - IEEE International Conference on Systems, Man and Cybernetics","2020-October","","9283189","2565","2571","6","8","10.1109/SMC42975.2020.9283189","https://www.scopus.com/inward/record.uri?eid=2-s2.0-85098887594&doi=10.1109%2fSMC42975.2020.9283189&partnerID=40&md5=a8ec14f54d22b4841988c07a1986538e","Conference paper","Final","","Scopus","2-s2.0-85098887594"
"Wu P.; Cui Z.; Gan Z.; Liu F.","Wu, Peida (57215693950); Cui, Ziguan (35730905800); Gan, Zongliang (15119109300); Liu, Feng (57188574368)","57215693950; 35730905800; 15119109300; 57188574368","Three-dimensional resNeXt network using feature fusion and label smoothing for hyperspectral image classification","2020","Sensors (Switzerland)","20","6","1652","","","","26","10.3390/s20061652","https://www.scopus.com/inward/record.uri?eid=2-s2.0-85081680974&doi=10.3390%2fs20061652&partnerID=40&md5=fefe995b2aa9d1a7a13cfa5820417d21","Article","Final","All Open Access; Gold Open Access; Green Open Access","Scopus","2-s2.0-85081680974"
"Wang J.; Zhang P.; He Q.; Li Y.; Hu Y.","Wang, Jiyue (57221141681); Zhang, Pei (57020283100); He, Qianhua (7402118349); Li, Yanxiong (24825176900); Hu, Yongjian (35766130600)","57221141681; 57020283100; 7402118349; 24825176900; 35766130600","Revisiting label smoothing regularization with knowledge distillation","2021","Applied Sciences (Switzerland)","11","10","4699","","","","10","10.3390/app11104699","https://www.scopus.com/inward/record.uri?eid=2-s2.0-85107265569&doi=10.3390%2fapp11104699&partnerID=40&md5=5afc8eafc4a9dd2cdaf14c540aa42578","Article","Final","All Open Access; Gold Open Access","Scopus","2-s2.0-85107265569"
"Cao H.; Pu S.; Tan W.; Tong J.; Zhang D.","Cao, Haichao (57202130095); Pu, Shiliang (56462199300); Tan, Wenming (57204394128); Tong, Junyan (57220958714); Zhang, Di (57226173537)","57202130095; 56462199300; 57204394128; 57220958714; 57226173537","Multi-Tasking U-Shaped Network for Benign and Malignant Classification of Breast Masses","2020","IEEE Access","8","","9284440","223396","223404","8","8","10.1109/ACCESS.2020.3042889","https://www.scopus.com/inward/record.uri?eid=2-s2.0-85097957170&doi=10.1109%2fACCESS.2020.3042889&partnerID=40&md5=f2c0ae4285d8929a3f609598e6f1f950","Article","Final","All Open Access; Gold Open Access","Scopus","2-s2.0-85097957170"
"Guo Y.; Fang Z.; Zhang S.; Dong H.","Guo, Yanshuo (57547893600); Fang, Zhiyi (7402681666); Zhang, Shuhao (57547126400); Dong, Hongliang (57195265164)","57547893600; 7402681666; 57547126400; 57195265164","Classification of Potato Early Blight with Unbalanced Data Based on GhostNet","2021","2021 3rd International Academic Exchange Conference on Science and Technology Innovation, IAECST 2021","","","","559","563","4","3","10.1109/IAECST54258.2021.9695532","https://www.scopus.com/inward/record.uri?eid=2-s2.0-85127014035&doi=10.1109%2fIAECST54258.2021.9695532&partnerID=40&md5=dca872502072009ea0105df958030309","Conference paper","Final","","Scopus","2-s2.0-85127014035"
"He X.; Fang L.; Rabbani H.; Chen X.; Liu Z.","He, Xingxin (57207845778); Fang, Leyuan (36739090900); Rabbani, Hossein (16643769100); Chen, Xiangdong (37068435000); Liu, Zhimin (57194782592)","57207845778; 36739090900; 16643769100; 37068435000; 57194782592","Retinal optical coherence tomography image classification with label smoothing generative adversarial network","2020","Neurocomputing","405","","","37","47","10","47","10.1016/j.neucom.2020.04.044","https://www.scopus.com/inward/record.uri?eid=2-s2.0-85085211856&doi=10.1016%2fj.neucom.2020.04.044&partnerID=40&md5=3f044d837d7d5b694f99fc5c50d5fbe2","Article","Final","","Scopus","2-s2.0-85085211856"
