"Authors","Author full names","Author(s) ID","Title","Year","Source title","Volume","Issue","Art. No.","Page start","Page end","Page count","Cited by","DOI","Link","Document Type","Publication Stage","Open Access","Source","EID"
"Feng S.; Yu X.; Liang W.; Li X.; Zhong W.; Hu W.; Zhang H.; Feng Z.; Song M.; Zhang J.; Zhang X.","Feng, Shi (57191331983); Yu, Xiaotian (57718164400); Liang, Wenjie (55726993100); Li, Xuejie (57203715523); Zhong, Weixiang (56581061700); Hu, Wanwan (57376540100); Zhang, Han (56498847100); Feng, Zunlei (57192555083); Song, Mingli (9333722700); Zhang, Jing (57834218500); Zhang, Xiuming (55941479500)","57191331983; 57718164400; 55726993100; 57203715523; 56581061700; 57376540100; 56498847100; 57192555083; 9333722700; 57834218500; 55941479500","Development of a Deep Learning Model to Assist With Diagnosis of Hepatocellular Carcinoma","2021","Frontiers in Oncology","11","","762733","","","","12","10.3389/fonc.2021.762733","https://www.scopus.com/inward/record.uri?eid=2-s2.0-85121399920&doi=10.3389%2ffonc.2021.762733&partnerID=40&md5=9b881e686401624c170fb4e857ab62b7","Article","Final","All Open Access; Gold Open Access; Green Open Access","Scopus","2-s2.0-85121399920"
"Happy S.L.; Dantcheva A.; Bremond F.","Happy, S.L. (55638461500); Dantcheva, Antitza (22834321400); Bremond, Francois (6602918684)","55638461500; 22834321400; 6602918684","A Weakly Supervised learning technique for classifying facial expressions","2019","Pattern Recognition Letters","128","","","162","168","6","15","10.1016/j.patrec.2019.08.025","https://www.scopus.com/inward/record.uri?eid=2-s2.0-85072040124&doi=10.1016%2fj.patrec.2019.08.025&partnerID=40&md5=3f2d41e8e2cba5a9f41ed08413eb5e23","Article","Final","All Open Access; Green Open Access","Scopus","2-s2.0-85072040124"
"Liu Q.; Dong Y.; Zhang Y.; Luo H.","Liu, Quanwei (57438356400); Dong, Yanni (56585094400); Zhang, Yuxiang (55771857200); Luo, Hui (55454100200)","57438356400; 56585094400; 55771857200; 55454100200","A Fast Dynamic Graph Convolutional Network and CNN Parallel Network for Hyperspectral Image Classification","2022","IEEE Transactions on Geoscience and Remote Sensing","60","","5530215","","","","40","10.1109/TGRS.2022.3179419","https://www.scopus.com/inward/record.uri?eid=2-s2.0-85131731423&doi=10.1109%2fTGRS.2022.3179419&partnerID=40&md5=3f402146d995cc1944dca252dcc5b941","Article","Final","","Scopus","2-s2.0-85131731423"
"Islam M.; Glocker B.","Islam, Mobarakol (57200950445); Glocker, Ben (23396784900)","57200950445; 23396784900","Spatially Varying Label Smoothing: Capturing Uncertainty from Expert Annotations","2021","Lecture Notes in Computer Science (including subseries Lecture Notes in Artificial Intelligence and Lecture Notes in Bioinformatics)","12729 LNCS","","","677","688","11","26","10.1007/978-3-030-78191-0_52","https://www.scopus.com/inward/record.uri?eid=2-s2.0-85111413775&doi=10.1007%2f978-3-030-78191-0_52&partnerID=40&md5=34a1750b1c5e176c8125182dcd9c9277","Conference paper","Final","","Scopus","2-s2.0-85111413775"
"Zhang C.-B.; Jiang P.-T.; Hou Q.; Wei Y.; Han Q.; Li Z.; Cheng M.-M.","Zhang, Chang-Bin (57226516780); Jiang, Peng-Tao (57204465645); Hou, Qibin (57191428893); Wei, Yunchao (55378119700); Han, Qi (57220996844); Li, Zhen (57202992643); Cheng, Ming-Ming (57200622074)","57226516780; 57204465645; 57191428893; 55378119700; 57220996844; 57202992643; 57200622074","Delving deep into label smoothing","2021","IEEE Transactions on Image Processing","30","","9464693","5984","5996","12","175","10.1109/TIP.2021.3089942","https://www.scopus.com/inward/record.uri?eid=2-s2.0-85111789408&doi=10.1109%2fTIP.2021.3089942&partnerID=40&md5=6952a3ce4e7cfc0fe3d68d256759efc1","Article","Final","All Open Access; Green Open Access","Scopus","2-s2.0-85111789408"
"Hou B.; Liu Y.; Rong T.; Ren B.; Xiang Z.; Zhang X.; Wang S.","Hou, Biao (7102142690); Liu, Yangfei (57222245025); Rong, Tuotuo (57222241701); Ren, Bo (57209552437); Xiang, Zijuan (57222243858); Zhang, Xiangrong (55802358000); Wang, Shuang (55940463600)","7102142690; 57222245025; 57222241701; 57209552437; 57222243858; 55802358000; 55940463600","Panchromatic Image Land Cover Classification Via DCNN with Updating Iteration Strategy","2020","International Geoscience and Remote Sensing Symposium (IGARSS)","","","9323700","1472","1475","3","4","10.1109/IGARSS39084.2020.9323700","https://www.scopus.com/inward/record.uri?eid=2-s2.0-85101957528&doi=10.1109%2fIGARSS39084.2020.9323700&partnerID=40&md5=75bf30ed8bc13fc1d8c96ee71aeae999","Conference paper","Final","","Scopus","2-s2.0-85101957528"
"Katsumata K.; Nakayama H.","Katsumata, Kai (57221099626); Nakayama, Hideki (35230509500)","57221099626; 35230509500","Semantic image synthesis from inaccurate and coarse masks","2021","ICASSP, IEEE International Conference on Acoustics, Speech and Signal Processing - Proceedings","2021-June","","","2285","2289","4","1","10.1109/ICASSP39728.2021.9414521","https://www.scopus.com/inward/record.uri?eid=2-s2.0-85115071466&doi=10.1109%2fICASSP39728.2021.9414521&partnerID=40&md5=bda1a82ebaca85e83b2c6ad0586bb78c","Conference paper","Final","","Scopus","2-s2.0-85115071466"
"Zhang K.; Li T.; Liu B.; Liu Q.","Zhang, Kaihua (55475000500); Li, Tengpeng (57218178148); Liu, Bo (57204829196); Liu, Qingshan (36063739200)","55475000500; 57218178148; 57204829196; 36063739200","Co-saliency detection via mask-guided fully convolutional networks with multi-scale label smoothing","2019","Proceedings of the IEEE Computer Society Conference on Computer Vision and Pattern Recognition","2019-June","","8954093","3090","3099","9","78","10.1109/CVPR.2019.00321","https://www.scopus.com/inward/record.uri?eid=2-s2.0-85078729650&doi=10.1109%2fCVPR.2019.00321&partnerID=40&md5=6d8ca056f49b027d654d4df67ce2f885","Conference paper","Final","","Scopus","2-s2.0-85078729650"
"Zeng M.; Lu X.; Xu W.; Zhou T.; Liu Y.","Zeng, Ming (57204547185); Lu, Xiangzhe (57219131638); Xu, Wenkang (57219133258); Zhou, Tongxi (57219132896); Liu, Yinbo (57207473125)","57204547185; 57219131638; 57219133258; 57219132896; 57207473125","PublicGarbageNet : A Deep Learning Framework for Public Garbage Classification","2020","Chinese Control Conference, CCC","2020-July","","9189561","7200","7205","5","25","10.23919/CCC50068.2020.9189561","https://www.scopus.com/inward/record.uri?eid=2-s2.0-85091395692&doi=10.23919%2fCCC50068.2020.9189561&partnerID=40&md5=b002652c22fa793988093e38c741e52c","Conference paper","Final","","Scopus","2-s2.0-85091395692"
"Park S.-W.; Ko J.-S.; Huh J.-H.; Kim J.-C.","Park, Sung-Wook (57205079478); Ko, Jae-Sub (35253916100); Huh, Jun-Ho (56438784800); Kim, Jong-Chan (49963957400)","57205079478; 35253916100; 56438784800; 49963957400","Review on generative adversarial networks: Focusing on computer vision and its applications","2021","Electronics (Switzerland)","10","10","1216","","","","66","10.3390/electronics10101216","https://www.scopus.com/inward/record.uri?eid=2-s2.0-85106180519&doi=10.3390%2felectronics10101216&partnerID=40&md5=8d5ca3347494a23908b9b448ce19d112","Review","Final","All Open Access; Gold Open Access","Scopus","2-s2.0-85106180519"
"Bi L.; Hu G.","Bi, Luning (57189758358); Hu, Guiping (57115681500)","57189758358; 57115681500","Improving Image-Based Plant Disease Classification With Generative Adversarial Network Under Limited Training Set","2020","Frontiers in Plant Science","11","","583438","","","","52","10.3389/fpls.2020.583438","https://www.scopus.com/inward/record.uri?eid=2-s2.0-85097838586&doi=10.3389%2ffpls.2020.583438&partnerID=40&md5=7228ad2e11a8ba639dd460a49f9aee0b","Article","Final","All Open Access; Gold Open Access; Green Open Access","Scopus","2-s2.0-85097838586"
"Zheng C.; Jiang X.; Liu X.","Zheng, Ce (57201703277); Jiang, Xue (55724182500); Liu, Xingzhao (35242655900)","57201703277; 55724182500; 35242655900","Multi-discriminator generative adversarial network for semi-supervised SAR target recognition","2019","2019 IEEE Radar Conference, RadarConf 2019","","","8835801","","","","2","10.1109/RADAR.2019.8835801","https://www.scopus.com/inward/record.uri?eid=2-s2.0-85073112841&doi=10.1109%2fRADAR.2019.8835801&partnerID=40&md5=2d2cc12b8b1ae85595125acfb6fc595c","Conference paper","Final","","Scopus","2-s2.0-85073112841"
"Nambu Y.; Mariya T.; Shinkai S.; Umemoto M.; Asanuma H.; Sato I.; Hirohashi Y.; Torigoe T.; Fujino Y.; Saito T.","Nambu, Yuta (57354559700); Mariya, Tasuku (37023508600); Shinkai, Shota (57204030358); Umemoto, Mina (57205586614); Asanuma, Hiroko (7101973980); Sato, Ikuma (23493536000); Hirohashi, Yoshihiko (6701633527); Torigoe, Toshihiko (56410576900); Fujino, Yuichi (56783679300); Saito, Tsuyoshi (56397359600)","57354559700; 37023508600; 57204030358; 57205586614; 7101973980; 23493536000; 6701633527; 56410576900; 56783679300; 56397359600","A screening assistance system for cervical cytology of squamous cell atypia based on a two-step combined CNN algorithm with label smoothing","2022","Cancer Medicine","11","2","","520","529","9","17","10.1002/cam4.4460","https://www.scopus.com/inward/record.uri?eid=2-s2.0-85119972712&doi=10.1002%2fcam4.4460&partnerID=40&md5=4370f3d7a733881495697828ab696d4c","Article","Final","All Open Access; Green Open Access","Scopus","2-s2.0-85119972712"
"Ghoshal A.; Chen X.; Gupta S.; Zettlemoyer L.; Mehdad Y.","Ghoshal, Asish (57221157446); Chen, Xilun (57221569023); Gupta, Sonal (57215066662); Zettlemoyer, Luke (57204370628); Mehdad, Yashar (36705115700)","57221157446; 57221569023; 57215066662; 57204370628; 36705115700","LEARNING BETTER STRUCTURED REPRESENTATIONS USING LOW-RANK ADAPTIVE LABEL SMOOTHING","2021","ICLR 2021 - 9th International Conference on Learning Representations","","","","","","","6","","https://www.scopus.com/inward/record.uri?eid=2-s2.0-85135803793&partnerID=40&md5=31d042b13adccfb1f511c01edde8748d","Conference paper","Final","","Scopus","2-s2.0-85135803793"
"Thulasidasan S.; Chennupati G.; Bilmes J.; Bhattacharya T.; Michalak S.","Thulasidasan, Sunil (7801643916); Chennupati, Gopinath (56313821800); Bilmes, Jeff (7003705752); Bhattacharya, Tanmoy (7006308075); Michalak, Sarah (15521284800)","7801643916; 56313821800; 7003705752; 7006308075; 15521284800","On mixup training: Improved calibration and predictive uncertainty for deep neural networks","2019","Advances in Neural Information Processing Systems","32","","","","","","318","","https://www.scopus.com/inward/record.uri?eid=2-s2.0-85090099067&partnerID=40&md5=393b6ca3ac96b6ba3f2cb14c94d2099d","Conference paper","Final","","Scopus","2-s2.0-85090099067"
"Kanebako Y.; Tsukamoto K.","Kanebako, Yusuke (57271914200); Tsukamoto, Kazuki (57271497400)","57271914200; 57271497400","PuzzleShuffle: Undesirable Feature Learning for Semantic Shift Detection","2021","Lecture Notes in Computer Science (including subseries Lecture Notes in Artificial Intelligence and Lecture Notes in Bioinformatics)","12979 LNAI","","","3","19","16","0","10.1007/978-3-030-86517-7_1","https://www.scopus.com/inward/record.uri?eid=2-s2.0-85115675350&doi=10.1007%2f978-3-030-86517-7_1&partnerID=40&md5=d7580909c571a0fe04f17b2973406409","Conference paper","Final","","Scopus","2-s2.0-85115675350"
"Ren J.; Reyes N.; Barczak A.; Scogings C.; Liu M.","Ren, Jun (57203091004); Reyes, Napoleon (25423176400); Barczak, Andre (8704637800); Scogings, Chris (6507342004); Liu, Mingzhe (8921200600)","57203091004; 25423176400; 8704637800; 6507342004; 8921200600","Toward three-dimensional human action recognition using a convolutional neural network with correctness-vigilant regularizer","2018","Journal of Electronic Imaging","27","4","043040","","","","3","10.1117/1.JEI.27.4.043040","https://www.scopus.com/inward/record.uri?eid=2-s2.0-85051826124&doi=10.1117%2f1.JEI.27.4.043040&partnerID=40&md5=252406f01c0535b2aab11a715c5d1683","Article","Final","","Scopus","2-s2.0-85051826124"
"Fan Y.; Jiao J.","Fan, Yijiang (57393338500); Jiao, Jiajia (36625597200)","57393338500; 36625597200","Mammography Data Augmentation Using ACGAN","2021","ACM International Conference Proceeding Series","","","","431","437","6","1","10.1145/3500931.3501004","https://www.scopus.com/inward/record.uri?eid=2-s2.0-85122109414&doi=10.1145%2f3500931.3501004&partnerID=40&md5=f4e4ed779a4ae6a39f70da1ff1cc8277","Conference paper","Final","","Scopus","2-s2.0-85122109414"
"Takahashi R.; Matsubara T.; Uehara K.","Takahashi, Ryo (57208188137); Matsubara, Takashi (53863900700); Uehara, Kuniaki (7201993612)","57208188137; 53863900700; 7201993612","RICAP: Random Image Cropping and Patching Data Augmentation for Deep CNNs","2018","Proceedings of Machine Learning Research","95","","","786","798","12","97","","https://www.scopus.com/inward/record.uri?eid=2-s2.0-85161057083&partnerID=40&md5=4562cf7ea7ec8d66a1232ad2dcbe2c1e","Conference paper","Final","","Scopus","2-s2.0-85161057083"
"Luo J.; Wang Y.; Ou Y.; He B.; Li B.","Luo, Jianqiao (56621749600); Wang, Yihan (57767414700); Ou, Yang (57205493313); He, Biao (57198793427); Li, Bailin (15725555700)","56621749600; 57767414700; 57205493313; 57198793427; 15725555700","Article neighbor‐based label distribution learning to model label ambiguity for aerial scene classification","2021","Remote Sensing","13","4","755","1","25","24","15","10.3390/rs13040755","https://www.scopus.com/inward/record.uri?eid=2-s2.0-85101900286&doi=10.3390%2frs13040755&partnerID=40&md5=0cc940b216037714487698ecae8374a1","Article","Final","All Open Access; Gold Open Access","Scopus","2-s2.0-85101900286"
"Kaya Y.; Dumitras T.","Kaya, Yigitcan (57204824575); Dumitras, Tudor (13609104900)","57204824575; 13609104900","When Does Data Augmentation Help With Membership Inference Attacks?","2021","Proceedings of Machine Learning Research","139","","","5345","5355","10","43","","https://www.scopus.com/inward/record.uri?eid=2-s2.0-85161286377&partnerID=40&md5=b0b39d78675e3e6e6f2fd60061fc1394","Conference paper","Final","","Scopus","2-s2.0-85161286377"
"Xu M.; Islam M.; Lim C.M.; Ren H.","Xu, Mengya (57223735761); Islam, Mobarakol (57200950445); Lim, Chwee Ming (13410511900); Ren, Hongliang (14030501000)","57223735761; 57200950445; 13410511900; 14030501000","Learning Domain Adaptation with Model Calibration for Surgical Report Generation in Robotic Surgery","2021","Proceedings - IEEE International Conference on Robotics and Automation","2021-May","","","12350","12356","6","27","10.1109/ICRA48506.2021.9561569","https://www.scopus.com/inward/record.uri?eid=2-s2.0-85125440832&doi=10.1109%2fICRA48506.2021.9561569&partnerID=40&md5=96fc88d4300f1bfca06351842982eaf0","Conference paper","Final","All Open Access; Green Open Access","Scopus","2-s2.0-85125440832"
"Pereyra G.; Tucker G.; Chorowski J.; Kaiser Ł.; Hinton G.","Pereyra, Gabriel (57189599563); Tucker, George (57191854308); Chorowski, Jan (36970966300); Kaiser, Łukasz (15044821700); Hinton, Geoffrey (7006699573)","57189599563; 57191854308; 36970966300; 15044821700; 7006699573","Regularizing neural networks by penalizing confident output distributions","2017","5th International Conference on Learning Representations, ICLR 2017 - Workshop Track Proceedings","","","","","","","704","","https://www.scopus.com/inward/record.uri?eid=2-s2.0-85135124091&partnerID=40&md5=241097621294e21a3f016fc5a0d79479","Conference paper","Final","","Scopus","2-s2.0-85135124091"
"Wang J.; Shi K.; Wang L.; Li Z.; Sun F.; Pan R.; Gao W.","Wang, Jingan (56505824000); Shi, Kangjun (57209602498); Wang, Lei (57070625000); Li, Zhengxin (57203992603); Sun, Fengxin (56727201100); Pan, Ruru (35243302400); Gao, Weidong (7402758106)","56505824000; 57209602498; 57070625000; 57203992603; 56727201100; 35243302400; 7402758106","Automatic Assessment of Fabric Smoothness Appearance Based on a Compact Convolutional Neural Network with Label Smoothing","2020","IEEE Access","8","","8981949","26966","26974","8","13","10.1109/ACCESS.2020.2971506","https://www.scopus.com/inward/record.uri?eid=2-s2.0-85081096266&doi=10.1109%2fACCESS.2020.2971506&partnerID=40&md5=60e7a8314359288156ac8b6416b3c560","Article","Final","All Open Access; Gold Open Access","Scopus","2-s2.0-85081096266"
"Wan H.; Chen J.; Huang Z.; Feng Y.; Zhou Z.; Liu X.; Yao B.; Xu T.","Wan, Huiyao (57226596443); Chen, Jie (57208251494); Huang, Zhixiang (12243904200); Feng, Yun (57226598514); Zhou, Zheng (57226607721); Liu, Xiaoping (57226614459); Yao, Baidong (38762597100); Xu, Tao (57224664628)","57226596443; 57208251494; 12243904200; 57226598514; 57226607721; 57226614459; 38762597100; 57224664628","Lightweight Channel Attention and Multiscale Feature Fusion Discrimination for Remote Sensing Scene Classification","2021","IEEE Access","9","","9467262","94586","94600","14","15","10.1109/ACCESS.2021.3093308","https://www.scopus.com/inward/record.uri?eid=2-s2.0-85112026986&doi=10.1109%2fACCESS.2021.3093308&partnerID=40&md5=04fd4ba0a2e798bd8607f6a75bb07fb0","Article","Final","All Open Access; Gold Open Access","Scopus","2-s2.0-85112026986"
"Wang W.; Chen Y.; Ghamisi P.","Wang, Weiquan (57401754000); Chen, Yushi (15059992600); Ghamisi, Pedram (53663404300)","57401754000; 15059992600; 53663404300","Transferring CNN With Adaptive Learning for Remote Sensing Scene Classification","2022","IEEE Transactions on Geoscience and Remote Sensing","60","","5533918","","","","86","10.1109/TGRS.2022.3190934","https://www.scopus.com/inward/record.uri?eid=2-s2.0-85135234377&doi=10.1109%2fTGRS.2022.3190934&partnerID=40&md5=52faa658a3fab1e12f0ee777da4ad21c","Article","Final","","Scopus","2-s2.0-85135234377"
"Lee H.; Bae H.; Yoon S.","Lee, Hyungyu (57219632377); Bae, Ho (57205541775); Yoon, Sungroh (58142622900)","57219632377; 57205541775; 58142622900","Gradient Masking of Label Smoothing in Adversarial Robustness","2021","IEEE Access","9","","9311250","6453","6464","11","15","10.1109/ACCESS.2020.3048120","https://www.scopus.com/inward/record.uri?eid=2-s2.0-85099097767&doi=10.1109%2fACCESS.2020.3048120&partnerID=40&md5=20a03ea521c7a2fc4c39464336dbb081","Article","Final","All Open Access; Gold Open Access","Scopus","2-s2.0-85099097767"
"Wei D.; Cao S.; Ma K.; Zheng Y.","Wei, Dong (57213002733); Cao, Shilei (57212064686); Ma, Kai (57216331738); Zheng, Yefeng (8062522600)","57213002733; 57212064686; 57216331738; 8062522600","Learning and exploiting interclass visual correlations for medical image classification","2020","Lecture Notes in Computer Science (including subseries Lecture Notes in Artificial Intelligence and Lecture Notes in Bioinformatics)","12261 LNCS","","","106","115","9","3","10.1007/978-3-030-59710-8_11","https://www.scopus.com/inward/record.uri?eid=2-s2.0-85093105699&doi=10.1007%2f978-3-030-59710-8_11&partnerID=40&md5=cbb0c163e6fc35a59ba740d515715c58","Conference paper","Final","","Scopus","2-s2.0-85093105699"
"Danilla C.; Persello C.; Tolpekin V.; Bergado J.R.","Danilla, Carolyne (57200605507); Persello, Claudio (23493587700); Tolpekin, Valentyn (16418092800); Bergado, John Ray (57192703116)","57200605507; 23493587700; 16418092800; 57192703116","Classification of multitemporal SAR images using convolutional neural networks and Markov random fields","2017","International Geoscience and Remote Sensing Symposium (IGARSS)","2017-July","","8127432","2231","2234","3","17","10.1109/IGARSS.2017.8127432","https://www.scopus.com/inward/record.uri?eid=2-s2.0-85041823065&doi=10.1109%2fIGARSS.2017.8127432&partnerID=40&md5=231badd8781ece7948344342fac8f01e","Conference paper","Final","","Scopus","2-s2.0-85041823065"
"Hänsch R.; Hellwich O.","Hänsch, Ronny (35795173000); Hellwich, Olaf (6701327873)","35795173000; 6701327873","Skipping the real world: Classification of PolSAR images without explicit feature extraction","2018","ISPRS Journal of Photogrammetry and Remote Sensing","140","","","122","132","10","34","10.1016/j.isprsjprs.2017.11.022","https://www.scopus.com/inward/record.uri?eid=2-s2.0-85037724565&doi=10.1016%2fj.isprsjprs.2017.11.022&partnerID=40&md5=3425eb3f689c7ffd42b683f886eaff90","Article","Final","","Scopus","2-s2.0-85037724565"
"Qiu J.; Hayashi Y.; Oda M.; Kitasaka T.; Takeshita N.; Ito M.; Mori K.","Qiu, Jie (57740993500); Hayashi, Yuichiro (35187020100); Oda, Masahiro (7402781246); Kitasaka, Takayuki (6603413131); Takeshita, Nobuyoshi (54975055100); Ito, Masaaki (58722995900); Mori, Kensaku (55322004600)","57740993500; 35187020100; 7402781246; 6603413131; 54975055100; 58722995900; 55322004600","Spatial Label Smoothing via Aleatoric Uncertainty for Bleeding Region Segmentation from Laparoscopic Videos","2022","Progress in Biomedical Optics and Imaging - Proceedings of SPIE","12032","","120320U","","","","0","10.1117/12.2611672","https://www.scopus.com/inward/record.uri?eid=2-s2.0-85131954150&doi=10.1117%2f12.2611672&partnerID=40&md5=b12463c08bd149f7f32c8afc59082f8f","Conference paper","Final","","Scopus","2-s2.0-85131954150"
"Tong W.; Chen W.; Han W.; Li X.; Wang L.","Tong, Wei (57218501791); Chen, Weitao (55822747800); Han, Wei (57191570975); Li, Xianju (41261664800); Wang, Lizhe (23029267900)","57218501791; 55822747800; 57191570975; 41261664800; 23029267900","Channel-Attention-Based DenseNet Network for Remote Sensing Image Scene Classification","2020","IEEE Journal of Selected Topics in Applied Earth Observations and Remote Sensing","13","","9141394","4121","4132","11","178","10.1109/JSTARS.2020.3009352","https://www.scopus.com/inward/record.uri?eid=2-s2.0-85089347927&doi=10.1109%2fJSTARS.2020.3009352&partnerID=40&md5=2991b59a0953af7ac8878168eae6cac5","Article","Final","All Open Access; Gold Open Access","Scopus","2-s2.0-85089347927"
"He X.; Chen Y.","He, Xin (57201259373); Chen, Yushi (15059992600)","57201259373; 15059992600","Modifications of the multi-layer perceptron for hyperspectral image classification","2021","Remote Sensing","13","17","3547","","","","28","10.3390/rs13173547","https://www.scopus.com/inward/record.uri?eid=2-s2.0-85114553432&doi=10.3390%2frs13173547&partnerID=40&md5=d665136d40547e58cc6f09cca417b556","Article","Final","All Open Access; Gold Open Access; Green Open Access","Scopus","2-s2.0-85114553432"
"Carse J.; Alvarez Olmo A.; McKenna S.","Carse, Jacob (57196021846); Alvarez Olmo, Andres (57908371000); McKenna, Stephen (56781068200)","57196021846; 57908371000; 56781068200","Calibration of Deep Medical Image Classifiers: An Empirical Comparison Using Dermatology and Histopathology Datasets","2022","Lecture Notes in Computer Science (including subseries Lecture Notes in Artificial Intelligence and Lecture Notes in Bioinformatics)","13563 LNCS","","","89","99","10","2","10.1007/978-3-031-16749-2_9","https://www.scopus.com/inward/record.uri?eid=2-s2.0-85138832787&doi=10.1007%2f978-3-031-16749-2_9&partnerID=40&md5=4915917c312b8cdffcc7654c02e47342","Conference paper","Final","All Open Access; Green Open Access","Scopus","2-s2.0-85138832787"
"Song Z.; Meng Z.; Zhang Y.; King I.","Song, Zixing (57222380726); Meng, Ziqiao (57217164272); Zhang, Yifei (57340422400); King, Irwin (7102275781)","57222380726; 57217164272; 57340422400; 7102275781","Semi-supervised Multi-label Learning for Graph-structured Data","2021","International Conference on Information and Knowledge Management, Proceedings","","","","1723","1733","10","27","10.1145/3459637.3482391","https://www.scopus.com/inward/record.uri?eid=2-s2.0-85119198751&doi=10.1145%2f3459637.3482391&partnerID=40&md5=3e2902caa21377f972fff44255567580","Conference paper","Final","","Scopus","2-s2.0-85119198751"
"Qiao S.-B.; Pang S.-C.; Wang M.; Zhai X.; Yu S.-H.; Ding T.","Qiao, Si-Bo (57209331290); Pang, Shan-Chen (56257339200); Wang, Min (57230447200); Zhai, Xue (57217280673); Yu, Shi-Hang (57218824177); Ding, Tong (57209328786)","57209331290; 56257339200; 57230447200; 57217280673; 57218824177; 57209328786","A Convolutional Neural Network for Brain CT Image Classification Based on Residual Hybrid Attention Mechanism; [基于残差混合注意力机制的脑部CT图像分类卷积神经网络模型]","2021","Tien Tzu Hsueh Pao/Acta Electronica Sinica","49","5","","984","991","7","13","10.12263/DZXB.20200881","https://www.scopus.com/inward/record.uri?eid=2-s2.0-85108184313&doi=10.12263%2fDZXB.20200881&partnerID=40&md5=45257cbc476c032385c14401d45851a7","Article","Final","","Scopus","2-s2.0-85108184313"
"Petrovska B.; Atanasova-Pacemska T.; Stojkovik N.; Stojanova A.; Kocaleva M.","Petrovska, Biserka (57218093154); Atanasova-Pacemska, Tatjana (55612796100); Stojkovik, Natasa (56497869700); Stojanova, Aleksandra (56938593800); Kocaleva, Mirjana (56939023800)","57218093154; 55612796100; 56497869700; 56938593800; 56939023800","Machine learning with remote sensing image datasets","2021","Informatica (Slovenia)","45","3","","347","358","11","2","10.31449/INF.V45I3.3296","https://www.scopus.com/inward/record.uri?eid=2-s2.0-85119091395&doi=10.31449%2fINF.V45I3.3296&partnerID=40&md5=51fb67d165906423f8df3704850a37c2","Article","Final","All Open Access; Gold Open Access; Green Open Access","Scopus","2-s2.0-85119091395"
"","","","20th International Conference on Artificial Intelligence in Medicine, AIME 2022","2022","Lecture Notes in Computer Science (including subseries Lecture Notes in Artificial Intelligence and Lecture Notes in Bioinformatics)","13263 LNAI","","","","","440","0","","https://www.scopus.com/inward/record.uri?eid=2-s2.0-85135080837&partnerID=40&md5=d8ade5cf7a95ff00269c1b6a8e8de0db","Conference review","Final","","Scopus","2-s2.0-85135080837"
