"Authors","Author full names","Author(s) ID","Title","Year","Source title","Volume","Issue","Art. No.","Page start","Page end","Page count","Cited by","DOI","Link","Document Type","Publication Stage","Open Access","Source","EID"
"Yu H.; Li X.; Hao X.; Song Z.; Liu S.; Li X.; Hou C.; Xie H.","Yu, Han (57218552887); Li, Xingjie (57212493853); Hao, Xue (58868504900); Song, Zhaowei (55177010700); Liu, Shangyu (58032859200); Li, Xinyue (57775609000); Hou, Chunyu (58033198800); Xie, Huasheng (7401672865)","57218552887; 57212493853; 58868504900; 55177010700; 58032859200; 57775609000; 58033198800; 7401672865","Improving Scattered Defect Grading in Castings Digital Radiographs via Smoothing the One-Hot Encoding","2024","International Journal of Metalcasting","","","","","","","0","10.1007/s40962-024-01335-3","https://www.scopus.com/inward/record.uri?eid=2-s2.0-85191089957&doi=10.1007%2fs40962-024-01335-3&partnerID=40&md5=ca052b6735b0ac55bd9e31274dc224e7","Article","Article in press","","Scopus","2-s2.0-85191089957"
"Kang G.; Hou L.; Zhao Z.; Lang B.","Kang, Gangwei (58416489500); Hou, Liang (58411902900); Zhao, Zhuo (58413426900); Lang, Bingbing (58415721600)","58416489500; 58411902900; 58413426900; 58415721600","Research on the Application of Convolutional Neural Network Based on YOLO Algorithm in Pest Small Target Detection","2023","Proceedings - 2023 3rd Asia-Pacific Conference on Communications Technology and Computer Science, ACCTCS 2023","","","","131","135","4","3","10.1109/ACCTCS58815.2023.00074","https://www.scopus.com/inward/record.uri?eid=2-s2.0-85163780723&doi=10.1109%2fACCTCS58815.2023.00074&partnerID=40&md5=fcd1abc5bf35b90ca9bdf377e627ab74","Conference paper","Final","","Scopus","2-s2.0-85163780723"
"Wu X.; Wei X.; Xu H.; He W.; Sun C.; Zhang L.; Li Y.; Fang Y.","Wu, Xin (57210928667); Wei, Xiaolong (55818758900); Xu, Haojun (16033737400); He, Weifeng (26867736700); Sun, Chao (57746176300); Zhang, Lin (59117679100); Li, Yiwen (27172311800); Fang, Yang (58103770500)","57210928667; 55818758900; 16033737400; 26867736700; 57746176300; 59117679100; 27172311800; 58103770500","Radar-absorbing materials damage detection through microwave images using one-stage object detectors","2022","NDT and E International","127","","102604","","","","1","10.1016/j.ndteint.2022.102604","https://www.scopus.com/inward/record.uri?eid=2-s2.0-85122998580&doi=10.1016%2fj.ndteint.2022.102604&partnerID=40&md5=0d6910687a1f7f809d7a0ac0593e4d2e","Article","Final","","Scopus","2-s2.0-85122998580"
"Chen Z.; Wang J.; Wang Y.","Chen, Zengzheng (59553367900); Wang, Jianxin (55930514400); Wang, Yeru (36524286900)","59553367900; 55930514400; 36524286900","Enhancing Food Image Recognition by Multi-Level Fusion and the Attention Mechanism","2025","Foods","14","3","461","","","","0","10.3390/foods14030461","https://www.scopus.com/inward/record.uri?eid=2-s2.0-85217715976&doi=10.3390%2ffoods14030461&partnerID=40&md5=f185135f35fe8192076aef0ca72455f3","Article","Final","","Scopus","2-s2.0-85217715976"
"Li D.; Huo H.; Jiao S.; Sun X.; Chen S.","Li, Dongfang (59145047300); Huo, Hua (8899588700); Jiao, Shupei (59144930900); Sun, Xiaowei (56139100600); Chen, Shuya (59144853200)","59145047300; 8899588700; 59144930900; 56139100600; 59144853200","Automated thorax disease diagnosis using multi-branch residual attention network","2024","Scientific Reports","14","1","11865","","","","0","10.1038/s41598-024-62813-6","https://www.scopus.com/inward/record.uri?eid=2-s2.0-85194218917&doi=10.1038%2fs41598-024-62813-6&partnerID=40&md5=01581bd3db4963ea78ea3233cc2a525a","Article","Final","All Open Access; Gold Open Access; Green Open Access","Scopus","2-s2.0-85194218917"
"Wan P.; Lu Z.; Chen C.; Teoh T.T.","Wan, Pian (57205907419); Lu, Zhiwei (58581036300); Chen, Chen (55664378400); Teoh, Teik Toe (57738355900)","57205907419; 58581036300; 55664378400; 57738355900","Deep Learning Based COVID-19 Detection from Chest X-ray Images","2023","2023 3rd International Conference on Computer, Control and Robotics, ICCCR 2023","","","","41","46","5","1","10.1109/ICCCR56747.2023.10194142","https://www.scopus.com/inward/record.uri?eid=2-s2.0-85168548994&doi=10.1109%2fICCCR56747.2023.10194142&partnerID=40&md5=9a94de9b579dffa7351222e54ffe6e8a","Conference paper","Final","","Scopus","2-s2.0-85168548994"
"Wang L.; Wang X.; Xu Y.; Wu X.; Du S.; Zhang S.; Sun Q.; Wang X.","Wang, Lilong (57217028736); Wang, Xuan (55978394800); Xu, Yali (55536085200); Wu, Xiangan (57210893582); Du, Shunda (15077897300); Zhang, Shaoting (13605200100); Sun, Qiang (59317295900); Wang, Xiaosong (57192075663)","57217028736; 55978394800; 55536085200; 57210893582; 15077897300; 13605200100; 59317295900; 57192075663","Dual-Perspective Label Smoothing for Accurate Tumor Segmentation","2024","Proceedings - International Symposium on Biomedical Imaging","","","","","","","0","10.1109/ISBI56570.2024.10635464","https://www.scopus.com/inward/record.uri?eid=2-s2.0-85203392983&doi=10.1109%2fISBI56570.2024.10635464&partnerID=40&md5=0b1c2f5d53bd71a830d222f6b2e0751f","Conference paper","Final","","Scopus","2-s2.0-85203392983"
"Wei X.; Wang J.-J.; Zhang S.-L.; Zhang D.; Zhang J.; Wei X.-T.","Wei, Xiang (55894157800); Wang, Jing-Jie (57752552100); Zhang, Shun-Li (56108895300); Zhang, Di (57193343435); Zhang, Jian (55894825000); Wei, Xiao-Tao (14038368300)","55894157800; 57752552100; 56108895300; 57193343435; 55894825000; 14038368300","ReLSL: Reliable Label Selection and Learning Based Algorithm for Semi-Supervised Learning; [ReLSL:基于可靠标签选择与学习的半监督学习算法]","2022","Jisuanji Xuebao/Chinese Journal of Computers","45","6","","1147","1160","13","2","10.11897/SP.J.1016.2022.01147","https://www.scopus.com/inward/record.uri?eid=2-s2.0-85132335834&doi=10.11897%2fSP.J.1016.2022.01147&partnerID=40&md5=c9aa64c173757429976d5956a5efea6e","Article","Final","","Scopus","2-s2.0-85132335834"
"Adeshina S.A.; Adedigba A.P.","Adeshina, Steve A. (36198036600); Adedigba, Adeyinka P. (57194027040)","36198036600; 57194027040","Bag of Tricks for Improving Deep Learning Performance on Multimodal Image Classification","2022","Bioengineering","9","7","312","","","","3","10.3390/bioengineering9070312","https://www.scopus.com/inward/record.uri?eid=2-s2.0-85136182454&doi=10.3390%2fbioengineering9070312&partnerID=40&md5=f266004fc9705e7e80cc66b351492dbc","Article","Final","All Open Access; Gold Open Access; Green Open Access","Scopus","2-s2.0-85136182454"
"An R.; Perez-Cruet J.; Wang J.","An, Ruopeng (35793436900); Perez-Cruet, Joshua (57821545700); Wang, Junjie (57202162743)","35793436900; 57821545700; 57202162743","We got nuts! use deep neural networks to classify images of common edible nuts","2024","Nutrition and Health","30","2","","301","307","6","1","10.1177/02601060221113928","https://www.scopus.com/inward/record.uri?eid=2-s2.0-85135011797&doi=10.1177%2f02601060221113928&partnerID=40&md5=94f3f971265fc6b29c133eb9c217b7cc","Article","Final","","Scopus","2-s2.0-85135011797"
"Yu H.; Zhang Q.; Zhu D.; Wang W.","Yu, Hongbo (49865200600); Zhang, Qipeng (58394337900); Zhu, Duojia (58395896100); Wang, Weiding (58397459400)","49865200600; 58394337900; 58395896100; 58397459400","Research On Garbage Classification Algorithm Based On Deep Learning","2023","Proceedings of SPIE - The International Society for Optical Engineering","12712","","127121R","","","","0","10.1117/12.2679224","https://www.scopus.com/inward/record.uri?eid=2-s2.0-85163297648&doi=10.1117%2f12.2679224&partnerID=40&md5=94c4fad0cafbcffa048d6e73194d1448","Conference paper","Final","","Scopus","2-s2.0-85163297648"
"Yuan J.; Wang S.","Yuan, Jingwen (57216860203); Wang, Shugen (56428270800)","57216860203; 56428270800","HCFPN: Hierarchical Contextual Feature-Preserved Network for Remote Sensing Scene Classification","2023","Remote Sensing","15","3","810","","","","4","10.3390/rs15030810","https://www.scopus.com/inward/record.uri?eid=2-s2.0-85148036412&doi=10.3390%2frs15030810&partnerID=40&md5=0ddc4d5d207a05d1f4917b25cb7e0390","Article","Final","All Open Access; Gold Open Access","Scopus","2-s2.0-85148036412"
"Wei X.; Xu Y.; Yang J.","Wei, Xiushen (56718883700); Xu, Yuyan (57222158773); Yang, Jian (56999514900)","56718883700; 57222158773; 56999514900","Review of webly-supervised fine-grained image recognition; [网络监督数据下的细粒度图像识别综述]","2022","Journal of Image and Graphics","27","7","","2057","2077","20","3","10.11834/jig.210188","https://www.scopus.com/inward/record.uri?eid=2-s2.0-85137846637&doi=10.11834%2fjig.210188&partnerID=40&md5=8e6c69d5830ffaf9e8d6930950caecae","Review","Final","","Scopus","2-s2.0-85137846637"
"Chen Z.; Yang J.; Feng Z.; Chen L.","Chen, Zhichao (57230282800); Yang, Jie (57221479523); Feng, Zhicheng (57851676500); Chen, Lifang (57360210500)","57230282800; 57221479523; 57851676500; 57360210500","RSCNet: An Efficient Remote Sensing Scene Classification Model Based on Lightweight Convolution Neural Networks","2022","Electronics (Switzerland)","11","22","3727","","","","13","10.3390/electronics11223727","https://www.scopus.com/inward/record.uri?eid=2-s2.0-85142413402&doi=10.3390%2felectronics11223727&partnerID=40&md5=98d1be6d2985beaa08f12da61fa515bf","Article","Final","All Open Access; Gold Open Access","Scopus","2-s2.0-85142413402"
"Ni J.; Tian K.; Lopez-Martinez C.; Zhan Y.; Lin X.; Tao D.","Ni, Jun (57197785262); Tian, Kun (59365307600); Lopez-Martinez, Carlos (56036083300); Zhan, Yibing (56100491900); Lin, Xu (56453694400); Tao, Dapeng (54411283900)","57197785262; 59365307600; 56036083300; 56100491900; 56453694400; 54411283900","HAG-Former: A Temporal-Polarimetric Relationship Inference Network From Local to Global","2024","IEEE Geoscience and Remote Sensing Letters","21","","4018205","","","","0","10.1109/LGRS.2024.3469910","https://www.scopus.com/inward/record.uri?eid=2-s2.0-85206263406&doi=10.1109%2fLGRS.2024.3469910&partnerID=40&md5=8f6cc0defe15f8c277cdec7acd912c82","Article","Final","","Scopus","2-s2.0-85206263406"
"Naseer M.; Khan S.; Porikli F.; Khan F.S.","Naseer, Muzammal (57204565968); Khan, Salman (56415451600); Porikli, Fatih (6603528219); Khan, Fahad Shahbaz (36100204000)","57204565968; 56415451600; 6603528219; 36100204000","Guidance Through Surrogate: Toward a Generic Diagnostic Attack","2024","IEEE Transactions on Neural Networks and Learning Systems","35","2","","2042","2053","11","0","10.1109/TNNLS.2022.3186278","https://www.scopus.com/inward/record.uri?eid=2-s2.0-85134325046&doi=10.1109%2fTNNLS.2022.3186278&partnerID=40&md5=faa3950fd4e4402e512e9aa071160e3f","Article","Final","","Scopus","2-s2.0-85134325046"
"Karakose E.","Karakose, Ebru (55604717500)","55604717500","An Efficient Satellite Images Classification Approach Based on Fuzzy Cognitive Map Integration With Deep Learning Models Using Improved Loss Function","2024","IEEE Access","12","","","141361","141379","18","0","10.1109/ACCESS.2024.3461871","https://www.scopus.com/inward/record.uri?eid=2-s2.0-85204580675&doi=10.1109%2fACCESS.2024.3461871&partnerID=40&md5=95aa96645723e2cab32819cd3618016a","Article","Final","All Open Access; Gold Open Access","Scopus","2-s2.0-85204580675"
"Sheela S.; Piang M.P.; Sakorntanant S.; Poomrittigul S.; Treebupachatsakul T.","Sheela, Sherin (58966867200); Piang, May Phu (57193688862); Sakorntanant, Sakda (57193015749); Poomrittigul, Suvit (26422438900); Treebupachatsakul, Treesukon (56659489300)","58966867200; 57193688862; 57193015749; 26422438900; 56659489300","Deep Learning to Classify Bacterial Species in the same Genus","2024","2024 International Conference on Electronics, Information, and Communication, ICEIC 2024","","","","","","","0","10.1109/ICEIC61013.2024.10457278","https://www.scopus.com/inward/record.uri?eid=2-s2.0-85189244055&doi=10.1109%2fICEIC61013.2024.10457278&partnerID=40&md5=146db0fd2599732efcfc4480edf36b95","Conference paper","Final","","Scopus","2-s2.0-85189244055"
"Mao R.; Wu G.; Wu J.; Wang X.","Mao, Ruichi (59417220500); Wu, Guangqiang (7404976093); Wu, Jian (59254366000); Wang, Xingyu (57221486301)","59417220500; 7404976093; 59254366000; 57221486301","A lightweight convolutional neural network for road surface classification under shadow interference","2024","Knowledge-Based Systems","306","","112761","","","","0","10.1016/j.knosys.2024.112761","https://www.scopus.com/inward/record.uri?eid=2-s2.0-85209670945&doi=10.1016%2fj.knosys.2024.112761&partnerID=40&md5=a8bebbbd6ce8ef8c5af3ddd493afe1dd","Article","Final","","Scopus","2-s2.0-85209670945"
"Deng E.; Xiao P.; Zhou E.","Deng, Erqiang (57222097331); Xiao, Peng (57221193160); Zhou, Erqiang (22037246000)","57222097331; 57221193160; 22037246000","Optimizing Network Architectures for Ultrasound Cardiac Segmentation","2023","ACM International Conference Proceeding Series","","","","20","25","5","0","10.1145/3644116.3644122","https://www.scopus.com/inward/record.uri?eid=2-s2.0-85190945928&doi=10.1145%2f3644116.3644122&partnerID=40&md5=3018bc4c4089175a4974a5147d6b5d31","Conference paper","Final","","Scopus","2-s2.0-85190945928"
"Jin H.; Li H.","Jin, Hailong (58779203400); Li, Huiying (36552872000)","58779203400; 36552872000","An enhanced approach for few-shot segmentation via smooth downsampling mask and label smoothing loss","2024","Image and Vision Computing","148","","105113","","","","0","10.1016/j.imavis.2024.105113","https://www.scopus.com/inward/record.uri?eid=2-s2.0-85196035450&doi=10.1016%2fj.imavis.2024.105113&partnerID=40&md5=cf3dff9da37ba06a163fe21f37c3bba2","Article","Final","","Scopus","2-s2.0-85196035450"
"Hayashi Y.; Misawa K.; Mori K.","Hayashi, Yuichiro (35187020100); Misawa, Kazunari (23091664200); Mori, Kensaku (55322004600)","35187020100; 23091664200; 55322004600","Surgical area recognition from laparoscopic images in laparoscopic gastrectomy for gastric cancer using label smoothing and uncertainty","2023","Progress in Biomedical Optics and Imaging - Proceedings of SPIE","12466","","1246624","","","","0","10.1117/12.2654775","https://www.scopus.com/inward/record.uri?eid=2-s2.0-85160812558&doi=10.1117%2f12.2654775&partnerID=40&md5=e0da55bb58950f56b291c86887e3a6e5","Conference paper","Final","","Scopus","2-s2.0-85160812558"
"Wang A.; Zhang K.; Wu H.; Dai S.; Iwahori Y.; Yu X.","Wang, Aili (55483869300); Zhang, Kang (58193508000); Wu, Haibin (57219039210); Dai, Shiyu (56693642600); Iwahori, Yuji (7003339167); Yu, Xiaoyu (16318062200)","55483869300; 58193508000; 57219039210; 56693642600; 7003339167; 16318062200","Noise-Disruption-Inspired Neural Architecture Search with Spatial–Spectral Attention for Hyperspectral Image Classification","2024","Remote Sensing","16","17","3123","","","","0","10.3390/rs16173123","https://www.scopus.com/inward/record.uri?eid=2-s2.0-85203850448&doi=10.3390%2frs16173123&partnerID=40&md5=bebad9e6e40968fc056682744e72f962","Article","Final","All Open Access; Gold Open Access","Scopus","2-s2.0-85203850448"
"Cao C.; Xiang H.; Song W.; Yi H.; Xiao F.; Gao X.","Cao, Chunhong (57188999346); Xiang, Han (58137882300); Song, Wei (58137882400); Yi, Hongbo (58138560200); Xiao, Fen (9233047500); Gao, Xieping (8961276300)","57188999346; 58137882300; 58137882400; 58138560200; 9233047500; 8961276300","Lightweight Multiscale Neural Architecture Search With Spectral-Spatial Attention for Hyperspectral Image Classification","2023","IEEE Transactions on Geoscience and Remote Sensing","61","","5505315","","","","16","10.1109/TGRS.2023.3253247","https://www.scopus.com/inward/record.uri?eid=2-s2.0-85149890306&doi=10.1109%2fTGRS.2023.3253247&partnerID=40&md5=3dc308b80eb5f877ee3ac4444d7e0508","Article","Final","","Scopus","2-s2.0-85149890306"
"Liu L.; Zhang H.; Wang Y.","Liu, Lizhu (56048662500); Zhang, Hui (56955310400); Wang, Yaonan (55998880600)","56048662500; 56955310400; 55998880600","Contrastive Mutual Learning with Pseudo-Label Smoothing for Hyperspectral Image Classification","2024","IEEE Transactions on Instrumentation and Measurement","73","","2520314","1","14","13","4","10.1109/TIM.2024.3406811","https://www.scopus.com/inward/record.uri?eid=2-s2.0-85194846545&doi=10.1109%2fTIM.2024.3406811&partnerID=40&md5=ce948a3b39232b200090a293e618cda5","Article","Final","","Scopus","2-s2.0-85194846545"
"Kongmanee J.; Thanapattheerakul T.; Chignell M.","Kongmanee, Jaturong (57193608075); Thanapattheerakul, Thanyathorn (57193609247); Chignell, Mark (7004468008)","57193608075; 57193609247; 7004468008","Dual-Stage OOD Detection Learning with an Unsupervised Start","2023","ACM International Conference Proceeding Series","","","10","","","","0","10.1145/3628454.3628497","https://www.scopus.com/inward/record.uri?eid=2-s2.0-85180749393&doi=10.1145%2f3628454.3628497&partnerID=40&md5=7ba9d1d04ef77dfa289d4e23f052d93f","Conference paper","Final","","Scopus","2-s2.0-85180749393"
"Liu F.; Zang C.; Li L.; Xu C.; Luo J.","Liu, Fuxiang (55522564400); Zang, Chen (58202434900); Li, Lei (57742384200); Xu, Chunfeng (57976489600); Luo, Jingmin (58202196400)","55522564400; 58202434900; 57742384200; 57976489600; 58202196400","ConvNeXt-Haze: A Fog Image Classification Algorithm for Small and Imbalanced Sample Dataset Based on Convolutional Neural Network","2023","IEICE Transactions on Information and Systems","E106D","4","","488","494","6","1","10.1587/TRANSINF.2022IIP0009","https://www.scopus.com/inward/record.uri?eid=2-s2.0-85153851247&doi=10.1587%2fTRANSINF.2022IIP0009&partnerID=40&md5=d9a6bf01bee3edc98ff44310a97a26a4","Article","Final","All Open Access; Gold Open Access","Scopus","2-s2.0-85153851247"
"Yuan S.-Q.; Cao Y.; Cheng X.","Yuan, Shi-Qi (58765275700); Cao, Yu (58497724000); Cheng, Xu (57919516100)","58765275700; 58497724000; 57919516100","Research on Strawberry Quality Grading Based on Object Detection and Stacking Fusion Model","2023","IEEE Access","11","","","137475","137484","9","2","10.1109/ACCESS.2023.3339572","https://www.scopus.com/inward/record.uri?eid=2-s2.0-85179806927&doi=10.1109%2fACCESS.2023.3339572&partnerID=40&md5=937c391929071d0a994f6825aa1be8bf","Article","Final","All Open Access; Gold Open Access","Scopus","2-s2.0-85179806927"
"Lu P.; Rashid A.; Kobyzev I.; Rezagholizadeh M.; Langlais P.","Lu, Peng (57216965637); Rashid, Ahmad (57216968815); Kobyzev, Ivan (57204242327); Rezagholizadeh, Mehdi (57218453387); Langlais, Philippe (7006100067)","57216965637; 57216968815; 57204242327; 57218453387; 7006100067","LABO: Towards Learning Optimal Label Regularization via Bi-level Optimization","2023","Proceedings of the Annual Meeting of the Association for Computational Linguistics","","","","5759","5774","15","0","","https://www.scopus.com/inward/record.uri?eid=2-s2.0-85175461602&partnerID=40&md5=c74898b97ed39186c7cd9442363a9f96","Conference paper","Final","","Scopus","2-s2.0-85175461602"
"Din N.U.; Zhang L.; Nawaz M.S.; Yang Y.","Din, Nasir Ud (58116852600); Zhang, Li (36834765200); Nawaz, M. Saqib (57205056170); Yang, Yatao (57203417891)","58116852600; 36834765200; 57205056170; 57203417891","Multi-model feature aggregation for classification of laser welding images with vision transformer","2024","Journal of King Saud University - Computer and Information Sciences","36","5","102049","","","","1","10.1016/j.jksuci.2024.102049","https://www.scopus.com/inward/record.uri?eid=2-s2.0-85192699788&doi=10.1016%2fj.jksuci.2024.102049&partnerID=40&md5=e8a75b5165656c574e87b80e92fb9446","Article","Final","All Open Access; Gold Open Access","Scopus","2-s2.0-85192699788"
"Zhu W.; Lai H.; Zhang H.; Zhang G.; Luo Y.; Wang J.; Sun L.; Lu J.; Wang S.; Xiang Y.","Zhu, Wei (58108479000); Lai, Huilin (57243976900); Zhang, Haitang (58727421800); Zhang, Guokai (57197828490); Luo, Yongxin (58973371800); Wang, Jie (58533782900); Sun, Lu (58533216500); Lu, Jianwei (55701429200); Wang, Shuihua (36544650700); Xiang, Yanwei (57211256905)","58108479000; 57243976900; 58727421800; 57197828490; 58973371800; 58533782900; 58533216500; 55701429200; 36544650700; 57211256905","Abscissa-Ordinate Focused Network for Psoriasis and Eczema Healthcare Cyber-Physical System With Active Label Smoothing","2024","IEEE Access","12","","","54953","54963","10","2","10.1109/ACCESS.2024.3384310","https://www.scopus.com/inward/record.uri?eid=2-s2.0-85189635413&doi=10.1109%2fACCESS.2024.3384310&partnerID=40&md5=6dcd6634c0e17f269ca58067a72fec71","Article","Final","All Open Access; Gold Open Access","Scopus","2-s2.0-85189635413"
"Kumar T.; Mileo A.; Brennan R.; Bendechache M.","Kumar, Teerath (57274800400); Mileo, Alessandra (57198982108); Brennan, Rob (36447456700); Bendechache, Malika (57090876300)","57274800400; 57198982108; 36447456700; 57090876300","RSMDA: Random Slices Mixing Data Augmentation","2023","Applied Sciences (Switzerland)","13","3","1711","","","","5","10.3390/app13031711","https://www.scopus.com/inward/record.uri?eid=2-s2.0-85147977205&doi=10.3390%2fapp13031711&partnerID=40&md5=f14fac36ae3f889b37af153d54711a61","Article","Final","All Open Access; Gold Open Access","Scopus","2-s2.0-85147977205"
"Zhang B.; Chen Y.; Rong Y.; Xiong S.; Lu X.","Zhang, Bo (58367988800); Chen, Yaxiong (57195986737); Rong, Yi (56902248300); Xiong, Shengwu (57203905556); Lu, Xiaoqiang (35180125200)","58367988800; 57195986737; 56902248300; 57203905556; 35180125200","MATNet: A Combining Multi-Attention and Transformer Network for Hyperspectral Image Classification","2023","IEEE Transactions on Geoscience and Remote Sensing","61","","5506015","","","","20","10.1109/TGRS.2023.3254523","https://www.scopus.com/inward/record.uri?eid=2-s2.0-85149811455&doi=10.1109%2fTGRS.2023.3254523&partnerID=40&md5=e1d9d51cbb29c7edf0ad3d5e9d51c946","Article","Final","","Scopus","2-s2.0-85149811455"
"Tamang T.; Baral S.; Paing M.P.","Tamang, Thinam (57273876000); Baral, Sushish (58028566300); Paing, May Phu (57193688862)","57273876000; 58028566300; 57193688862","Classification of White Blood Cells: A Comprehensive Study Using Transfer Learning Based on Convolutional Neural Networks","2022","Diagnostics","12","12","2903","","","","14","10.3390/diagnostics12122903","https://www.scopus.com/inward/record.uri?eid=2-s2.0-85144616814&doi=10.3390%2fdiagnostics12122903&partnerID=40&md5=d2f8ac6839ac2807329ffdc8d7f7b913","Article","Final","All Open Access; Gold Open Access; Green Open Access","Scopus","2-s2.0-85144616814"
"Tang Y.; Zhou D.; Flesch R.C.C.; Jin T.","Tang, Yundong (57193339074); Zhou, Depei (59410875800); Flesch, Rodolfo C.C. (35179226900); Jin, Tao (57203993358)","57193339074; 59410875800; 35179226900; 57203993358","A multi-input lightweight convolutional neural network for breast cancer detection considering infrared thermography","2025","Expert Systems with Applications","263","","125738","","","","1","10.1016/j.eswa.2024.125738","https://www.scopus.com/inward/record.uri?eid=2-s2.0-85209135738&doi=10.1016%2fj.eswa.2024.125738&partnerID=40&md5=cfda7abb6cda956ec19bb9b9883d56ac","Article","Final","","Scopus","2-s2.0-85209135738"
"Zhou Q.; Zhang K.; Yue F.; Zhang Z.; Yu H.","Zhou, Qinbang (57194204110); Zhang, Kezhi (58162174000); Yue, Feng (58839119300); Zhang, Zhaoliang (58839119400); Yu, Hui (58838112900)","57194204110; 58162174000; 58839119300; 58839119400; 58838112900","Naming Conventions based Multi-Label Multi-Task Learning for Fine-Grained Classification","2024","Proceedings of SPIE - The International Society for Optical Engineering","12969","","129691D","","","","0","10.1117/12.3014589","https://www.scopus.com/inward/record.uri?eid=2-s2.0-85183044831&doi=10.1117%2f12.3014589&partnerID=40&md5=9b8821fac7083e528673e93a124aeb6f","Conference paper","Final","","Scopus","2-s2.0-85183044831"
"Lu H.; Dai Q.","Lu, Han (58261932800); Dai, Qun (35315440400)","58261932800; 35315440400","A self-supervised COVID-19 CT recognition system with multiple regularizations","2022","Computers in Biology and Medicine","150","","106149","","","","3","10.1016/j.compbiomed.2022.106149","https://www.scopus.com/inward/record.uri?eid=2-s2.0-85139341471&doi=10.1016%2fj.compbiomed.2022.106149&partnerID=40&md5=421860f61418c80a3218f88bf227eb55","Article","Final","All Open Access; Green Open Access","Scopus","2-s2.0-85139341471"
"Kim B.C.; Kim B.; Hyun Y.","Kim, Byung Chun (57204677482); Kim, Byungro (58977045600); Hyun, Yoonsuk (57225178208)","57204677482; 58977045600; 57225178208","Investigation of out-of-distribution detection across various models and training methodologies","2024","Neural Networks","175","","106288","","","","1","10.1016/j.neunet.2024.106288","https://www.scopus.com/inward/record.uri?eid=2-s2.0-85189861397&doi=10.1016%2fj.neunet.2024.106288&partnerID=40&md5=de010648be80df228dcf1ef23a3eb814","Article","Final","","Scopus","2-s2.0-85189861397"
"Zhu S.; Li X.; Wan G.; Wang H.; Shao S.; Shi P.","Zhu, Sisi (59001232200); Li, Xinyu (57826753600); Wan, Gang (59170878000); Wang, Hanren (59230426800); Shao, Shen (58020740400); Shi, Pengfei (57213385715)","59001232200; 57826753600; 59170878000; 59230426800; 58020740400; 57213385715","Underwater Dam Crack Image Classification Algorithm Based on Improved VanillaNet","2024","Symmetry","16","7","845","","","","1","10.3390/sym16070845","https://www.scopus.com/inward/record.uri?eid=2-s2.0-85199922217&doi=10.3390%2fsym16070845&partnerID=40&md5=7f085d00f93a7f6311d584c894444dae","Article","Final","All Open Access; Gold Open Access","Scopus","2-s2.0-85199922217"
"Xia R.; Du S.; Liu J.; Li C.","Xia, Runpeng (58560116100); Du, Sirui (58360860300); Liu, Jiahang (57459703700); Li, Chenjia (58601668000)","58560116100; 58360860300; 57459703700; 58601668000","A New Convolutional Neural Network Architecture for Mars Landmarks Classification Based on MobileNetV2","2023","2023 3rd IEEE International Conference on Software Engineering and Artificial Intelligence, SEAI 2023","","","","68","74","6","0","10.1109/SEAI59139.2023.10217391","https://www.scopus.com/inward/record.uri?eid=2-s2.0-85171556208&doi=10.1109%2fSEAI59139.2023.10217391&partnerID=40&md5=869a824a40de38a551d66325a835caa6","Conference paper","Final","","Scopus","2-s2.0-85171556208"
