"Authors","Author full names","Author(s) ID","Title","Year","Source title","Volume","Issue","Art. No.","Page start","Page end","Page count","Cited by","DOI","Link","Document Type","Publication Stage","Open Access","Source","EID"
"Maiti N.; Chawla R.; Quraishi A.; Soni M.; Rusho M.A.; Pande S.D.","Maiti, Niladri (57215721580); Chawla, Riddhi (57702146800); Quraishi, Aadam (58970508200); Soni, Mukesh (57202986134); Rusho, Maher Ali (59126288100); Pande, Sagar Dhanraj (57213160540)","57215721580; 57702146800; 58970508200; 57202986134; 59126288100; 57213160540","Generative Intelligence-Based Federated Learning Model for Brain Tumor Classification in Smart Health","2024","Generative Artificial Intelligence for Biomedical and Smart Health Informatics","","","","435","453","18","0","10.1002/9781394280735.ch22","https://www.scopus.com/inward/record.uri?eid=2-s2.0-85216007519&doi=10.1002%2f9781394280735.ch22&partnerID=40&md5=90e8b9a35dbff231bb236bd3147daf13","Book chapter","Final","","Scopus","2-s2.0-85216007519"
"Chen K.; Guan H.; Lei X.; Cao S.","Chen, Ke (58492109000); Guan, Haiyan (48260990900); Lei, Xiangda (57220548664); Cao, Shuang (54785876600)","58492109000; 48260990900; 57220548664; 54785876600","A Multispectral LiDAR Point Cloud Classification Method based on Enhanced Features Kernel Point Convolutional Network; [基于特征增强核点卷积网络的多光谱 LiDAR 点云分类方法]","2023","Journal of Geo-Information Science","25","5","","1075","1087","12","4","10.12082/dqxxkx.2023.220736","https://www.scopus.com/inward/record.uri?eid=2-s2.0-85165064717&doi=10.12082%2fdqxxkx.2023.220736&partnerID=40&md5=fdc208a7e21cf1a3fca0dbff2d9410b8","Article","Final","","Scopus","2-s2.0-85165064717"
"Murugesan B.; Liu B.; Galdran A.; Ayed I.B.; Dolz J.","Murugesan, Balamurali (57203838554); Liu, Bingyuan (57223910012); Galdran, Adrian (56451007600); Ayed, Ismail Ben (55663476500); Dolz, Jose (56578010400)","57203838554; 57223910012; 56451007600; 55663476500; 56578010400","Calibrating segmentation networks with margin-based label smoothing","2023","Medical Image Analysis","87","","102826","","","","15","10.1016/j.media.2023.102826","https://www.scopus.com/inward/record.uri?eid=2-s2.0-85154033725&doi=10.1016%2fj.media.2023.102826&partnerID=40&md5=cdbcbad71ce04f1eebc7f5550052c550","Article","Final","All Open Access; Green Open Access","Scopus","2-s2.0-85154033725"
"Anitha R.; Prabakaran P.","Anitha, R. (57192104713); Prabakaran, P. (58823990900)","57192104713; 58823990900","Vehicle Detection and Classification based on C-DSO Dataset using YOLO v3 with SRBD Method for Intelligent Transportation Applications","2023","2023 3rd International Conference on Advances in Electrical, Computing, Communication and Sustainable Technologies, ICAECT 2023","","","","","","","2","10.1109/ICAECT57570.2023.10117923","https://www.scopus.com/inward/record.uri?eid=2-s2.0-85160401675&doi=10.1109%2fICAECT57570.2023.10117923&partnerID=40&md5=467a233f238f8dac949d4bd5d0618386","Conference paper","Final","","Scopus","2-s2.0-85160401675"
"Pornvoraphat P.; Tiankanon K.; Pittayanon R.; Sunthornwetchapong P.; Vateekul P.; Rerknimitr R.","Pornvoraphat, Passin (58110077500); Tiankanon, Kasenee (57217862044); Pittayanon, Rapat (26538052600); Sunthornwetchapong, Phanukorn (58110030600); Vateekul, Peerapon (24829867400); Rerknimitr, Rungsun (6603607086)","58110077500; 57217862044; 26538052600; 58110030600; 24829867400; 6603607086","Real-time gastric intestinal metaplasia diagnosis tailored for bias and noisy-labeled data with multiple endoscopic imaging","2023","Computers in Biology and Medicine","154","","106582","","","","12","10.1016/j.compbiomed.2023.106582","https://www.scopus.com/inward/record.uri?eid=2-s2.0-85148479310&doi=10.1016%2fj.compbiomed.2023.106582&partnerID=40&md5=5c1e2c399d105085462eae1ec01288c1","Article","Final","","Scopus","2-s2.0-85148479310"
"Yao J.; Guo Z.; Yu W.","Yao, Jun (57907870300); Guo, Zhilin (57907472600); Yu, Wei (57908066000)","57907870300; 57907472600; 57908066000","Enhanced deep residual network for bone classification and abnormality detection","2022","Medical Physics","49","11","","6914","6929","15","4","10.1002/mp.15966","https://www.scopus.com/inward/record.uri?eid=2-s2.0-85138759202&doi=10.1002%2fmp.15966&partnerID=40&md5=31d8851219d644b1f87e858343ebbd99","Article","Final","","Scopus","2-s2.0-85138759202"
"Li X.; Zhang M.; Guo H.","Li, Xin (57205503391); Zhang, Meiling (59279286000); Guo, Hubo (59281365500)","57205503391; 59279286000; 59281365500","Dual-Path Fault Diagnosis of Small Sample for Mechanical Systems Based on Multiple Attention Mechanisms","2024","IEEE Access","12","","","114538","114551","13","0","10.1109/ACCESS.2024.3444828","https://www.scopus.com/inward/record.uri?eid=2-s2.0-85201612720&doi=10.1109%2fACCESS.2024.3444828&partnerID=40&md5=c48b44c5f415fccbaaa3b7168e1e659d","Article","Final","All Open Access; Gold Open Access","Scopus","2-s2.0-85201612720"
"Huang H.; Liu Y.; Xiong Q.; Xing Y.; Du H.","Huang, Hong (57845176500); Liu, Yong (57194542795); Xiong, Qiuju (55758750500); Xing, Yuanxiu (36635097800); Du, Honglei (58498345000)","57845176500; 57194542795; 55758750500; 36635097800; 58498345000","A fatty liver diseases classification network based on adaptive coordination attention with label smoothing","2023","Biomedical Signal Processing and Control","86","","105267","","","","2","10.1016/j.bspc.2023.105267","https://www.scopus.com/inward/record.uri?eid=2-s2.0-85165360375&doi=10.1016%2fj.bspc.2023.105267&partnerID=40&md5=14789bc47be1afd533c0cefe8c56686d","Article","Final","","Scopus","2-s2.0-85165360375"
"Lee M.S.; Han S.W.","Lee, Min Seok (57271968800); Han, Sung Won (55487857400)","57271968800; 55487857400","DuETNet: Dual Encoder based Transfer Network for thoracic disease classification","2022","Pattern Recognition Letters","161","","","143","153","10","3","10.1016/j.patrec.2022.08.007","https://www.scopus.com/inward/record.uri?eid=2-s2.0-85136478713&doi=10.1016%2fj.patrec.2022.08.007&partnerID=40&md5=b7789871b65f1c2b567bdd6b2f2668ba","Article","Final","","Scopus","2-s2.0-85136478713"
"Shang C.; Zhao H.; Wang M.; Wang X.; Jiang Y.; Gao Q.","Shang, Cheng (57219555083); Zhao, Hongke (57218277654); Wang, MeiLi (55694491200); Wang, XiaoLong (55808034000); Jiang, Yu (55733627100); Gao, Qiang (57228348700)","57219555083; 57218277654; 55694491200; 55808034000; 55733627100; 57228348700","Individual identification of cashmere goats via method of fusion of multiple optimization","2023","Computer Animation and Virtual Worlds","34","2","e2048","","","","4","10.1002/cav.2048","https://www.scopus.com/inward/record.uri?eid=2-s2.0-85129172836&doi=10.1002%2fcav.2048&partnerID=40&md5=b80a14a3e172f89fb967557969478968","Article","Final","","Scopus","2-s2.0-85129172836"
"Park S.; Kim J.; Heo Y.S.","Park, Sangyong (57218547297); Kim, Jaeseon (57213518379); Heo, Yong Seok (57201765185)","57218547297; 57213518379; 57201765185","Semantic Segmentation Using Pixel-Wise Adaptive Label Smoothing via Self-Knowledge Distillation for Limited Labeling Data","2022","Sensors","22","7","2623","","","","5","10.3390/s22072623","https://www.scopus.com/inward/record.uri?eid=2-s2.0-85127161198&doi=10.3390%2fs22072623&partnerID=40&md5=deb4184de904e78f7bd6f5344c430a93","Article","Final","All Open Access; Gold Open Access; Green Open Access","Scopus","2-s2.0-85127161198"
"Dai H.; Hao X.-T.; Sheng L.-J.; Miao Q.-G.","Dai, Hong (57255620200); Hao, Xuan-Ting (57274957700); Sheng, Li-Jie (36807485400); Miao, Qi-Guang (9133503300)","57255620200; 57274957700; 36807485400; 9133503300","Domain Adaptation Algorithm for Few-Shot Classification Task; [面向小样本约束的域适应分类算法]","2022","Jisuanji Xuebao/Chinese Journal of Computers","45","5","","935","950","15","2","10.11897/SP.J.1016.2022.00935","https://www.scopus.com/inward/record.uri?eid=2-s2.0-85129460181&doi=10.11897%2fSP.J.1016.2022.00935&partnerID=40&md5=22590587ef3f35516c6b46c88f8c13a0","Article","Final","","Scopus","2-s2.0-85129460181"
"Arora M.; Davis C.M.; Gowda N.R.; Foster D.G.; Mondal A.; Coopersmith C.M.; Kamaleswaran R.","Arora, Mehak (57213649721); Davis, Carolyn M. (57369278000); Gowda, Niraj R. (57211480217); Foster, Dennis G. (58551674000); Mondal, Angana (58551900000); Coopersmith, Craig M. (7004094284); Kamaleswaran, Rishikesan (35761072500)","57213649721; 57369278000; 57211480217; 58551674000; 58551900000; 7004094284; 35761072500","Uncertainty-Aware Convolutional Neural Network for Identifying Bilateral Opacities on Chest X-rays: A Tool to Aid Diagnosis of Acute Respiratory Distress Syndrome","2023","Bioengineering","10","8","946","","","","3","10.3390/bioengineering10080946","https://www.scopus.com/inward/record.uri?eid=2-s2.0-85168857288&doi=10.3390%2fbioengineering10080946&partnerID=40&md5=a2a9270f31ac4d752ed1746a18c70843","Article","Final","All Open Access; Gold Open Access; Green Open Access","Scopus","2-s2.0-85168857288"
"Wang Z.; Cheng Y.; Peng H.; Zhou H.; Wang Z.; Liu H.","Wang, Zhifei (59454391500); Cheng, Yige (59454391600); Peng, Hui (59453864600); Zhou, Huiqiang (59453467200); Wang, Zheng (59453730900); Liu, Hongquan (59453864700)","59454391500; 59454391600; 59453864600; 59453467200; 59453730900; 59453864700","In-Cabin Detection, Localization and Classification based on mmWave Radar with TinyML","2024","2024 21st European Radar Conference, EuRAD 2024","","","","392","395","3","0","10.23919/EuRAD61604.2024.10734950","https://www.scopus.com/inward/record.uri?eid=2-s2.0-85210889424&doi=10.23919%2fEuRAD61604.2024.10734950&partnerID=40&md5=738126b6d4506b6368ba9c12f049226a","Conference paper","Final","","Scopus","2-s2.0-85210889424"
"Liu B.; Rony J.; Galdran A.; Dolz J.; Ayed I.B.","Liu, Bingyuan (57223910012); Rony, Jérôme (57204558490); Galdran, Adrian (56451007600); Dolz, Jose (56578010400); Ayed, Ismail Ben (55663476500)","57223910012; 57204558490; 56451007600; 56578010400; 55663476500","Class Adaptive Network Calibration","2023","Proceedings of the IEEE Computer Society Conference on Computer Vision and Pattern Recognition","2023-June","","","16070","16079","9","6","10.1109/CVPR52729.2023.01542","https://www.scopus.com/inward/record.uri?eid=2-s2.0-85173947170&doi=10.1109%2fCVPR52729.2023.01542&partnerID=40&md5=3be59fcb9a60984343b98c6d52f10b72","Conference paper","Final","All Open Access; Green Open Access","Scopus","2-s2.0-85173947170"
"Fang S.; Mu L.; Jia S.; Liu K.; Liu D.","Fang, Shibiao (53879784500); Mu, Lin (15071932700); Jia, Sen (7202859948); Liu, Kuan (57658897800); Liu, Darong (57216038543)","53879784500; 15071932700; 7202859948; 57658897800; 57216038543","Research on sunken & submerged oil detection and its behavior process under the action of breaking waves based on YOLO v4 algorithm","2022","Marine Pollution Bulletin","179","","113682","","","","6","10.1016/j.marpolbul.2022.113682","https://www.scopus.com/inward/record.uri?eid=2-s2.0-85129327928&doi=10.1016%2fj.marpolbul.2022.113682&partnerID=40&md5=1a5104a15af719171d81f3375595f038","Article","Final","","Scopus","2-s2.0-85129327928"
"Lv L.; Peng M.; Wang X.; Wu Y.","Lv, Linquan (57994827000); Peng, Mengle (57240758900); Wang, Xuefeng (57900032000); Wu, Yuanjun (57994209200)","57994827000; 57240758900; 57900032000; 57994209200","Multi-scale information fusion network with label smoothing strategy for corneal ulcer classification in slit lamp images","2022","Frontiers in Neuroscience","16","","993234","","","","8","10.3389/fnins.2022.993234","https://www.scopus.com/inward/record.uri?eid=2-s2.0-85143438421&doi=10.3389%2ffnins.2022.993234&partnerID=40&md5=df95203ff8fed9f92c28013ee890d456","Article","Final","All Open Access; Gold Open Access; Green Open Access","Scopus","2-s2.0-85143438421"
"Guo X.; Yang Y.; Ye C.; Cai G.; Ma T.","Guo, Xutao (57214740038); Yang, Yanwu (57196195779); Ye, Chenfei (56369884700); Cai, Guoqing (57405548300); Ma, Ting (57194030386)","57214740038; 57196195779; 56369884700; 57405548300; 57194030386","CALSEG: IMPROVING CALIBRATION OF MEDICAL IMAGE SEGMENTATION VIA VARIATIONAL LABEL SMOOTHING","2024","ICASSP, IEEE International Conference on Acoustics, Speech and Signal Processing - Proceedings","","","","1601","1605","4","2","10.1109/ICASSP48485.2024.10446030","https://www.scopus.com/inward/record.uri?eid=2-s2.0-85195372992&doi=10.1109%2fICASSP48485.2024.10446030&partnerID=40&md5=9ed6564f95f26218bb06d2a89efec703","Conference paper","Final","","Scopus","2-s2.0-85195372992"
"Han A.; Zhang Y.; Li A.; Li C.; Zhao F.; Dong Q.; Liu Y.; Shen X.; Yan S.; Zhou S.","Han, Aifu (57211937579); Zhang, Yongze (57190019716); Li, Ajuan (57216805852); Li, Changjin (57219309967); Zhao, Fengying (57210804493); Dong, Qiujie (57215079044); Liu, Yanting (57214336739); Shen, Ximei (55450893000); Yan, Sunjie (24280901600); Zhou, Shengzong (57211940590)","57211937579; 57190019716; 57216805852; 57219309967; 57210804493; 57215079044; 57214336739; 55450893000; 24280901600; 57211940590","Deep Learning Methods for Real-time Detection and Analysis of Wagner Ulcer Classification System","2022","Proceedings - 2022 International Conference on Computer Applications Technology, CCAT 2022","","","","11","21","10","2","10.1109/CCAT56798.2022.00010","https://www.scopus.com/inward/record.uri?eid=2-s2.0-85147324477&doi=10.1109%2fCCAT56798.2022.00010&partnerID=40&md5=5e2c1348f2737c4e115462caf69074d9","Conference paper","Final","All Open Access; Green Open Access","Scopus","2-s2.0-85147324477"
"Vijayan M.; Prasad D.K.; Srinivasan V.","Vijayan, Midhula (58122462100); Prasad, Deepthi Keshav (57204111003); Srinivasan, Venkatakrishnan (59118800200)","58122462100; 57204111003; 59118800200","Advancing Glaucoma Diagnosis: Employing Confidence-Calibrated Label Smoothing Loss for Model Calibration","2024","Ophthalmology Science","4","6","100555","","","","1","10.1016/j.xops.2024.100555","https://www.scopus.com/inward/record.uri?eid=2-s2.0-85201374461&doi=10.1016%2fj.xops.2024.100555&partnerID=40&md5=97f2e08d78d734254733114c55861724","Article","Final","All Open Access; Green Open Access","Scopus","2-s2.0-85201374461"
"Jiang L.; Zhu S.; Sun N.","Jiang, Liang (58848200100); Zhu, Sicheng (59173751100); Sun, Ning (58278318800)","58848200100; 59173751100; 58278318800","An Improved Lightweight Variant of EfficientNetV2 Coupled With Sensor Fusion and Transfer Learning Techniques for Motor Fault Diagnosis","2024","IEEE Access","12","","","84470","84487","17","0","10.1109/ACCESS.2024.3412050","https://www.scopus.com/inward/record.uri?eid=2-s2.0-85196069817&doi=10.1109%2fACCESS.2024.3412050&partnerID=40&md5=45357036fe54d857d1c9fbf88f1f2cbe","Article","Final","All Open Access; Gold Open Access","Scopus","2-s2.0-85196069817"
"Liu L.; Wang Y.; Peng J.; Zhang L.","Liu, Li (57202047220); Wang, Yuebin (55986579100); Peng, Junhuan (12785442100); Zhang, Liqiang (36064917000)","57202047220; 55986579100; 12785442100; 36064917000","GLR-CNN: CNN-Based Framework With Global Latent Relationship Embedding for High-Resolution Remote Sensing Image Scene Classification","2024","IEEE Transactions on Geoscience and Remote Sensing","62","","5633913","","","","5","10.1109/TGRS.2024.3434452","https://www.scopus.com/inward/record.uri?eid=2-s2.0-85200207410&doi=10.1109%2fTGRS.2024.3434452&partnerID=40&md5=99742e04cbf43918babea578f9cee190","Article","Final","","Scopus","2-s2.0-85200207410"
"Xiao P.; Gou P.; Wang B.; Deng E.; Zhao P.","Xiao, Peng (57221193160); Gou, Pan (58044844600); Wang, Bintao (57222621092); Deng, Erqiang (57222097331); Zhao, Pengbiao (57223085740)","57221193160; 58044844600; 57222621092; 57222097331; 57223085740","Fine-Grained Gastrointestinal Endoscopy Image Categorization","2022","ACM International Conference Proceeding Series","","","","239","242","3","1","10.1145/3570773.3570836","https://www.scopus.com/inward/record.uri?eid=2-s2.0-85145772796&doi=10.1145%2f3570773.3570836&partnerID=40&md5=b68245936b99ba34768d77f38ab69384","Conference paper","Final","","Scopus","2-s2.0-85145772796"
"Kaloi M.A.; Ali A.; Babar I.A.; Mujeeb K.","Kaloi, Mumtaz A. (57204178309); Ali, Asif (57216791220); Babar, Irfan Ali (57195303982); Mujeeb, Kashif (58243419800)","57204178309; 57216791220; 57195303982; 58243419800","Label Smoothing Loss with Dual-Stream Network Using Separable Convolutional Layers for Retinopathy Grading and Classification","2023","2023 4th International Conference on Computing, Mathematics and Engineering Technologies: Sustainable Technologies for Socio-Economic Development, iCoMET 2023","","","","","","","1","10.1109/iCoMET57998.2023.10099097","https://www.scopus.com/inward/record.uri?eid=2-s2.0-85158924895&doi=10.1109%2fiCoMET57998.2023.10099097&partnerID=40&md5=4b1698d432d77e6b1fe58bc63bd01741","Conference paper","Final","","Scopus","2-s2.0-85158924895"
"Pham V.; Nguyen D.; Donan C.","Pham, Vung (57210934430); Nguyen, Du (57224876443); Donan, Christopher (57985869500)","57210934430; 57224876443; 57985869500","Road Damage Detection and Classification with YOLOv7","2022","Proceedings - 2022 IEEE International Conference on Big Data, Big Data 2022","","","","6416","6423","7","32","10.1109/BigData55660.2022.10020856","https://www.scopus.com/inward/record.uri?eid=2-s2.0-85147903287&doi=10.1109%2fBigData55660.2022.10020856&partnerID=40&md5=7946c80fb013236e405c807fe6a5157f","Conference paper","Final","","Scopus","2-s2.0-85147903287"
"Murugesan B.; Adiga Vasudeva S.; Liu B.; Lombaert H.; Ben Ayed I.; Dolz J.","Murugesan, Balamurali (57203838554); Adiga Vasudeva, Sukesh (57219751851); Liu, Bingyuan (57223910012); Lombaert, Herve (36350957600); Ben Ayed, Ismail (55663476500); Dolz, Jose (56578010400)","57203838554; 57219751851; 57223910012; 36350957600; 55663476500; 56578010400","Neighbor-aware calibration of segmentation networks with penalty-based constraints","2025","Medical Image Analysis","101","","103501","","","","0","10.1016/j.media.2025.103501","https://www.scopus.com/inward/record.uri?eid=2-s2.0-85217960784&doi=10.1016%2fj.media.2025.103501&partnerID=40&md5=c47423e9e852db12c2588a4fcb0ebd68","Article","Final","All Open Access; Green Open Access","Scopus","2-s2.0-85217960784"
"Wang L.; Wang J.; Zhang X.; Wang L.; Qin F.","Wang, Lijun (57225187087); Wang, Jiayao (57115582100); Zhang, Xiwang (35294522400); Wang, Laigang (36699074600); Qin, Fen (8238463300)","57225187087; 57115582100; 35294522400; 36699074600; 8238463300","Deep segmentation and classification of complex crops using multi-feature satellite imagery","2022","Computers and Electronics in Agriculture","200","","107249","","","","25","10.1016/j.compag.2022.107249","https://www.scopus.com/inward/record.uri?eid=2-s2.0-85135387564&doi=10.1016%2fj.compag.2022.107249&partnerID=40&md5=6874dd3aee6f0197c7f533bbd1a96e0f","Article","Final","","Scopus","2-s2.0-85135387564"
"Al Noumah W.; Jafar A.; Al Joumaa K.","Al Noumah, William (57410802800); Jafar, Assef (57206663030); Al Joumaa, Kadan (37041195300)","57410802800; 57206663030; 37041195300","Using parallel pre-trained types of DCNN model to predict breast cancer with color normalization","2022","BMC Research Notes","15","1","14","","","","7","10.1186/s13104-021-05902-3","https://www.scopus.com/inward/record.uri?eid=2-s2.0-85122764379&doi=10.1186%2fs13104-021-05902-3&partnerID=40&md5=0dbfde1bf5a6bd34795eb29c27ac4f1e","Article","Final","All Open Access; Gold Open Access; Green Open Access","Scopus","2-s2.0-85122764379"
"Li X.; Wang J.; Jing L.","Li, Xiaomeng (58657845000); Wang, Jiaqi (58855359600); Jing, Liping (8893085600)","58657845000; 58855359600; 8893085600","Interpretable Image Recognition by Screening Class-Specific and Class-Shared Prototypes","2023","Lecture Notes in Computer Science (including subseries Lecture Notes in Artificial Intelligence and Lecture Notes in Bioinformatics)","14255 LNCS","","","397","408","11","0","10.1007/978-3-031-44210-0_32","https://www.scopus.com/inward/record.uri?eid=2-s2.0-85174589669&doi=10.1007%2f978-3-031-44210-0_32&partnerID=40&md5=83c8c55d21be6c2114bb372ee0048979","Conference paper","Final","","Scopus","2-s2.0-85174589669"
"Durrani N.; Vukovic D.; van der Burgt J.; Antico M.; van Sloun R.J.G.; Canty D.; Steffens M.; Wang A.; Royse A.; Royse C.; Haji K.; Dowling J.; Chetty G.; Fontanarosa D.","Durrani, Nabeel (57745131100); Vukovic, Damjan (57213829810); van der Burgt, Jeroen (57222254949); Antico, Maria (57207455135); van Sloun, Ruud J. G. (56052857600); Canty, David (6601908434); Steffens, Marian (57801435500); Wang, Andrew (57219658329); Royse, Alistair (7003631520); Royse, Colin (7004623917); Haji, Kavi (36542482600); Dowling, Jason (57210097371); Chetty, Girija (14008859700); Fontanarosa, Davide (17433992600)","57745131100; 57213829810; 57222254949; 57207455135; 56052857600; 6601908434; 57801435500; 57219658329; 7003631520; 7004623917; 36542482600; 57210097371; 14008859700; 17433992600","Automatic deep learning-based consolidation/collapse classification in lung ultrasound images for COVID-19 induced pneumonia","2022","Scientific Reports","12","1","17581","","","","6","10.1038/s41598-022-22196-y","https://www.scopus.com/inward/record.uri?eid=2-s2.0-85140236007&doi=10.1038%2fs41598-022-22196-y&partnerID=40&md5=4db17ca5d55c7014b17e634397170254","Article","Final","All Open Access; Gold Open Access; Green Open Access","Scopus","2-s2.0-85140236007"
"Bourlai T.; Rose J.; Mokalla S.R.; Zabin A.; Hornak L.; Nalty C.B.; Peri N.; Gleason J.; Castillo C.D.; Patel V.M.; Chellappa R.","Bourlai, Thirimachos (8850031300); Rose, Jacob (57197336287); Mokalla, Suha Reddy (57215273795); Zabin, Ananya (57222665888); Hornak, Lawrence (7003761759); Nalty, Christopher B. (58031307800); Peri, Neehar (57215780478); Gleason, Joshua (57208014152); Castillo, Carlos D. (56259959100); Patel, Vishal M. (56660008900); Chellappa, Rama (57203078416)","8850031300; 57197336287; 57215273795; 57222665888; 7003761759; 58031307800; 57215780478; 57208014152; 56259959100; 56660008900; 57203078416","Data and Algorithms for End-to-End Thermal Spectrum Face Verification","2024","IEEE Transactions on Biometrics, Behavior, and Identity Science","6","1","","1","14","13","3","10.1109/TBIOM.2023.3304999","https://www.scopus.com/inward/record.uri?eid=2-s2.0-85171538957&doi=10.1109%2fTBIOM.2023.3304999&partnerID=40&md5=ffdd17d204dab4a5cf6b9322ebdd9f72","Article","Final","","Scopus","2-s2.0-85171538957"
"Guo N.; Jiang M.; Wang D.; Jia Y.; Li K.; Zhang Y.; Wang M.; Luo J.","Guo, Ningbo (57217193772); Jiang, Mingyong (57223822156); Wang, Decheng (57209655296); Jia, Yutong (57222104276); Li, Kaitao (55662709400); Zhang, Yanan (57220483631); Wang, Mingdong (56517131400); Luo, Jiancheng (7404183561)","57217193772; 57223822156; 57209655296; 57222104276; 55662709400; 57220483631; 56517131400; 7404183561","PGNN-Net: Parallel Graph Neural Networks for Hyperspectral Image Classification Using Multiple Spatial-Spectral Features","2024","Remote Sensing","16","18","3531","","","","0","10.3390/rs16183531","https://www.scopus.com/inward/record.uri?eid=2-s2.0-85205244000&doi=10.3390%2frs16183531&partnerID=40&md5=4206d597182fa19caa17eef8738d84a3","Article","Final","All Open Access; Gold Open Access","Scopus","2-s2.0-85205244000"
"dos Santos C.F.G.; Papa J.P.","dos Santos, Claudio Filipi Gonçalves (57212002436); Papa, João Paulo (23397842300)","57212002436; 23397842300","Rethinking Regularization with Random Label Smoothing","2024","Neural Processing Letters","56","3","157","","","","0","10.1007/s11063-024-11579-z","https://www.scopus.com/inward/record.uri?eid=2-s2.0-85191656399&doi=10.1007%2fs11063-024-11579-z&partnerID=40&md5=a54a4c142ec3799f8ada35dc130bbead","Article","Final","","Scopus","2-s2.0-85191656399"
"Wan C.; Hua R.; Li K.; Hong X.; Fang D.; Yang W.","Wan, Cheng (23398892800); Hua, Rongrong (58128187500); Li, Kunke (57206858939); Hong, Xiangqian (57221724946); Fang, Dong (57201215164); Yang, Weihua (56070103200)","23398892800; 58128187500; 57206858939; 57221724946; 57201215164; 56070103200","Automatic Diagnosis of Different Types of Retinal Vein Occlusion Based on Fundus Images","2023","International Journal of Intelligent Systems","2023","","1587410","","","","4","10.1155/2023/1587410","https://www.scopus.com/inward/record.uri?eid=2-s2.0-85171834416&doi=10.1155%2f2023%2f1587410&partnerID=40&md5=440ee1343aa54897ab517cfbd5686a7b","Article","Final","All Open Access; Gold Open Access","Scopus","2-s2.0-85171834416"
"Karimi D.; Rollins C.K.; Velasco-Annis C.; Ouaalam A.; Gholipour A.","Karimi, Davood (23569991400); Rollins, Caitlin K. (56396436300); Velasco-Annis, Clemente (56520292900); Ouaalam, Abdelhakim (57193806383); Gholipour, Ali (57192251309)","23569991400; 56396436300; 56520292900; 57193806383; 57192251309","Learning to segment fetal brain tissue from noisy annotations","2023","Medical Image Analysis","85","","102731","","","","17","10.1016/j.media.2022.102731","https://www.scopus.com/inward/record.uri?eid=2-s2.0-85145980402&doi=10.1016%2fj.media.2022.102731&partnerID=40&md5=1f8cd6ff705fcf95cd2660d2862545dd","Article","Final","All Open Access; Bronze Open Access; Green Open Access","Scopus","2-s2.0-85145980402"
"Liu J.; Ye C.; Wang S.; Cui R.; Zhang J.; Zhang K.; Barnes N.","Liu, Jiawei (57223910143); Ye, Changkun (57938988600); Wang, Shan (57852784800); Cui, Ruikai (57220207482); Zhang, Jing (57196378491); Zhang, Kaihao (57190277075); Barnes, Nick (55515924300)","57223910143; 57938988600; 57852784800; 57220207482; 57196378491; 57190277075; 55515924300","Model Calibration in Dense Classification with Adaptive Label Perturbation","2023","Proceedings of the IEEE International Conference on Computer Vision","","","","1173","1184","11","1","10.1109/ICCV51070.2023.00114","https://www.scopus.com/inward/record.uri?eid=2-s2.0-85185879056&doi=10.1109%2fICCV51070.2023.00114&partnerID=40&md5=9faec8c7724e135770ab2a1c94a5685e","Conference paper","Final","","Scopus","2-s2.0-85185879056"
